"id","user_id","listing_review_id","review_content","review_time"
2224,63,2912030,"Facilis nihil voluptas. Deserunt veniam sunt consequatur nemo excepturi aut ut qui. Veritatis quia error possimus vero. Enim dolorem voluptatem fugit ut ut reprehenderit quisquam et distinctio. Porro ea sequi id facilis.Enim sint provident. Nemo nesciunt omnis. Et laborum est maxime. Autem aut porro voluptas. Rem at voluptatem amet a fugit tempore laborum et. Omnis sed officiis ea.","2018-08-20"
2225,76,2912030,"Tenetur dolorum a voluptas qui totam neque laudantium et ut. Totam et omnis et harum voluptas quo eos expedita. Voluptas dolor quia sit aut eum perspiciatis doloribus architecto eaque. Sed labore aut corporis reprehenderit sit quos quam sed. Saepe dolores quia. Animi consequuntur ab.Dolor qui voluptatem id consectetur cupiditate voluptatem. Quas a officiis voluptate occaecati ut. Vel minus iusto odio ut nulla tempore. Modi cumque sunt laboriosam nihil laboriosam. Modi eligendi et. Qui possimus molestiae unde.","2018-08-20"
2226,99,2912030,"Voluptatum doloremque enim nihil corrupti delectus. Est impedit illum. Similique cupiditate consequuntur dolorem dolores aut. Ipsam iure inventore ut velit optio nihil. Pariatur qui tempora sunt sed laborum optio est error. Et rerum est sed corrupti enim quo voluptas est nostrum.Nihil optio deleniti architecto et ducimus aperiam nisi. Repellat aut aliquid eaque culpa qui quos illo. Voluptas natus ut aut dolor omnis unde quo sit dolore.","2018-08-20"
2227,11,2912030,"Architecto quia aspernatur. Quia vel in commodi ex est dolorum. Nesciunt ullam eveniet doloribus.Accusantium eum et eos sint ut voluptates. Quidem placeat aperiam quisquam aspernatur ut necessitatibus dignissimos. Doloremque officiis ipsum ut laudantium ipsum explicabo saepe. Consequatur quis labore.","2018-08-20"
2228,85,2912030,"Eum neque voluptatibus ducimus. Autem minima beatae mollitia aliquam quasi. Deleniti reiciendis odio nesciunt doloribus corporis iste. Eligendi est eos. Ipsum id explicabo.Sapiente illo nam placeat odio suscipit. Consequatur distinctio ratione labore. Officiis perferendis deserunt alias quis quo rem aut.","2018-08-20"
2229,36,2912030,"Consequatur dicta non modi. Blanditiis dolor tempora asperiores quos totam impedit est consequatur. Cupiditate molestiae quisquam minus neque soluta ut. Consequatur aut sunt sed dignissimos cupiditate recusandae. Nihil similique officia alias laborum deleniti aut et et. Aliquid praesentium dicta quae itaque est sed vel adipisci.A illo magnam qui placeat impedit reiciendis ab. Ut aperiam et alias ipsum iusto. Reprehenderit culpa voluptate id. Consectetur eius impedit alias quo praesentium inventore. Est alias facere.","2018-08-20"
2230,85,2912030,"Aspernatur id dolorum voluptas. Repellat quisquam reprehenderit. Ab nobis omnis sint ab. Eaque laudantium iure rerum debitis libero impedit omnis nihil debitis. Sunt nulla tenetur optio maiores sint alias qui excepturi. Repellendus non eveniet dicta illum.Molestiae impedit laborum sapiente explicabo. Consequatur magnam voluptatem consequuntur eos necessitatibus consequatur dolorem. Deleniti quibusdam earum autem iste repellat omnis voluptatibus iusto. Doloremque atque cupiditate laboriosam accusantium quod porro quidem ad.","2018-08-20"
2231,16,2912030,"Velit reprehenderit qui tempore at est. Et ut et deserunt quia numquam in. Ipsum incidunt voluptas occaecati molestiae accusamus facilis illum rerum iste. Asperiores voluptatem minus est et nihil aut adipisci vel. Deleniti et necessitatibus laboriosam et vel voluptas enim.Vero vitae iure eligendi voluptas quo omnis rerum qui dolores. Non consequatur illo et dolores blanditiis velit aut quia. Quo placeat nostrum quibusdam. Ad quis quaerat a sit blanditiis. Sapiente aut et et. Sit omnis sequi.","2018-08-20"
2232,37,2912030,"Totam officiis est saepe quo autem aut qui. Veritatis natus ullam atque. Excepturi est voluptatem est minus sunt dolor velit.Rerum tempore aut aut eos iste et. Omnis eius at quo neque et sit ducimus provident. Quia blanditiis magni doloremque non perferendis deleniti aliquid. Sequi autem eligendi vitae fuga. Sit sit officia similique iusto suscipit.","2018-08-20"
2233,70,2912030,"Ut aut enim et quidem magni quaerat est iusto. Placeat et odit. A occaecati minima quos doloremque. Itaque vel facere a corrupti eum. Est culpa non voluptate porro aspernatur et aut. Rem eveniet enim odit quibusdam.Ipsam voluptas corrupti itaque. Qui possimus nihil debitis assumenda nihil. Assumenda modi consequatur molestias occaecati voluptas consectetur illo nulla. Ratione magnam ut itaque aspernatur et enim recusandae dolorum. Ea cupiditate dolore eos voluptatem et ducimus cum est qui.","2018-08-20"
2234,80,2912030,"Distinctio voluptas voluptatem quo voluptatibus qui distinctio officia laboriosam quisquam. Expedita neque laboriosam est deleniti consequatur. Ducimus et voluptatem qui dolores consectetur consequatur eius ut voluptatem. Velit eos voluptatem saepe fugiat amet possimus et facilis porro. Optio nihil esse.Est nam autem optio voluptatibus omnis nisi iure sunt. Aperiam molestias repudiandae natus labore voluptates. Provident officiis eos illo consequatur ea. Atque aut aliquid qui vel voluptatem quis qui deleniti. Iste aspernatur iusto.","2018-08-20"
2235,24,2912030,"Sed qui esse non voluptatem cupiditate rem. Sapiente id molestiae aut provident neque. Officia minima et iure aut quis blanditiis eveniet. Sequi est occaecati.Reiciendis blanditiis veniam recusandae. Nemo sit voluptatem ab. Tempora sunt dolores possimus neque accusamus iste. Ipsa modi in qui corporis.","2018-08-20"
2236,74,2912030,"Facere iste dolor. At aut sit est soluta voluptas aliquid cum pariatur. Voluptatem enim vero aliquid aut et. Voluptatem nisi eligendi quam omnis ipsam et delectus.Molestiae accusamus provident minus ut officia nihil. Eligendi corporis eligendi perferendis consectetur amet dolores. Quia omnis natus odio exercitationem impedit praesentium optio accusantium quaerat. Illum omnis totam.","2018-08-20"
2237,44,2912030,"Nam qui est quia nihil laborum sunt. Aut ratione exercitationem. Similique earum enim rerum mollitia asperiores autem. Excepturi quasi et natus ut beatae et eos voluptatem aut. Amet unde placeat corrupti aliquid quod eligendi. Repellendus ut suscipit qui sed dolorum quam.Sit dignissimos deleniti a ut quas voluptate. Est natus deleniti et ipsam impedit vitae totam odit repellendus. Quia corporis omnis unde vel maiores quae ipsum eum.","2018-08-20"
2238,58,2912030,"Delectus doloremque nisi iste soluta. Fugiat delectus dolores cum non. Corrupti veniam est ut et dicta. Dicta voluptatem aspernatur. Blanditiis rerum voluptas architecto molestiae numquam.Deleniti cupiditate eum sunt voluptas suscipit fuga deserunt facilis. Id quis dolor dolores a. Magnam labore ut error odit qui nostrum et aut. Laudantium blanditiis illum. Hic corrupti error dolorum id aut dignissimos. Illo aut doloremque quos.","2018-08-20"
2239,89,2912030,"Enim et tenetur ipsam rem sed. Laboriosam ab et quas nesciunt rerum sunt sit. Magni aut unde. Voluptatem incidunt quos. Voluptas et quibusdam quisquam rerum laudantium. Dolorum non suscipit et occaecati quo labore provident officia.Atque sit debitis illo accusantium ut esse rerum. Nihil voluptas sapiente dolorem reiciendis doloribus qui laboriosam qui. Officiis sapiente id est qui aperiam quis rem. Qui aspernatur consectetur aut.","2018-08-20"
2240,67,2912030,"Sed reprehenderit omnis est enim provident minus doloremque eos omnis. Aliquam dolorem hic soluta quis distinctio error nisi aut repudiandae. Consequuntur eos fugit. Doloremque ipsa est.Non repudiandae officia ut voluptatem dolores quaerat incidunt. Aut iusto id alias occaecati. Corrupti officia quae. Quisquam sit at et sed commodi. Qui sit rerum et enim ut quasi.","2018-08-20"
2241,30,2912030,"Beatae et et excepturi aliquam laboriosam vero. Pariatur nobis quidem alias. Consequatur eveniet aut dolorum praesentium nihil ea aut. Ut temporibus similique suscipit optio voluptates dolor autem molestiae. Ipsam rerum amet corrupti voluptas id.Qui totam in inventore sed unde. Quia sit suscipit consequuntur cum numquam praesentium. Impedit velit a fuga consequatur praesentium asperiores. Illum deleniti beatae necessitatibus sequi. Nesciunt nulla in voluptatibus itaque consequatur. Sint sequi qui est facere repudiandae nostrum velit.","2018-08-20"
2242,20,2912030,"Ducimus ut labore rerum consectetur. Libero fugit voluptatem ut est hic ut. Quia saepe ducimus esse repellendus nihil omnis culpa eius ut. Et sint soluta tenetur molestias qui dolores autem magnam. Laboriosam blanditiis veniam sit iste animi.Similique in aut aliquid non dignissimos doloribus ratione ipsa. Eligendi voluptatum iste. Ut consectetur ut id earum ab recusandae quas. Tenetur possimus incidunt molestias. Architecto vero ipsa et. Non provident quis sed ab assumenda rerum maiores repudiandae.","2018-08-20"
2243,36,2912030,"Aut eveniet modi. Error sunt dolorem nulla ea autem explicabo error. Quidem ratione et reprehenderit voluptatem aut. Et fugiat a eos. Non sequi laborum delectus accusamus a.Qui inventore aliquam. Repellendus itaque nihil hic tenetur. Ex itaque aperiam inventore. Voluptatem doloremque consequatur fuga non autem. Et in et ut ut laboriosam dolorum.","2018-08-20"
2244,81,2912030,"Dolor rerum ipsam. Atque aut aliquam. Minima porro omnis dolorem. Totam qui id dicta. Facilis earum dolor a est ipsum consequatur.Quibusdam qui labore corrupti reiciendis. Fugit voluptatem iusto consequatur molestias. Laborum atque et est earum sed. Placeat doloribus maxime voluptatem. Repudiandae repellendus perspiciatis accusantium et repellat. Accusantium sint est nulla eum voluptatem.","2018-08-20"
2245,5,2912030,"Sed est veritatis ad hic. Perferendis dolorum amet consequatur explicabo facere illum velit ipsa velit. Aut officia dignissimos rerum assumenda vero cupiditate ex. Accusantium sed eligendi qui suscipit est iure. Maxime aut sunt sapiente.Officia temporibus dignissimos molestiae. Et pariatur eos accusantium voluptatum aperiam possimus. Delectus iste ut corporis doloribus libero. Commodi rerum qui omnis. Repellat est nam enim sint. Consequuntur tempora cum consectetur voluptatibus.","2018-08-20"
2246,93,2912030,"Aspernatur est consequatur voluptatem nihil possimus amet sequi. Aut a ad veniam et quam enim aut temporibus. Quisquam deleniti corrupti eveniet distinctio delectus explicabo. Unde enim dicta non. Consequatur accusamus nihil fugiat possimus suscipit rerum vero rem. Earum porro et illum et maxime.Amet voluptate quia dolor. Consequatur voluptatem voluptas qui amet. Sed aut commodi ipsam voluptas sit et molestiae.","2018-08-20"
2247,39,2912030,"Saepe dolores quaerat aut et doloribus. Aut quia culpa. Quas odit sint.Nisi cumque voluptate. Qui velit consequatur quia nulla enim vero corrupti. Ut ut labore quidem perspiciatis.","2018-08-20"
2248,53,2912030,"Architecto sed placeat. Provident et aut vel eos est est. Minus animi sed facilis reprehenderit quod rem earum repellat molestiae. Aut maiores odit nisi minus.Neque esse et. Iusto ut saepe error. Exercitationem maiores praesentium nihil et ipsum officiis fuga. Nulla voluptatum omnis sequi suscipit architecto eveniet. Veniam doloribus suscipit omnis laboriosam officiis reiciendis est. Maxime quisquam est officiis accusantium eius impedit nulla.","2018-08-20"
2249,79,2912030,"Quos velit aut mollitia voluptatem sed. Minima expedita recusandae. Aut et nam sed soluta modi qui. Rerum voluptatum tempora maxime non eligendi et et magni. Voluptatum ipsum est dignissimos dolorum reiciendis.Architecto est nemo cum est officiis omnis magni quidem facilis. Id debitis a dolores molestiae voluptatem optio. Molestiae dolor repellendus consectetur id id quo reiciendis accusantium rerum.","2018-08-20"
2250,15,2912030,"Quam nemo velit et debitis nihil blanditiis aliquid. Aut neque ab quis. Assumenda vitae eveniet ab ad possimus ducimus repudiandae quos. Neque in id neque voluptas nam in laudantium vel occaecati. Necessitatibus numquam qui dignissimos facilis quaerat voluptas.Non aliquid sapiente ducimus non. Quia at et ipsum nesciunt. Illo laudantium vel veniam laboriosam sapiente sit sit. Consequatur sed voluptas eaque sit ratione quia. Dolore praesentium eius officiis qui aut vitae.","2018-08-20"
2251,10,2912030,"Maiores illum quae quas veniam nesciunt rerum error. Voluptas veritatis eos consectetur et ullam aperiam. Dolores odit est excepturi et illum libero eligendi voluptate. Distinctio sunt mollitia quisquam commodi praesentium amet ratione reiciendis voluptatem. Exercitationem corporis odit et est ut nam.Porro est ex. Maxime corporis et. Cupiditate maxime sit accusantium voluptas delectus tenetur enim dolorem. Sed ex rerum et aspernatur vero sed.","2018-08-20"
2252,50,2912030,"Id fugiat facere perspiciatis suscipit. Quibusdam blanditiis explicabo qui. Ducimus minima architecto id. Id magni enim asperiores quo. Impedit id numquam aut.Ut nulla voluptatem quia et asperiores. Et et neque dolore velit. Harum et ut enim nisi aut laboriosam nulla possimus. Molestiae nesciunt dolorum repudiandae nulla in ad debitis voluptatem.","2018-08-20"
2253,25,2912030,"Eum molestias itaque. Aut quae quo et ad. Ut aut porro ut sunt debitis. Nobis et quo magnam explicabo voluptatem blanditiis minus eligendi. Voluptas delectus inventore quod voluptatem qui deserunt. Consequatur rerum ipsum iure voluptatem ut id voluptatem.Et exercitationem nisi sapiente. Molestiae nobis voluptatem. Dolorem corrupti blanditiis autem. Nihil modi fugit iure. Omnis quia aut qui. Rerum eius rerum et quas quidem nulla consequatur ullam.","2018-08-20"
2254,34,2912030,"Atque quia doloremque itaque consequatur repellat aut enim qui provident. Suscipit quod blanditiis et ex in omnis optio sit. Doloremque molestiae aut distinctio quia assumenda consequuntur recusandae odit sit. Occaecati vel recusandae est. Perferendis dignissimos expedita asperiores.Qui doloribus rerum vitae maiores et suscipit nostrum. Officiis natus veritatis ea odit eum nostrum. Corporis est dolores voluptatem enim. Ut non ipsa. Ea odit quis dolores voluptatem. Minus id non sit quia.","2018-08-20"
2255,12,2912030,"Nobis harum voluptatem quaerat fugit. Cum quo sit corrupti vero doloribus ipsum vel. Neque et ipsam quo doloribus. Sed quia doloremque porro officiis facere et voluptatem omnis fugiat. Aut totam ut aut ad est suscipit aspernatur dolorem voluptas.Veritatis enim consequatur qui. Id doloremque tenetur totam. Voluptates assumenda aut qui nihil sint ipsam fuga qui.","2018-08-20"
2256,8,2912030,"In molestiae nulla repudiandae impedit. Quia omnis et tenetur. Veritatis ratione id sed. Adipisci fugit dolorum incidunt recusandae hic vitae distinctio beatae.Sed pariatur qui ipsam doloremque est ipsa nobis. Earum sed incidunt consequuntur quia. Nihil totam ut.","2018-08-20"
2257,12,2912030,"Ea mollitia odit error rerum ullam nulla magni facilis rerum. Magnam consequatur illum tempore laudantium nam natus eos nesciunt. Velit ut qui voluptatum vel omnis eligendi provident ipsum. Rem natus minima cumque repellat eos praesentium id hic. Temporibus minus suscipit aut atque enim sunt sequi voluptas dolorum.Ut a repudiandae in fugiat explicabo accusantium eveniet. Perspiciatis quam quisquam sint nostrum molestiae totam. Voluptatibus facilis totam. Cumque est quisquam quo. Aut rerum est. Nisi nemo est soluta consequatur aliquid voluptatem rerum repellendus.","2018-08-20"
2258,74,2912030,"Quia maxime eius. Expedita et ducimus harum doloremque non est voluptas autem consectetur. Et cum nihil laboriosam eligendi laboriosam cum ut. Ut itaque facere officia culpa vitae ipsum laboriosam ut. Qui ut et quibusdam dolorem ea magni et placeat. Numquam et aut aliquam repellat et accusamus optio vel.Similique veritatis perferendis nobis distinctio non ipsa. Ex vero consequatur. Voluptas velit ipsam. Nihil non eligendi explicabo voluptas tempore alias maxime. Enim magnam consequuntur non et ea. Qui nesciunt molestiae optio dignissimos esse rerum sed.","2018-08-20"
2259,43,2912030,"Deleniti quidem ipsum labore ab vitae sed voluptas dolorem accusantium. Quo qui et. Rerum aliquid eius doloribus.Est omnis aut quia quod debitis ea adipisci odit. Ducimus laboriosam neque ea aut quae commodi voluptas perferendis. Vero beatae eligendi doloremque provident sint quaerat minus dolores quae. Nisi tenetur sed id qui et fugit cum sit dolorem.","2018-08-20"
2260,24,2912030,"In facere numquam perspiciatis aut commodi quia beatae minima explicabo. Inventore sapiente ex porro debitis. Voluptatem est beatae. Laudantium temporibus odit et quia laboriosam recusandae. Officia et et facilis et minus. Hic inventore saepe optio occaecati praesentium et repellat vero vitae.Magnam sit possimus et fugiat. Ad sed iusto. Maxime labore praesentium et at qui qui enim. Et veritatis qui dolorem maiores blanditiis ea voluptatem laudantium sequi. Rerum debitis qui quo nesciunt unde eius nulla qui consequuntur. Voluptates molestiae quo velit similique iusto sapiente eum aut.","2018-08-20"
2261,89,2912030,"Itaque aut voluptatem quia quae voluptatem dolor eum ea. Quis omnis autem et aut officiis. Autem vel tenetur neque quo et enim quod est atque. Laudantium nam illum hic explicabo illo non vero est quam. Exercitationem eveniet et. Facere numquam totam porro aut.Sed nesciunt deserunt. Voluptates veritatis consequatur. Quidem eum doloremque sapiente. Culpa architecto dolor sapiente soluta at ut amet. Quos cum quis natus.","2018-08-20"
2262,1,2912030,"Nisi quas in rerum odit magni sed voluptas. Perspiciatis et laborum perspiciatis delectus ut ea. Voluptas consectetur est dolor cum et amet beatae inventore cum.Qui omnis ut fuga velit et quo laudantium. Quae qui iure debitis nemo. Cum eum rem aut sed sequi dicta est. Eum debitis vero quidem eius veritatis quas itaque voluptas voluptate. Et et rerum incidunt totam incidunt ex. Ut quia accusantium suscipit similique recusandae occaecati est eum maxime.","2018-08-20"
2263,83,2912030,"Voluptas voluptas vel consequatur et cum impedit at eveniet. Exercitationem ea impedit ut quas accusantium. Est suscipit ad maiores quo praesentium itaque officia explicabo. Sunt consequatur commodi iste. Magnam sed sint velit aliquam excepturi. Natus laudantium velit.Ea dicta nostrum et ipsa nihil ut sed. Est nesciunt at incidunt ut autem. Vero tempora natus non voluptatem quis ratione. Quia voluptatem omnis dolorem. Quasi rerum harum sint qui. Voluptatum voluptatem sit eum.","2018-08-20"
2264,57,2912030,"Illum voluptatem itaque numquam qui quaerat ea eum aperiam. Maxime perspiciatis et nemo id cupiditate accusamus pariatur sed sed. Repudiandae fugit sed sint quidem numquam sit. Autem animi ut fugiat qui. Rerum excepturi id. Quibusdam ex consequatur blanditiis error sunt culpa.Quam voluptatem illo ea culpa. Aut et repudiandae velit veniam deserunt quasi ut incidunt. Soluta deleniti ratione mollitia sed saepe id placeat eos. Quam labore nisi omnis voluptatem maiores error praesentium quam.","2018-08-20"
2265,37,2912030,"Quibusdam quo deserunt illum. Exercitationem ad dolor. Omnis esse dolores enim molestiae nostrum doloribus voluptate sunt. Ut molestiae ut ipsam dolor dolores nulla dicta aliquid.Velit laudantium quam ut. Possimus et neque occaecati quia non cum voluptas animi quia. Provident magnam beatae ratione est. Odio praesentium eligendi alias ratione qui. Sunt labore et quas aut laudantium quia accusantium.","2018-08-20"
2266,4,2912030,"Animi corrupti quam et doloribus tempore laboriosam. Iusto quia pariatur rerum quia accusantium cupiditate voluptas vel itaque. Temporibus beatae consequatur facilis nulla perferendis placeat et beatae. Dolorem repellat qui velit. Quae aut dolore sapiente.Soluta enim tenetur reprehenderit corrupti in dignissimos. Minus voluptatibus iste earum voluptatem et. Laudantium inventore vel ea.","2018-08-20"
2267,86,2912030,"Ab molestiae sit sunt error veniam molestiae. Voluptatem eum ullam repudiandae et voluptatem et necessitatibus in. Labore neque facere est fugit consectetur quae et. Vel sit a ipsum ut aut optio aspernatur. Commodi est molestiae occaecati in quaerat ipsum delectus. Tempora et est ipsa.Qui earum ducimus occaecati dolores. Aut officiis tempore. Mollitia ut neque. Dolores pariatur at ab ipsum doloremque. Maiores magnam nobis rem beatae vero et veniam facere voluptatum.","2018-08-20"
2268,53,2912030,"Animi omnis velit quis officia reiciendis non voluptates. Distinctio debitis consequatur. Itaque maxime dolor ut aliquid et consequatur.Voluptas id culpa incidunt. At eum ab ea quas molestiae sed in illum ab. Quis quos minus repudiandae occaecati voluptates quaerat.","2018-08-20"
2269,3,2912030,"Delectus est quia consequuntur repellat cum ullam corporis. Ullam doloribus consectetur rerum neque delectus consequuntur officia. Debitis sapiente assumenda quo nihil eligendi eos. Et non aut facilis nesciunt enim et perferendis neque eum.Sed sunt minus aut deserunt totam numquam ipsum. Sunt sit sed laboriosam omnis officiis. Rem tenetur itaque delectus veritatis distinctio tempore. Neque vero consequatur beatae quo. Modi esse non culpa qui quos sequi.","2018-08-20"
2270,18,2912030,"Dolor necessitatibus iste incidunt quibusdam quos quia. Fugiat molestias quo natus accusamus occaecati distinctio. Eius eos qui molestias facilis. Unde aut error aut sunt asperiores eum qui voluptates. Modi sapiente nesciunt officia. Incidunt vel at ea.Id velit consequuntur eius dolorem aut. Reprehenderit in fuga omnis ut et ut ipsum consequuntur. Inventore magni officiis placeat rerum. Voluptatem cupiditate animi quis pariatur voluptatem expedita est et. Nihil voluptas sint qui.","2018-08-20"
2271,77,2912030,"Vel ut repudiandae ut. Aliquam aspernatur tempora mollitia et omnis eveniet. Autem dolores nostrum tenetur non illum. Repellat consectetur a est ullam necessitatibus autem a sed. Rerum iste animi voluptatem maiores non fugiat nulla ea.Deserunt qui rerum officia nostrum aliquam. Iure ea quia qui eos corporis sed dignissimos ut enim. Itaque reprehenderit nesciunt quibusdam et est. Omnis minima sed. Et aut id asperiores numquam. Eveniet dolorem quo placeat reiciendis quae vero asperiores iste amet.","2018-08-20"
2272,92,2912030,"Modi dolorem esse. Dolor ab itaque sunt eaque beatae a rem voluptatibus blanditiis. Similique eum officia. Cumque aliquid aspernatur.Possimus natus voluptas non dolorem quasi explicabo omnis sed voluptatibus. Perferendis excepturi ipsam dolores expedita ipsum velit fugiat alias. Quia voluptates quisquam est. Delectus qui officiis voluptas mollitia dolores voluptate optio. Voluptate dolores quam itaque. Odio aut est ut facilis.","2018-08-20"
2273,54,2912030,"Eligendi minima necessitatibus iste quis mollitia ut aut incidunt. Labore et blanditiis. Dolor eius ea consectetur.Iusto et eius repellendus odit ut beatae. Qui consequatur hic temporibus. Animi nisi animi aut ut id est consequuntur facere aut. Sit ab quidem labore ut neque est. Cumque voluptatem deleniti. Sit sunt totam vero voluptas.","2018-08-20"
2274,64,2912030,"Unde repudiandae voluptatum earum aspernatur debitis ullam architecto aut. Numquam cupiditate est quisquam officiis possimus expedita quisquam. Earum et impedit minus rem.Non mollitia tempore. Cum omnis provident et. Est non quas et totam vel. Qui ut alias sint corrupti voluptas sunt explicabo rerum.","2018-08-20"
2275,3,2912030,"Perferendis ipsa molestiae sit. Eaque vel delectus ut corporis laboriosam. Minima repellendus necessitatibus quos.Quasi explicabo ipsam natus culpa tenetur. Reprehenderit rerum omnis quasi dolores. Saepe aut voluptatem. Nemo praesentium quos recusandae. Accusamus fugiat velit recusandae aliquid molestias saepe dolore sed dolor. Consectetur quibusdam ullam possimus excepturi.","2018-08-20"
2276,95,2912030,"Quas commodi dolorum blanditiis accusamus distinctio. Ipsum pariatur illum provident accusamus excepturi animi maiores minima odit. Aspernatur ipsam placeat. Similique neque dolores inventore sed sit dolores.Similique mollitia qui maiores incidunt error ducimus. Illo reprehenderit ut aliquam omnis voluptas ipsum qui minus. Ut qui sint ut hic. Totam nulla quasi perspiciatis explicabo aut ut pariatur.","2018-08-20"
2277,47,2912030,"Delectus et dolorem sit corporis. Et blanditiis voluptatem sit mollitia harum maiores dolorum debitis. Et aut ut voluptates tempore ea autem similique voluptatem. Qui qui consequatur qui. Autem dolor id eos nesciunt quae. Quis necessitatibus nihil voluptatum ea voluptates molestiae sunt.Consequatur cumque amet blanditiis. Voluptatem voluptatem error quo delectus qui. Similique voluptatibus et. Nobis ut voluptatem quo sit facilis.","2018-08-20"
2278,26,2912030,"Deserunt consequuntur qui aut libero. Vero odio delectus. Rerum debitis ut consectetur qui. Dolore quisquam totam.Rerum accusamus sit distinctio repellendus voluptates. Ipsa assumenda enim qui illum id et quo. Adipisci laudantium vel molestiae architecto quam sint provident et.","2018-08-20"
2279,99,2912030,"Quo labore nam voluptate nesciunt atque. Id voluptatibus non aut praesentium nobis sed ab error. Dolores tempore omnis quis fuga explicabo aperiam. Non expedita et nihil voluptatem et libero et molestias dolore. Molestias quia vitae ut sit repudiandae illum in voluptas culpa.Et totam totam et quos atque dolores tenetur. Voluptas labore ratione molestiae eligendi. Omnis doloribus dolores quod sint nisi libero. Architecto et quas. Dolore adipisci fuga aut vel eum consequatur quo ullam.","2018-08-20"
2280,54,2912030,"Velit aut rerum quis. Maiores quidem consequuntur doloribus aut perferendis ad quidem. Placeat natus sint id omnis consequatur cumque sit enim. Omnis et eum beatae exercitationem et iusto veniam. Ipsa nemo et harum dolor minima qui exercitationem.Nobis ut voluptatem vitae odit debitis nobis sunt. Hic quia voluptatem deleniti quos veniam illum. Vitae sunt ut consequatur est vel necessitatibus. Autem provident quia.","2018-08-20"
