"id","user_id","listing_review_id","review_content","review_time"
2576,59,2912034,"Laborum molestias ut error accusamus ea qui odio. Possimus esse quisquam totam repellat ipsa. Sit est iste dicta molestias nihil illum. Nobis neque velit earum. Non iure eos unde. Aperiam veritatis neque nulla tenetur.Et est repudiandae qui qui iusto corrupti qui non atque. Doloremque nulla voluptatum occaecati porro. Ullam non eveniet et omnis.","2018-08-20"
2577,12,2912034,"Officiis molestiae in quam aut fuga voluptatibus. Ab minus ratione et dolore suscipit id beatae. Sed enim est aut blanditiis alias culpa. Debitis dolores alias nihil quam possimus sequi. Iste laboriosam voluptatem non modi iusto. Voluptas aliquid dicta voluptatem alias consequuntur.Non delectus natus deleniti aut illum. Consectetur voluptatem porro et aliquid qui est. Explicabo nulla odit possimus id eum. Nostrum amet deserunt exercitationem velit et earum repudiandae aliquid accusamus.","2018-08-20"
2578,33,2912034,"Dolores non necessitatibus dolores. Consequatur magnam nesciunt aut vel enim voluptas maiores adipisci iusto. Architecto occaecati sit doloribus totam a. Maxime quo repellendus nihil rerum quis distinctio minima.Fugiat ullam quaerat tempora est quas nobis itaque qui aut. In veniam ipsa a aliquid velit enim qui et eos. Veniam velit fuga quisquam hic officiis debitis omnis error.","2018-08-20"
2579,57,2912034,"Numquam quia officia. Sit aliquam ut repellendus quia voluptatem consequatur incidunt. Repudiandae minima illo totam explicabo qui nihil perspiciatis aliquid. Sequi animi aperiam deserunt aut autem maiores libero.Modi velit sint expedita esse quibusdam excepturi qui eos. Et consequatur excepturi quis at. Asperiores ut voluptatibus debitis iure rem ipsum vitae. Excepturi qui iste ut molestias hic omnis et maiores. Mollitia quasi est natus. Aperiam ut rerum dolorem aut autem possimus soluta unde dicta.","2018-08-20"
2580,22,2912034,"Fuga voluptatibus tempore aut explicabo dicta. Ut sint dolores dignissimos doloremque. Adipisci voluptatem quidem aut itaque earum consectetur vel dolor. Itaque autem quia omnis voluptatibus.Perferendis voluptatem odit illo. Exercitationem quia quis delectus soluta doloremque. Aut maiores quibusdam ut vitae ipsam. Velit voluptatum quia optio quia inventore voluptatem officiis omnis ut. Ratione accusamus sed amet aut voluptas officia voluptas corporis sunt. Magni iste in repudiandae cumque hic eaque.","2018-08-20"
2581,79,2912034,"Et rerum velit omnis. Praesentium non excepturi possimus. Et consequatur quaerat aut non voluptas ipsa cupiditate et qui.Et quia est expedita quia eos aliquid harum. Dolores ducimus aut. Eos nihil nisi officiis. Aut facere qui voluptas autem. Quisquam voluptatum sequi aliquid quasi. Distinctio omnis veniam.","2018-08-20"
2582,67,2912034,"Accusamus quia maiores corrupti magni. Fugit in animi voluptatibus perspiciatis harum error dolorem. Sed natus asperiores eius molestiae id est voluptas ipsum maiores. Est aliquam sint repudiandae qui saepe qui.Incidunt debitis sapiente eaque excepturi et quae. Sed magnam reprehenderit sed omnis sint cumque corrupti laudantium sapiente. Voluptas in non distinctio quis tenetur veritatis maxime. Doloremque impedit porro consequatur ratione velit dolor cumque consectetur. Et et asperiores sint temporibus.","2018-08-20"
2583,16,2912034,"Ea vel expedita rerum dolores numquam blanditiis qui. Enim maxime officiis quia sunt. Unde accusantium qui et molestiae quaerat. Est voluptates placeat quae soluta placeat omnis dicta facilis earum.Iusto maxime qui aspernatur voluptatem est. Exercitationem alias fugiat. Nihil est molestiae a optio in expedita. Exercitationem molestiae porro vitae iste perferendis. Voluptatem voluptatum quia voluptatem corporis repellendus eveniet.","2018-08-20"
2584,34,2912034,"Molestiae voluptates quo blanditiis ut cumque quis quae rerum. Autem totam aut sed. Voluptas sunt laudantium iusto fuga necessitatibus et ipsam et architecto. Ad enim quibusdam saepe autem consequuntur cumque odit ipsam numquam.Aspernatur quia maxime quaerat beatae facere aut. Et amet qui nihil nesciunt ut. A non sunt aut dolores. Quo et rerum.","2018-08-20"
2585,47,2912034,"Corporis doloremque iure quos. In repellat veritatis dolores libero harum et quos. Eius nemo eligendi nobis eligendi et.Sit ut molestias vitae ratione rerum voluptate itaque quisquam. Rerum minima quasi distinctio occaecati cumque numquam. Rerum non incidunt.","2018-08-20"
2586,37,2912034,"Aspernatur veritatis sit dolores impedit. Similique ad nihil et sit nulla. Architecto tempora aut explicabo ipsam aliquid repellendus sunt. Consequatur omnis voluptate quis quibusdam et ab minima.Illum eos repellat exercitationem veniam ab tenetur tempore consectetur perspiciatis. Consequatur amet ex nobis distinctio et quam quia enim. Dolor aut officia magni. Quis incidunt quo voluptas libero ratione. Velit vero ea. Explicabo et alias voluptatem pariatur.","2018-08-20"
2587,30,2912034,"Quidem mollitia est. Eos accusamus qui dolorem. Maiores quae ullam veritatis laudantium provident dolore ipsa. Incidunt deserunt laborum perspiciatis. Soluta et omnis in ut ut quis earum. Aut assumenda aliquam animi voluptatibus at.Voluptates culpa porro eum totam omnis ex rerum deleniti. Quibusdam consectetur quia quis qui ut voluptatem quo saepe iste. Id cupiditate et cupiditate aut non sunt eos est.","2018-08-20"
2588,52,2912034,"Omnis iste voluptas sed magni aut dolores. Quos id a error illum molestias architecto itaque minus quod. Totam fugit quos repudiandae sit fugit enim. Id harum eum aut corporis eum a quidem veritatis odit.Voluptatem fugiat dicta temporibus qui. Est incidunt quas error rerum in sunt. Qui accusantium voluptas ex ratione explicabo velit incidunt sunt eum. Aliquam aspernatur cum esse eum et et sequi. Vel sed accusamus quasi.","2018-08-20"
2589,14,2912034,"Repellendus et est nam. Quia iure ad. A consequatur iste quibusdam. Et ab qui est dolore occaecati aperiam quia. Provident perspiciatis sequi inventore est non iusto asperiores sapiente velit.Tempora commodi sunt omnis. Sunt voluptate et. Quis ex sint. Ut praesentium provident. Deserunt ut in velit ea tempora aliquid a voluptatem rem. Atque nulla architecto repellat quasi.","2018-08-20"
2590,16,2912034,"Deserunt accusantium soluta nihil. Dignissimos deleniti nulla consequuntur nesciunt cum quia dignissimos. Sed dignissimos nihil nobis animi eius ducimus minima sit. Ut ab dolor nemo voluptas pariatur dolore temporibus mollitia. Rerum voluptatem ab distinctio asperiores commodi. Sed placeat odio minima est nemo laborum occaecati quisquam aut.Voluptatem temporibus voluptatibus consequuntur quas quod. Pariatur aliquam qui magni cum sed illo quod possimus et. Harum saepe est dolorem. Eveniet qui voluptatem. Quibusdam cupiditate et odit rerum nostrum qui. Non et aut dolore doloremque quia velit cumque occaecati perspiciatis.","2018-08-20"
2591,81,2912034,"Quidem ipsa necessitatibus. Est ducimus rerum quisquam ipsam rerum non qui at. Ab temporibus voluptatem voluptas nulla.Dolorem rerum et fugit nobis et. Aut consequuntur molestias quae. Nesciunt porro tempora vel rerum ex non. Ea aliquid dignissimos neque hic quia corrupti debitis. Odio dolores reiciendis quis voluptatibus et eum assumenda.","2018-08-20"
2592,23,2912034,"Eos rerum quas aperiam voluptas quos asperiores. Facilis enim hic omnis. Voluptatibus rerum aut sed et tempora rerum voluptatibus. Quae excepturi architecto ut non inventore ut. Delectus minus perferendis necessitatibus quibusdam accusamus provident sed.Quibusdam facilis veritatis. Amet aperiam fugit occaecati molestiae occaecati sint omnis sed. Ex atque nostrum et est maxime vitae rem autem. Dolorem quibusdam ut nam sit nesciunt qui voluptate. Est vero ad facere at consectetur.","2018-08-20"
2593,89,2912034,"Vel cumque quia neque. Doloribus sunt repellendus quia pariatur cupiditate quae fuga ut. Nisi harum culpa voluptas deleniti repellat tempora. Ipsam odit nulla iure ex ut cumque velit quibusdam.Nostrum dolor sint non tenetur alias est necessitatibus laudantium. Qui quia et sit cumque est voluptatibus. Explicabo eaque nisi ut iste autem. Itaque at laudantium. Natus suscipit magnam consequatur. Error magni similique quis aliquam earum sed temporibus non.","2018-08-20"
2594,17,2912034,"Sit vel molestiae voluptatem sit aut dicta sequi et praesentium. Quibusdam sit repellat. Atque culpa quam est et minus nobis. Impedit delectus itaque est.Ipsum iste sed et eius autem eum ad itaque eaque. Rerum laudantium atque perspiciatis nulla nihil eos saepe dolor est. Dolorem expedita et porro enim quia est ut. Voluptas eum nihil consequatur. Id et labore aut rerum ut voluptate in enim impedit.","2018-08-20"
2595,43,2912034,"Doloribus molestiae incidunt dolorem. Qui ut in eos. A autem delectus id aut ullam. Qui et ut voluptate consequatur rerum est placeat.Provident praesentium recusandae qui. Voluptatem sapiente expedita voluptas doloremque qui. Commodi temporibus dolor praesentium dolor perferendis repellendus. Eum sed architecto in.","2018-08-20"
2596,26,2912034,"Dolor vel culpa veniam. Mollitia omnis at doloremque ut odio quis nisi iste impedit. Vel dolores a velit quibusdam. Vitae explicabo et.Id expedita cum nisi quia et iste ut quos. Quidem dolores est quaerat nostrum rerum. Quis molestiae odit adipisci aspernatur. At qui sapiente asperiores ipsa voluptatem similique. Praesentium et alias eum. Repellat quia sed cupiditate sint tempora dolore debitis alias reprehenderit.","2018-08-20"
2597,13,2912034,"Facilis ut ex sint est corrupti. Unde sint qui. Eaque voluptatem facere quis vel sapiente cumque. Qui voluptatibus consequatur odio eius. Blanditiis sint dolorem vitae odio.Hic aliquam minus fugiat natus id. Est accusamus quisquam quia rerum dicta rerum libero labore cum. Nesciunt odio sed eum.","2018-08-20"
2598,93,2912034,"Repellat impedit laudantium. Est ullam sunt excepturi voluptas officia laborum. Laudantium nam odio ad placeat nostrum velit error minima voluptates.Est nihil reprehenderit aperiam quia eos autem hic. Autem est cumque quo aut aliquam et ut ex et. Culpa modi magni facilis tempore suscipit.","2018-08-20"
2599,1,2912034,"Ipsa commodi tenetur. Est quia animi. Deserunt velit maiores. Optio ducimus minima sunt quis ducimus veniam. Dolores qui ratione error non culpa perspiciatis similique rerum. Dolorem et libero occaecati illum recusandae soluta.Non et porro consequatur corrupti aut ducimus. Ratione quaerat ut aut omnis harum non ipsam. Aut eius temporibus laborum vitae beatae facilis eos officia rerum. Quam et architecto nihil accusantium similique veritatis numquam voluptatum molestiae. Ad dolorum accusamus aliquid similique ipsum amet quis quaerat id. Voluptate et molestiae voluptas quo velit nihil.","2018-08-20"
2600,77,2912034,"Repudiandae fuga omnis assumenda accusantium consequatur iusto sunt impedit repudiandae. Voluptatum totam tempora rerum officia vero illum aut laboriosam. Labore enim molestias quos ex itaque numquam. Distinctio dolor temporibus perferendis.Nam hic voluptatem dolores ab id. Accusamus quia eveniet nemo est. Vitae illum et recusandae qui esse qui perferendis. Iusto laborum numquam ad saepe aliquid. Qui dolor qui deleniti necessitatibus. Repudiandae rerum nulla fugiat.","2018-08-20"
2601,90,2912034,"Cum qui aperiam. Ut possimus illo nostrum rem et voluptatibus. Molestiae minus eum molestiae repellat quo animi quia culpa. Animi ut et voluptates quia voluptas et. Vero inventore iusto qui quos.Nemo dicta voluptatem tempore. Veritatis vel aut laboriosam est inventore deserunt at non aut. Nesciunt necessitatibus est aliquam sint dolorem. Voluptatem sint facilis sint commodi quis tempore vel.","2018-08-20"
2602,82,2912034,"Illo voluptas itaque ipsa odit. Voluptas qui enim. Nihil dolorem nisi quia est consequatur rem omnis enim similique. Et pariatur ut dignissimos dignissimos odit aut. Deleniti quo ea similique enim. Modi ut veritatis molestias omnis enim.Quaerat rerum voluptas minima soluta voluptas. Est qui dolor illo deserunt aut nulla laudantium. Et vel accusamus culpa voluptas.","2018-08-20"
2603,43,2912034,"Dignissimos voluptatem praesentium quae repellendus molestias vel minus. Esse quo sunt ea. Et voluptatem possimus nobis. Est corrupti voluptates non ut magni sequi nisi.Molestiae et sit pariatur consequatur et voluptatem totam. Nemo ad eius ut ad optio ut qui deserunt qui. Corporis consectetur officiis qui dolor in. Quod sunt corrupti sit possimus sit iusto a excepturi. Maxime tempora iste quibusdam harum quia assumenda magnam natus voluptates. Mollitia nesciunt quaerat aliquam assumenda mollitia ullam itaque.","2018-08-20"
2604,9,2912034,"Cupiditate alias qui sit quia minima quia. Fugiat suscipit quis eius architecto excepturi minima. Doloribus aliquam iusto consectetur id molestiae sint saepe nam. Eaque non temporibus ut dolorem. Necessitatibus ullam accusamus error ut. Id voluptas quae illo.Iure ut aut voluptates tempora voluptates. Similique soluta quaerat officiis et perspiciatis voluptate fugit id. Commodi provident fugit vitae. Aspernatur nihil rem qui deserunt dolorem mollitia id.","2018-08-20"
2605,54,2912034,"Doloremque velit doloribus quas officiis voluptatem. Dignissimos tempore temporibus. Laborum architecto illo non sequi fugit tempore quos reiciendis nihil.Sapiente rem cumque eos dolor eius aut. Autem velit et quia culpa. Ut perferendis modi quidem quas minus molestiae qui commodi. Aliquid porro nulla non. Non sit corporis adipisci.","2018-08-20"
2606,38,2912034,"Non ipsa quibusdam labore. Ipsam sit rerum. Maiores magnam tempora impedit aspernatur non et ex consequatur quo.Nihil dignissimos voluptates illo rerum dolorem. Aut voluptatem dolor minima omnis consequatur cum qui dolor. Quasi voluptates quia sed non quod dolorem minus repellat voluptatibus.","2018-08-20"
2607,41,2912034,"Eaque in cumque quod. Aliquid sint molestiae quasi officia odit in expedita non ea. Velit quo error. Temporibus consequuntur rem ratione quisquam voluptatibus. Amet maiores aut impedit velit perspiciatis ut nihil officiis. Et dolorum neque vel eaque eos.Deleniti sit maxime repudiandae dolores. Possimus veniam commodi quia illo cumque qui totam unde. Harum et veritatis quas expedita.","2018-08-20"
2608,88,2912034,"Quaerat repellendus tenetur. Nesciunt omnis ut natus quos blanditiis at fugiat. Est aperiam fugiat recusandae at dignissimos totam quae voluptatum distinctio. Aut eius eius sed harum incidunt aut.Modi tempore deleniti. Tempore dolores cupiditate adipisci error expedita. Rerum soluta iusto quidem et vitae officiis nemo suscipit. Aliquam atque est rerum veritatis quod consequatur sunt sit. Commodi dicta quas.","2018-08-20"
2609,87,2912035,"Ut qui iste consectetur error. Rerum quisquam accusantium veritatis rerum velit harum. Qui impedit maiores aliquid nobis adipisci odio et aliquid. Perspiciatis labore odit aut facilis explicabo eos. Quaerat modi et est magnam ducimus rem perspiciatis. Animi ullam voluptatem.Velit officia quibusdam dolores maxime est quasi in nemo. Qui eius nisi in atque et quia est commodi aperiam. Tempora exercitationem et quia aperiam qui et. Ea aliquid iusto. Repellat magnam officiis et adipisci voluptas modi ullam occaecati.","2018-08-20"
2610,49,2912035,"Qui est quis in. Vel earum sed molestiae sequi nihil. Odio et ea ut suscipit unde. Amet officia architecto ullam et sed aut.Aut tenetur ipsa tempore. Officia fugit qui provident et voluptatem amet iste. Consequatur sed quidem impedit magni nulla porro eum. Quam ratione quia fugiat blanditiis neque eveniet. Voluptatem magni architecto nostrum in rem cupiditate ut est.","2018-08-20"
2611,55,2912035,"Ducimus molestiae optio excepturi est quis dolore. Quis eveniet saepe officia modi quisquam sed. Quae repudiandae ipsam quia velit non rerum excepturi debitis. Dolore ratione deserunt illum quia.Beatae voluptas qui. Laboriosam aut possimus expedita iste. Quae nam quae voluptatem assumenda ex odit harum ut. Ea praesentium et porro.","2018-08-20"
2612,43,2912035,"Et vitae quae voluptatem et. Impedit consequatur sed iste id est et voluptatum dolor. Est voluptas officia aliquid dignissimos aut occaecati cupiditate adipisci pariatur.Vero et corrupti suscipit. Quisquam neque ullam maiores vitae ea odio qui impedit. Commodi explicabo voluptatem quia sint voluptatum dolorem.","2018-08-20"
2613,70,2912035,"Sequi aliquam sapiente qui architecto velit magnam. Ea repellat aperiam aut aspernatur quia sed natus. Ducimus laboriosam non odit et rerum.Repellendus vero harum. Aut ex reprehenderit doloremque porro qui ullam. Blanditiis mollitia odit qui. Voluptate tempora et ut saepe aperiam corrupti.","2018-08-20"
2614,66,2912035,"Dolorem quia quis at quam quod voluptatem. Laborum laudantium ratione qui incidunt consequuntur. Perferendis omnis provident blanditiis asperiores est non tempora facere natus. Maiores nihil necessitatibus sunt harum dolorum pariatur.Sit magni et facilis alias eligendi. Quia sed harum corporis. Ratione dicta non eveniet consequatur sed et. Dolor nulla velit a et deserunt pariatur architecto beatae. Quisquam voluptas cumque dolores nihil omnis ratione doloribus quam tempora.","2018-08-20"
2615,16,2912035,"Est ex velit. Quia libero consectetur occaecati eaque eos consequatur. Vero dolores eius.Nemo suscipit possimus doloremque molestias reprehenderit nemo eum nemo. Eveniet laboriosam ullam. Esse voluptas non velit qui aut dicta ad nobis.","2018-08-20"
2616,38,2912035,"Libero porro velit dolores. Et qui aut sunt magni voluptas aut. Id nam quidem nobis perferendis perspiciatis. Officia natus corrupti voluptas maiores praesentium tenetur quidem.Quia quo sequi eveniet delectus. Dolorem et quam consequatur omnis fugit nihil voluptatum repudiandae. Saepe distinctio temporibus molestiae.","2018-08-20"
2617,95,2912035,"Blanditiis itaque dignissimos quis. Dolorem consequuntur illo sequi ut asperiores ad molestias. Velit est voluptas. Sint exercitationem eos corrupti. Consequuntur quis numquam corporis. Deleniti non deleniti ea.Non magni placeat omnis earum qui sed eius. Autem sunt et minus dolorem eos expedita rerum. Ducimus velit non quidem illo mollitia eos.","2018-08-20"
2618,53,2912035,"Illo et voluptatem autem consequatur quia. Voluptas tempora ut ut ipsum provident. Possimus soluta quia voluptate. Delectus voluptas quia. Id sed voluptates nihil facilis recusandae delectus autem sunt. Nam non eligendi dolor possimus quis amet ut non at.Dolorum ex sint unde cum perspiciatis mollitia dolorum dolore ab. Sed consequatur nostrum quisquam modi minima est. Quae eius totam. Autem molestiae praesentium veritatis.","2018-08-20"
2619,27,2912035,"Ratione non eveniet eius ut consequatur velit est nesciunt minus. Repudiandae id quidem in fuga nisi. Labore dicta magnam ullam. In voluptatem recusandae et. Impedit est rerum. Dolor qui amet debitis quibusdam dolorem eos.Itaque deserunt iusto inventore numquam. Impedit amet dolorem. Aperiam reprehenderit commodi. Molestiae porro aliquid recusandae sint. Illo omnis ut adipisci ea omnis omnis reprehenderit iste.","2018-08-20"
2620,19,2912035,"Cupiditate quam animi corporis repudiandae voluptatem impedit ea. Dolor porro quis ipsum perspiciatis deserunt quidem ipsum qui quidem. Est neque aut et. Enim voluptatem et sed facilis soluta nulla. Dolor rerum commodi facilis. Est omnis qui.Laboriosam aut consequatur voluptates mollitia ut temporibus. Voluptatem quasi quos ut totam quis ut autem ab. Dicta et culpa consequatur corporis magni temporibus ex.","2018-08-20"
2621,19,2912035,"Aspernatur deleniti qui facilis dicta. Deleniti quidem earum similique facere reiciendis atque quia repudiandae. Corrupti ea labore pariatur et ipsam.Sit neque libero. Maxime dicta qui. Magni aut necessitatibus. Velit impedit vitae omnis qui assumenda rerum animi odio commodi. Fugit eos molestiae harum velit aliquam vel possimus laborum.","2018-08-20"
2622,47,2912035,"Eos nesciunt sint vitae non harum ut fugiat. Voluptatem magni aut doloremque sequi dolorem aut rerum. Dolores quaerat excepturi accusamus sint illo. Eaque ab dolorum aperiam quis et non neque.Fugiat dicta quo dolore dolorem quo. Voluptas ex possimus aliquid aut. Non ut laborum necessitatibus libero repellendus. Sunt earum qui rem laudantium dolorum eveniet voluptatem est.","2018-08-20"
2623,15,2912035,"Dolorem numquam consequatur. Corrupti fugiat hic aut explicabo mollitia et aliquam. Quo commodi pariatur expedita ipsam illum aut sit sunt optio. Et numquam assumenda quo reprehenderit ratione aut porro deserunt. Doloribus vel aliquid temporibus. Quis neque autem labore accusamus est incidunt ratione itaque ut.Aut voluptates porro et consequatur consectetur debitis. Natus molestiae quo. Voluptatem libero laudantium reiciendis ut. Et natus qui debitis saepe corporis doloribus officia est qui. Velit cumque ea consequuntur voluptas ipsam quaerat sapiente nesciunt ipsam.","2018-08-20"
2624,37,2912035,"Est et facere possimus et laboriosam ipsam in architecto alias. Autem voluptatum soluta. Consequatur nam veniam neque deserunt perferendis non repudiandae et deleniti.Itaque illo nesciunt vel hic necessitatibus dolor non quia sit. Deserunt numquam provident omnis nam corporis repudiandae autem reiciendis sunt. Voluptate dolorum nihil quidem excepturi tempore nostrum nemo. Et in quam vel velit quas qui odit. Aut dolores ut nihil hic nihil natus nihil exercitationem doloribus. Commodi fugiat laborum tempora iusto quidem ut.","2018-08-20"
2625,85,2912035,"Voluptatibus beatae numquam voluptas et accusantium vel. Culpa ex temporibus omnis modi. Praesentium quidem molestiae quam voluptatem accusantium. Sint cupiditate ipsam.Eligendi repellendus numquam est aut aut. Sint magnam voluptates vel saepe voluptas ab. Voluptatem veniam autem accusamus nulla itaque.","2018-08-20"
2626,21,2912035,"Minus quia qui odio beatae mollitia. Reprehenderit vel distinctio. Adipisci enim expedita rerum magni impedit non quisquam eius. Quidem optio delectus dignissimos sit aut aliquid esse eius eveniet. Et tempora numquam fugit.A velit voluptatem corrupti doloremque eligendi tempore. Quidem eum nobis id nihil voluptatem aut. Nostrum atque occaecati adipisci incidunt sunt non. Earum vel ex quisquam expedita voluptas. Consequatur delectus consequuntur nostrum qui molestiae magnam. Enim vel sequi officiis ipsam animi laboriosam accusantium.","2018-08-20"
2627,35,2912035,"Accusamus vitae maxime molestiae magnam accusamus. Inventore ea enim. Sit eveniet sunt consectetur laboriosam. Qui architecto minima voluptas quas aliquid nisi ab praesentium.Ratione dolorem praesentium ex est omnis id nisi. Quia occaecati delectus ducimus molestiae dolore ex qui eum. Cumque voluptatem dolorum velit harum. Et aliquid quia architecto consectetur ut et aperiam et.","2018-08-20"
2628,46,2912035,"Magni nam et delectus eveniet dolorem officiis. Deserunt nam ipsam quo ex. Repudiandae sed dolore aut ad in repellendus iure vitae quisquam. Quia iusto et. Dolorem sed sed aut natus quisquam reprehenderit rerum et. Veritatis quibusdam temporibus eligendi non ea corrupti quibusdam voluptatem in.Veniam fuga id sit. Doloribus eligendi est. Molestias sint nam sunt quo quos. Harum quisquam dolor et quia numquam culpa autem. Alias at eligendi et nam. Architecto et qui numquam quos voluptatibus illum voluptatibus non molestiae.","2018-08-20"
2629,4,2912035,"Nihil quo tempora. Fuga architecto ut voluptatem autem nesciunt sequi. Repellendus nesciunt tempore accusamus ipsam ut sed corporis rerum ullam. Quaerat qui iste ipsam rerum quaerat tempore. Repellat voluptas nam esse consequatur vel. Eligendi accusantium corporis tempore nisi aut quasi et.Eos voluptatem praesentium. Numquam voluptatum nam nam eligendi porro. Et et accusantium iusto earum laudantium illo repellat similique. Fugiat quaerat illo laboriosam voluptatem error est vitae impedit placeat. Qui voluptatem sunt quia explicabo.","2018-08-20"
2630,97,2912035,"Libero accusamus nesciunt voluptatem et. Ducimus et quos distinctio aut ab pariatur pariatur sint ducimus. Saepe placeat quas fugiat. Quis et odit consequuntur quaerat vitae voluptatem.Veritatis occaecati dolor voluptas molestiae est pariatur culpa alias. Incidunt voluptatem aliquam voluptatem ad odit nihil deserunt rerum voluptatem. Ad impedit unde perspiciatis quo nisi iure adipisci. Consequatur et magnam excepturi aliquam dolorem fugit nam expedita doloremque. Voluptatem reiciendis nesciunt.","2018-08-20"
2631,14,2912035,"Consequatur ut dolorem voluptatem eos qui quo. Ex odio est. Fugit rem temporibus adipisci debitis vitae vel. Sed cumque esse. Non amet sit deleniti dicta quisquam expedita corrupti assumenda.Quia doloremque iure repudiandae possimus debitis pariatur officia. Quia magnam maxime et sint corporis voluptatibus unde debitis. Eum aut sit ea nostrum corporis dignissimos neque assumenda non. Quam qui quod ut. Unde voluptatem fugit omnis ab molestias. Ducimus et voluptatem doloribus autem nemo eligendi qui.","2018-08-20"
2632,67,2912035,"Et voluptate quis esse. Quia blanditiis consequatur necessitatibus harum in asperiores hic. Deserunt earum maiores similique dolor iste placeat. Perferendis officiis deserunt dolores fuga consequatur veritatis et at. Maiores eos ut iusto animi eum vel et. Consequatur iusto illum.Optio facere nesciunt rerum ipsam illo minima dolorem quos qui. Quia rerum ut. Voluptatem voluptas accusamus iste. Quo at inventore non ad aliquam provident consequatur excepturi. Voluptatem impedit qui nihil. Et et sit aut sapiente praesentium.","2018-08-20"
2633,83,2912035,"Molestias recusandae aut dolores velit. Qui neque vel error veniam consequatur sint qui. Aut incidunt veritatis aut molestiae et ducimus nisi dolores. A quidem ex natus minus voluptatum eligendi quae aut iure.Harum vel fuga. Rem earum placeat saepe quis cum culpa corporis. Accusantium at dolorum reiciendis voluptas quidem.","2018-08-20"
