"id","user_id","listing_review_id","review_content","review_time"
2399,91,2912032,"Dolores provident sed ducimus dolor soluta qui velit. Nam qui et similique neque voluptas atque est et. Minima eaque vitae voluptas nostrum officiis in. Laboriosam accusamus dicta ut deleniti enim error sit fugiat ut. Aut aut provident at esse. Voluptatem et pariatur placeat est.Odio corporis excepturi consequatur magnam recusandae non. Similique animi quia ipsam. Explicabo sunt vel et itaque eos. Tempora maiores ducimus dicta autem itaque quos. Modi eius nihil non nam doloremque rerum in ratione voluptatem.","2018-08-20"
2400,33,2912032,"Incidunt aut ratione. Sit similique error incidunt quibusdam beatae aliquam. Eum aut reprehenderit doloremque id iste consectetur accusamus necessitatibus.Officiis voluptatem corrupti consequatur. Cupiditate id et vel placeat ea. Pariatur sunt alias qui aliquam aut ut nobis.","2018-08-20"
2401,92,2912032,"Voluptas vel beatae ad quia ullam labore dignissimos ea. Officia iure sed corrupti consequatur. Aut quisquam dolor dolorem nam repellendus ut voluptate qui. Facilis aspernatur a.Dolores dolorem porro quasi nam in suscipit sunt. Laudantium distinctio nesciunt. Rem aut qui.","2018-08-20"
2402,86,2912032,"Distinctio neque velit ut perspiciatis. Dolor quia exercitationem quas. Possimus impedit voluptatem et rerum et alias. Praesentium molestiae quia rem earum. Cumque perferendis et ullam minus recusandae velit illum. Eos at nihil nihil a animi et facilis dignissimos.Quia ducimus iure et. Alias totam ut consequuntur est qui quis nobis. Praesentium consequatur unde. Cupiditate voluptates reprehenderit similique voluptate expedita aut totam itaque.","2018-08-20"
2403,11,2912032,"Eos et ad accusantium perferendis voluptatem consequuntur. Ab ut ad. Voluptatum non magni labore et. Omnis quia error qui. Aliquam eaque autem. Aspernatur doloribus ut dignissimos.Deleniti minus illo itaque a dolor nemo sed. Et cumque distinctio et. Nihil unde eaque. Corrupti temporibus nihil dicta cumque et et nostrum. Pariatur voluptas aliquam aut et omnis atque nesciunt.","2018-08-20"
2404,80,2912032,"Perferendis necessitatibus id odit voluptatem magnam nisi qui aliquam alias. Provident eos cumque et laboriosam voluptate impedit possimus nesciunt ipsum. Consequatur esse quod nulla corrupti. Totam exercitationem dolor ullam et ut officia ipsum.Molestiae quidem id. Voluptatem dolorum nostrum harum aut error. Et facere illo quidem. Qui veritatis ex blanditiis non magni quia iure eaque beatae. Perspiciatis consequatur eligendi perferendis enim odio placeat. Aut voluptate natus ex.","2018-08-20"
2405,89,2912032,"Sit quibusdam tempora. Saepe unde qui. Impedit eligendi reprehenderit quasi maiores.Inventore optio et voluptatem voluptatem exercitationem est beatae iste. Et vel qui voluptatem tenetur expedita quaerat fugit. Qui distinctio expedita aut voluptatibus est nisi.","2018-08-20"
2406,89,2912032,"Omnis doloremque rerum. Rerum omnis eum et qui ea officia qui. Et tenetur labore assumenda perferendis. Modi qui officiis eum. Iure voluptates voluptatibus rem asperiores corrupti ratione. Qui qui autem dolorem et voluptas maxime culpa expedita.Dolorum hic vel aliquid. Similique eveniet sit sint veniam quibusdam error. Quo ipsam qui laudantium quam vel voluptatem. Ut est non nesciunt. In optio porro in voluptatem maxime molestiae aliquam sed fugiat.","2018-08-20"
2407,39,2912032,"Aperiam facere vero et aut rerum inventore. Eligendi fugiat ea qui dicta dicta qui consequatur sequi. Neque reprehenderit maiores iure quam dicta. Eveniet consequatur et aut impedit. Doloribus cupiditate veritatis ipsam eveniet enim nostrum est.Rerum voluptas qui. Et eum nihil beatae perspiciatis et reiciendis. Sit enim aut incidunt exercitationem. Eos hic aut aliquam nihil sunt.","2018-08-20"
2408,78,2912032,"Voluptas est error eligendi. Est ut illum maxime provident alias quia et aspernatur. Et placeat tempore esse dolores molestiae iste sed. Aliquid ipsam sit sed est qui. Occaecati eos dicta. Molestiae voluptatem quia molestiae cum quo consectetur veritatis.Fugit dicta eos nihil ea deserunt porro modi est ut. Animi perferendis qui aperiam minima fugiat eveniet modi. Ea optio alias quo incidunt est. Natus temporibus minima eum. Nihil ut harum quibusdam odit odio excepturi rerum.","2018-08-20"
2409,92,2912032,"Velit voluptatem mollitia dignissimos. Animi ducimus omnis velit illo vitae harum. Blanditiis at pariatur asperiores deserunt ab molestias quidem dignissimos. Sapiente voluptatem assumenda aut voluptatem odio eveniet mollitia. Aut velit nam. Beatae libero saepe sunt quibusdam repudiandae.Impedit aliquam numquam soluta. Consequatur sed eum asperiores. Qui rerum ut. Ad eligendi aut.","2018-08-20"
2410,63,2912032,"Numquam quis numquam veritatis distinctio dolorem ratione exercitationem. Quaerat provident omnis. Iste est velit quia sint harum omnis voluptatem officiis. Quis laboriosam dolorem harum ratione molestiae non impedit omnis qui.Sit deserunt accusantium itaque. Eius tempora ducimus aut earum. Iusto dolorem nihil aut veniam eum sapiente est. Qui officia porro qui nam dolores et neque quam. Dolores consequatur mollitia et aut cumque velit. Nihil molestiae nesciunt qui deserunt sit.","2018-08-20"
2411,51,2912032,"Et tempora ut fuga dolorem nostrum debitis. Quis est voluptatibus iste sapiente doloribus. Sint molestiae laboriosam animi nemo cumque. Et consequatur in ut adipisci. Voluptates laborum sequi consequatur debitis.Distinctio atque qui voluptatem. Consequatur qui in sunt et. Nostrum non ratione aspernatur. Odio quo aliquid tempora.","2018-08-20"
2412,4,2912032,"Voluptatem inventore inventore dolores officia fuga eveniet dolores pariatur cupiditate. Adipisci in sequi voluptatem quaerat beatae et eos aut. Molestiae voluptates aut sed officiis. Qui modi et aut a odit soluta et voluptatibus. Eaque pariatur id iure harum quas.Ut officiis molestiae similique reprehenderit vitae nulla. Non harum voluptatem odit est iure possimus. Quibusdam beatae magnam dolores quos natus doloremque tenetur fugit corporis. Quam id quas. Quasi a reprehenderit fuga consequatur iste alias ratione.","2018-08-20"
2413,35,2912032,"Pariatur in veritatis et esse sunt porro aspernatur. Natus possimus quidem labore aspernatur. Sapiente pariatur totam et fugit voluptate exercitationem dolores mollitia.Eius nobis sunt explicabo dolor sit molestiae dolor nihil. Sequi omnis neque. Odio eos enim sed iure. Eum est aut quis.","2018-08-20"
2414,92,2912032,"Ex quis fuga ut qui. Non optio quo. Voluptatum accusantium in molestiae. Molestiae earum tenetur quam quas eveniet atque corrupti. Mollitia delectus voluptatem.Aperiam consequuntur ea provident omnis et porro voluptatum et. Et facilis natus quasi dolorem voluptatem ut neque sit. Pariatur id deserunt eaque. Deleniti molestias libero nostrum officia omnis consequatur.","2018-08-20"
2415,93,2912032,"Consectetur optio dolor sint iusto magnam est placeat qui. Animi reiciendis quae asperiores doloremque. Voluptas et repudiandae asperiores. Laboriosam sed voluptatem cumque molestias.Asperiores asperiores magnam voluptas qui quis error et voluptas enim. Perferendis veniam eum. Cumque molestiae iste labore maxime iure itaque est. Omnis dicta sequi. Et ullam non cupiditate voluptatem quo. Est ipsum at sit numquam accusamus.","2018-08-20"
2416,81,2912032,"Et quia molestiae beatae officia doloremque tempora maxime provident. Suscipit quis ducimus minima rerum suscipit qui quasi voluptas molestiae. Dolor voluptas vel iure tempora asperiores exercitationem. Eaque libero quae velit est. Ipsam ratione earum quia.Sed cupiditate vel quia quisquam aut eius placeat quas. Minus voluptate veniam laborum est doloribus a. Necessitatibus consequatur suscipit velit aperiam maxime inventore quis odit.","2018-08-20"
2417,11,2912032,"Quasi cupiditate mollitia molestiae vel et eveniet est. Iste est aut dolores reiciendis dolores eos. Nobis adipisci voluptas in. Placeat porro incidunt a est laborum magnam. Ut rerum nihil quidem repudiandae non consequuntur magnam ea deleniti. Aliquam atque aliquam.Aut laudantium porro iste non ipsum. Et tempora omnis eveniet aliquam et nemo veritatis labore nihil. Facere id quaerat nostrum. Non pariatur sapiente et. Impedit quia ea dolore et ipsam dolores quis fugiat.","2018-08-20"
2418,71,2912032,"Possimus voluptatum et amet et vitae et. Voluptatem numquam aut tempore harum. Ad dignissimos sunt qui praesentium similique. Amet ratione sed et consequatur quia animi culpa at. Quo eos aperiam nisi et ut facere. Rerum recusandae quisquam ex asperiores ut optio pariatur ducimus.Deleniti accusantium quisquam sint neque. Suscipit illum velit illo ipsam porro sed ullam tempore. Quas saepe itaque similique sed eos. Laudantium officiis autem.","2018-08-20"
2419,20,2912032,"Voluptatibus molestiae possimus ut mollitia occaecati vero amet natus rerum. Quis vel consequatur mollitia dolor tenetur voluptatem corrupti quod sed. Quidem iure aut optio. Vel quia modi. Deserunt voluptas quia aliquid tempora aliquam quia. Officia reiciendis modi ut excepturi repellendus ipsa hic.Repellendus quis veniam nesciunt deleniti delectus neque consectetur qui corrupti. Quod molestiae accusantium minima et quidem molestias eum culpa. Dolorem laborum error molestiae unde nihil distinctio amet. Enim corporis itaque quos ea molestias quas rerum nihil.","2018-08-20"
2420,36,2912032,"Ipsa quam voluptatum dolor rerum sapiente autem distinctio modi. Quae modi dolor perferendis fuga est in. Qui aliquid magnam voluptatem molestiae maiores similique neque numquam modi. Dolorem occaecati ducimus totam. Id sit harum dolorem aperiam nesciunt. Quia occaecati ut culpa hic voluptas ullam a porro.Minus enim asperiores. Eaque eligendi aut perferendis dolor consequatur. Expedita nemo expedita tempora est ut dolorem vitae reiciendis debitis. Qui vero quo qui quia quaerat consequuntur tempore tempore dolores. Saepe delectus sed id.","2018-08-20"
2421,65,2912032,"Consequatur repudiandae quis rerum autem voluptas molestiae perspiciatis molestias esse. Aut enim ut id omnis fuga provident non. Dicta dolore voluptatem. Modi in optio distinctio dolorem amet blanditiis molestiae molestiae debitis. Quo architecto ut aliquam assumenda temporibus dolorem animi et alias.Magni maiores sed animi dolor sapiente rerum recusandae ut. Debitis omnis molestiae similique omnis aut odio quo est. Qui nostrum distinctio iusto dicta ipsa. Delectus impedit laboriosam incidunt eum aliquam reiciendis.","2018-08-20"
2422,37,2912032,"Qui expedita ipsa dignissimos. Dignissimos autem minima ipsa et. Ipsa natus est et ullam provident voluptas. Numquam nobis animi sed dolores est ut eos rem ad. Libero recusandae ut nemo eos. Impedit voluptatem consequatur.Odit laborum ducimus laboriosam omnis. Alias atque saepe. Eum sunt et voluptatem sed sint nesciunt et non aliquid. Dolorum itaque est aut repudiandae quis qui. Beatae cum quia sit nulla. Omnis debitis quis deleniti ut quisquam dolores.","2018-08-20"
2423,13,2912032,"Et et vel occaecati et sed fuga. Natus non consequatur. Rem est similique consequatur et aut molestias perspiciatis possimus. Assumenda optio porro rerum nam. Aut odio occaecati totam ut quam.Aperiam rerum quae sed sed cumque. Maxime molestias assumenda facilis consequatur perspiciatis recusandae eveniet minima. Et quidem et sunt ea ut quia.","2018-08-20"
2424,51,2912032,"Dolorem dolore doloremque iste rem expedita eos adipisci. Est tempora ipsum dolor quaerat nam quidem distinctio unde. Debitis distinctio explicabo sequi eos enim. Non sed ad.Quasi ipsum sit et. Architecto voluptatem porro dolor cum nobis minus esse aperiam autem. Itaque ut nam dolore. Voluptas odit quidem. Rem ut voluptas explicabo nostrum ea voluptatum sint. Recusandae sunt provident aperiam.","2018-08-20"
2425,79,2912032,"Aut nostrum saepe iste nobis corrupti ipsam. Minima laboriosam esse assumenda molestiae pariatur error. Reiciendis voluptatem aut magnam ipsum. Ut quaerat aut molestias ea impedit.Voluptates pariatur vero eos qui et id. Quaerat sit laboriosam perspiciatis non iure id. Ipsum architecto eum laudantium ut omnis. Nostrum voluptas pariatur. Ut aut nobis laudantium ab architecto.","2018-08-20"
2426,81,2912032,"Facere architecto adipisci sint. Nobis voluptatem optio porro. Eligendi id ut exercitationem impedit. Neque omnis repudiandae ea voluptatem occaecati omnis ducimus et. Quidem repudiandae debitis dignissimos et non.Commodi voluptatem iusto impedit. Dolor at et ut voluptatum qui atque officia. Et officiis dolores et aliquam id cum.","2018-08-20"
2427,67,2912032,"Eos enim provident. Porro accusamus labore quia sit. Vitae delectus et ut. Dolore cumque dignissimos amet harum magni necessitatibus.Eos rem minima. Qui recusandae dolor aut consequatur odit molestiae voluptatem corporis dolores. Qui velit dolorem. Pariatur praesentium et et.","2018-08-20"
2428,6,2912032,"Cupiditate quo eaque perspiciatis quasi et fugit totam corrupti et. Et quis ab et fugiat sint. Placeat eos dolore et omnis veritatis minima libero vitae.Dolorum quaerat minus consequatur inventore distinctio aliquid omnis sint itaque. Vero doloremque autem dolor sit qui et. Odit molestias rerum voluptates deleniti impedit. Accusamus et eum sunt ut et. Ducimus facilis placeat qui est. Nihil ipsa et provident officia.","2018-08-20"
2429,52,2912032,"Modi maxime aut sed exercitationem aperiam voluptas non vero. Nulla quis corporis. In sapiente quos quidem aspernatur aut necessitatibus. Magni dolorem tenetur et veniam qui aut sunt voluptas aliquid. Dolores qui porro. Error laborum voluptatem culpa sapiente qui labore accusantium.Maiores officiis fuga possimus earum a fuga autem quia quis. Harum reprehenderit saepe assumenda ea. Optio error rerum distinctio nostrum ullam voluptas. Temporibus aperiam deserunt a quaerat. Laudantium optio ut et quaerat reiciendis. Labore aut consequatur sequi natus temporibus et fugit et suscipit.","2018-08-20"
2430,57,2912032,"Itaque dolor aspernatur et unde corporis architecto consequatur. Minima molestiae id aliquam delectus illo nobis debitis quis repudiandae. Qui ipsam et ut eveniet quidem quidem fuga explicabo voluptatem. Eum aspernatur tenetur eveniet itaque perspiciatis repellat animi.Eligendi at est et. Rerum ea suscipit cumque. Ut adipisci vero et velit. Quis tenetur id et repudiandae mollitia rem non assumenda. Velit consequatur dolor harum aut laboriosam consequatur nesciunt provident.","2018-08-20"
2431,20,2912032,"Animi asperiores veniam quis ut tempora accusamus eaque. Dolor ab et similique aut ut. Aut hic aliquam asperiores quis nulla. Autem sed dolores sed nobis dolorem placeat eos maxime sunt.Reiciendis quia sapiente quaerat tempora esse consectetur nisi. Molestiae nihil atque alias voluptatem assumenda. Consequatur ut esse. Soluta quo expedita fuga placeat quisquam magni dicta. Ea voluptatum iure vel aut vel ullam nesciunt. Dolorum possimus possimus architecto voluptates voluptatem.","2018-08-20"
2432,17,2912032,"Cupiditate quibusdam aut ullam optio voluptatem dolorem sed. Vel unde excepturi. Blanditiis quos magni et consequuntur beatae aut ut quia rerum. Asperiores in at dolor ullam quia aperiam voluptas magni sequi.Autem quam laborum laborum fugit dicta. Placeat eum sit maiores. Cumque dignissimos rem voluptatem et soluta excepturi. Quidem qui sit quo ea. Unde sapiente vero dolorem temporibus cupiditate. Magni ex quia corrupti nam error illo explicabo voluptatibus.","2018-08-20"
2433,71,2912032,"Officiis beatae voluptas voluptatem. Sint voluptatum dolor sunt dolorem. Quaerat optio animi necessitatibus vero assumenda sapiente a aut.Eius quia consequuntur ab debitis sint omnis. Expedita atque totam modi voluptatum sed ut similique. Quos nihil earum officiis alias doloribus ut sit unde. Sed facilis corporis. Ut tenetur ut consequuntur excepturi.","2018-08-20"
2434,91,2912032,"Quia eos voluptatum similique officiis aliquam qui qui. Dolorem in fuga dolor ut sit. Totam sed et dolore maxime esse at aut ipsum. Officia consectetur vel et id possimus facere dolor voluptate sequi. Reprehenderit doloribus veritatis.Nostrum expedita dolores repellat. Consequuntur cum laborum commodi corporis quo. Incidunt illo velit fugiat ut. Id nihil corporis voluptas aperiam sunt quia et dicta facere. Occaecati non nihil sit eos. Possimus dolorem sunt.","2018-08-20"
2435,24,2912032,"Itaque autem repellat repudiandae dolorem. Perspiciatis possimus voluptas cumque consequuntur sint nisi. Maxime ut quos dolores earum excepturi sit ut quia.Totam quia similique debitis ex temporibus quia. At labore dolorem sint totam pariatur. Exercitationem occaecati adipisci facilis magnam. Voluptas ut animi dolor vitae quia est molestiae est vel. Alias magni quam quo velit est.","2018-08-20"
2436,91,2912032,"Qui soluta repellendus corrupti quibusdam soluta qui animi temporibus quidem. Dolore unde voluptatem dignissimos illum omnis. Et quis totam qui ut magni deleniti. Vel corrupti et architecto vero quisquam explicabo. Tempora qui aut nesciunt nulla voluptatem sint autem repudiandae sed. Voluptate et qui aperiam dicta.Non deserunt error explicabo animi nam et. Delectus laborum ipsum soluta quae ut aut accusamus accusantium. Delectus veritatis et cumque est et voluptatem rerum. Ut accusamus iste veniam culpa non.","2018-08-20"
2437,50,2912032,"Rerum repudiandae laboriosam earum eum molestias occaecati sequi dolores. Corporis hic nam eum. Inventore explicabo expedita eum explicabo. Vel maxime consequuntur labore nihil aperiam explicabo ut.Quos ea culpa consequatur corrupti. Reprehenderit repellendus fuga id quis. Beatae omnis eveniet.","2018-08-20"
2438,17,2912032,"Aut nostrum cupiditate ullam ea. Eum praesentium provident qui at nisi necessitatibus rem eveniet autem. Praesentium dolorem non ut rem.Veniam voluptatem qui. Rerum et culpa. Unde aliquid sed facilis sed aut deserunt provident unde. Autem voluptas harum. Voluptatum eligendi tempora laborum est et.","2018-08-20"
2439,4,2912032,"Fugit at sunt. Omnis minus voluptatem aut. Asperiores non enim voluptates repellendus quae atque vel quis eveniet.In rem quia earum laboriosam et voluptatum possimus cum ut. Eos deleniti sit iure accusamus. Aspernatur laudantium architecto sed ut molestiae ratione.","2018-08-20"
2440,66,2912032,"Dolorum et sit quia dignissimos architecto. Sed accusamus a. Et doloremque maiores nulla ea facere provident. Iure et odit vero aut quasi. Eum laudantium quaerat. Quos est ut iste non facilis quia.Facilis tenetur itaque alias doloribus culpa. Necessitatibus dolorem et est vel omnis rerum velit ut. Aut non nihil eveniet similique repellendus. Sit impedit qui id. Ipsam nam eaque quam facere nisi aut tempore aut sed. Reprehenderit accusantium autem consequuntur enim aperiam facilis neque voluptatem ea.","2018-08-20"
2441,97,2912032,"Nisi at quos. Et error et nemo consectetur. Aut recusandae ratione dolorem repudiandae est. Animi dolorem dolorem necessitatibus dolore. Quo voluptatem architecto laudantium harum quaerat excepturi qui. Maiores explicabo sunt quo voluptates aliquam ipsum officiis.Labore neque molestias minima tempora deleniti. Magnam et in temporibus minima rerum libero labore labore. Quis deleniti delectus accusamus nobis quod occaecati.","2018-08-20"
2442,93,2912032,"Aut impedit aut voluptatem itaque illo voluptates veritatis perspiciatis. Numquam ullam voluptatum unde fugit odit labore eveniet a aspernatur. Dolores reiciendis similique nemo odit porro officia. Quasi necessitatibus porro aspernatur. Rerum deserunt aut et sequi molestiae architecto velit. Deserunt quibusdam qui.Itaque reiciendis ducimus veritatis consequuntur esse perspiciatis est maiores possimus. Omnis iste dolorem a tempora quod praesentium et. Odit beatae quas et enim. Dolorem quibusdam eum odit autem neque ducimus repellat. Consequatur omnis aut qui a molestiae aut temporibus earum.","2018-08-20"
2443,15,2912032,"Sint porro corporis tempora. Consequatur architecto suscipit cupiditate laborum nulla. Sunt dolorem totam ducimus laudantium officia quis dolores et. Illo quod sint voluptate.Voluptatem molestias voluptatibus omnis labore temporibus expedita atque rerum sapiente. Ut nam error et impedit. Nobis sed et accusantium quae saepe possimus sit. Dolores autem dolor.","2018-08-20"
2444,25,2912032,"Placeat officiis harum dolores quia temporibus non porro ut enim. Officiis cum aut provident eum sit nostrum sint. Omnis quaerat ut saepe cupiditate facilis rerum eos sunt delectus. Qui consequatur dolorem est.Nulla odit beatae qui. Eum unde officiis iure. Quasi dolor rem alias quae dicta pariatur nulla et dolorem.","2018-08-20"
2445,72,2912032,"Dolores qui aut unde quidem commodi deserunt. Veniam reiciendis in. Quo officia architecto possimus. Dignissimos in magnam et maxime quia mollitia. Voluptatum ullam voluptatem rem beatae dolorum error.Officiis impedit voluptatem ad et sed perspiciatis fuga quia. Laborum dicta molestias aut fuga adipisci commodi doloremque eaque quod. Earum quas dolores sit dicta. Architecto quibusdam rerum enim rerum quos saepe.","2018-08-20"
2446,100,2912032,"Voluptas hic unde sapiente mollitia at accusantium quia. Ea quae sapiente ipsa. Assumenda omnis rerum dolor facere quia et.A dolor ab voluptas ut cum ut aut eos. Ut enim odit sed aperiam. Ducimus consequatur cupiditate est tempore enim ad. Nihil illum a odio vero sed. Consectetur voluptas architecto harum quasi animi qui.","2018-08-20"
2447,58,2912032,"Quaerat et blanditiis unde officiis nesciunt. Commodi et corporis. Adipisci in omnis iusto et ad illo ipsa. Vero quas reprehenderit nihil nemo et voluptas atque omnis.Non ipsam deserunt ut et exercitationem quia. Quo est sint optio odit animi. Voluptatibus vero quia aut similique suscipit alias. Eligendi voluptatum omnis eveniet. Voluptatibus expedita cupiditate minima nemo voluptates.","2018-08-20"
2448,50,2912032,"Reprehenderit odit aperiam iusto quos nulla. Aut dolorum corrupti. Alias quisquam praesentium. Ea repudiandae pariatur sit explicabo et.Optio distinctio reprehenderit veniam sunt voluptate iure ipsa consectetur non. Cumque sit occaecati alias. Blanditiis doloremque eaque quidem.","2018-08-20"
2449,78,2912032,"Sit rerum ipsa enim asperiores corporis eum totam error. Eum voluptas perferendis illo ut totam quae. Et qui rem et inventore laborum. Repellat quis velit quod ipsam animi fuga aut alias perferendis.Sint cumque cupiditate voluptates est doloremque nesciunt. Mollitia et ut beatae perferendis fuga. Et sit labore quia rerum nobis voluptatibus tempore esse.","2018-08-20"
2450,73,2912032,"Odit quia fugit odit vel consequatur autem eum velit quidem. Est ut inventore ut dolores natus est necessitatibus excepturi. Quisquam voluptas provident. Voluptatem magnam placeat. Animi quasi est deserunt.Est fugit quia ut in. Odit amet dolor sed facilis. Quia expedita saepe ipsum laboriosam incidunt est alias maiores odit. Aut eaque eaque magnam. Ullam eaque hic. Temporibus id aspernatur expedita accusantium deleniti.","2018-08-20"
2451,87,2912032,"Nemo rerum est qui. Et officia repudiandae dolor. Veniam et similique accusantium omnis ea eius aut. Ducimus sit nulla molestias. Odit facilis commodi cum porro.Error sint dolorem ipsa nihil illum ratione numquam quod. Ducimus architecto possimus explicabo natus. Eos aut ut culpa repellat omnis. Provident quis non eum nostrum earum autem voluptates eos dolores. Hic placeat facere sed.","2018-08-20"
2452,31,2912032,"Explicabo tempore soluta dolores esse et. Iste dicta perspiciatis a necessitatibus. Velit et sed molestias minima debitis maxime. Ea quod et maxime voluptas in odit.Iusto occaecati aliquam dolor consectetur recusandae sint nam. Tempora sunt cum recusandae tempore eos laboriosam eius. Cupiditate quaerat distinctio voluptatibus soluta ut quasi incidunt nostrum dolores. Voluptatem reprehenderit sequi debitis.","2018-08-20"
2453,93,2912032,"Doloribus deleniti qui blanditiis qui alias eveniet temporibus vero porro. Labore vero veritatis nihil accusantium rem assumenda eligendi unde. Sit sed sequi. Vel dignissimos quia nostrum quaerat ea pariatur autem. Aut velit et ut nam dolorem delectus aut. Ipsam repellat perspiciatis sit maiores soluta.Est voluptatem modi et assumenda eos quis in architecto. Doloribus sed numquam quis laborum iusto inventore libero non fugit. Aut a id soluta consequatur iure. Commodi fugit vel tempore sit impedit distinctio est. Doloremque perferendis quibusdam voluptatibus nobis. Repellat tempore modi a voluptatem laboriosam.","2018-08-20"
2454,88,2912032,"Odit omnis illum quia. Iusto saepe dolor molestiae ut dolores quod dignissimos corporis. Animi temporibus quos consequuntur ea distinctio ex animi deleniti. Pariatur maiores ullam facilis neque non. A voluptatem nihil non quasi quas tempore enim. Aut ut id officiis dignissimos ex et quis deleniti.Facere omnis recusandae sint tempore vero. Nam molestiae quo incidunt voluptatem cupiditate et provident quibusdam. Vel impedit ut non earum voluptatem autem cupiditate.","2018-08-20"
2455,60,2912032,"Rerum aut temporibus consequatur et id qui dicta ratione. Omnis alias beatae. Ut ab ut optio dolorem dolor id officiis. Optio ad earum in odio nostrum odio. Deserunt sunt accusantium beatae et iste. Nesciunt error enim et recusandae et corrupti et ea.Est provident est quos. At nulla laudantium similique impedit ipsum ut. Similique omnis accusantium ipsum.","2018-08-20"
