"id","user_id","listing_review_id","review_content","review_time"
4815,64,2912064,"Eius doloribus itaque ut cum praesentium a totam reiciendis. Doloribus aut iusto minus. Et culpa maxime minus repellat consequatur. Recusandae quis ut qui. Dicta voluptatem ut est et excepturi deserunt provident tempore.Quasi eius fugit ut esse ratione soluta. Non eos qui exercitationem ex. Non ex aliquam dicta pariatur sit et reprehenderit accusantium deserunt. Ab reprehenderit perferendis praesentium voluptates. Corporis doloremque ut dolores ut fugiat enim odit quia.","2018-08-20"
4816,25,2912064,"Et perspiciatis accusantium a debitis labore laboriosam accusamus cupiditate. Quas harum nihil rerum eum non nostrum aspernatur. Omnis omnis dolore sequi aut necessitatibus cumque. Autem architecto culpa asperiores maiores voluptatem est autem deserunt. Occaecati voluptatem molestias et voluptate maiores.Voluptatum necessitatibus consequuntur sed minima et. Ipsam sit eos. Mollitia perferendis eaque voluptas illo qui quia. Saepe cumque omnis ducimus nostrum voluptatem eos et. Omnis modi laboriosam praesentium sint ea tempora aut corrupti architecto.","2018-08-20"
4817,33,2912064,"Cupiditate est ut. Hic corrupti porro veritatis nihil at dicta in et quia. Cumque ut illum repudiandae fuga sed dolor.Voluptas voluptate iure doloremque non et ad. Odio iusto nemo impedit similique eum. Ducimus ut nihil. Quia molestiae dolorum rem eos dolor eum.","2018-08-20"
4818,91,2912064,"Modi aliquam itaque inventore ea deleniti rerum sint vero doloremque. Et molestiae quas. Quasi eius amet omnis eum veniam sunt quo. Hic sapiente dignissimos aperiam minima molestiae commodi suscipit cumque. Sed quisquam nam quae dolores.Ut maxime aspernatur sed dolores sunt exercitationem dolorem et magnam. Repudiandae molestiae laborum esse vitae ipsum est et eveniet eaque. Libero fugit voluptatum culpa omnis repellendus. Rerum facere ea quam ut unde ipsa. Nemo et vero sed vero quis molestias. Consequatur dolor qui voluptatem ut fuga pariatur.","2018-08-20"
4819,14,2912064,"Qui velit possimus magnam. Qui non qui. Rerum et nesciunt est doloremque quis. Sint voluptatem possimus et. Voluptates et inventore ut.Natus voluptate qui est. Fugit minus ipsa in. Architecto enim quia vel delectus accusantium rerum amet. Nostrum accusantium aut earum quo sed dolorum cumque sunt.","2018-08-20"
4820,19,2912064,"Omnis commodi dolorum enim eligendi est in modi. Culpa incidunt et magni quia. Quia accusantium commodi aut consequatur. Iusto in eum iusto. Sapiente qui officia tempora sed fuga quia.Ullam est quam molestiae aliquam odio deleniti. Nostrum autem voluptates occaecati sapiente. Et ut molestias omnis molestiae voluptas corrupti quod.","2018-08-20"
4821,55,2912064,"Inventore voluptatem autem quibusdam error alias quod nam. Perferendis et ut. Quia ratione corrupti et rerum facere magnam. Minus voluptatem sit aliquam animi architecto. Repudiandae voluptas voluptas et aut nam saepe consequatur eaque harum.Expedita quae enim. Doloremque occaecati incidunt error unde voluptatem nemo ea voluptate nihil. Et commodi ea id sed. Asperiores distinctio vero rerum dolorum illum suscipit voluptatem consequuntur. Veniam sed in odio dolores eos. Ut et tempora eos fugiat distinctio consequatur nesciunt.","2018-08-20"
4822,64,2912064,"Consequatur blanditiis alias aut in sint sapiente consequatur. Voluptas ipsum facere voluptatem tempore. Enim ut culpa sunt. Mollitia et voluptas iure atque sunt voluptatum dolorum fuga.Rerum rem omnis quia quis quis qui ratione. Accusamus est eius quas velit earum facere. Ipsum praesentium assumenda est dolores rerum.","2018-08-20"
4823,49,2912064,"Est quis aperiam. At quibusdam cupiditate corrupti eos id quam repudiandae iste. Sint odit alias in et necessitatibus quis quibusdam consectetur.Impedit rerum optio est. Ut ipsum vero blanditiis voluptate eligendi. Repellendus nihil et cupiditate sit perspiciatis repellendus autem aliquam. Dicta sint modi sunt sed inventore.","2018-08-20"
4824,43,2912064,"Ea facere nesciunt hic aliquid repellat voluptatem quia quidem. Minima repellat natus reprehenderit expedita. Nemo consequuntur temporibus perferendis eveniet officiis porro voluptatem. Dignissimos adipisci ad voluptatum. Sapiente molestiae sint voluptatem et. Consequuntur provident possimus dicta et.Aliquid dolorem suscipit nisi qui odio omnis maiores. Magnam rerum quo aut officia mollitia et enim in. Et recusandae quia blanditiis. Quod ut sed laborum. Cumque rerum officiis ad optio et ipsa impedit vel velit. Perferendis veritatis dicta.","2018-08-20"
4825,75,2912064,"Et dolor nostrum minus quia eius amet quidem eaque earum. Dolorum nihil molestiae. Dignissimos praesentium consequatur.Nesciunt sunt repellat est et omnis. Est commodi ipsam non cum quo quaerat. Facilis cumque rerum saepe ut recusandae. Et ut ut. Molestiae accusantium maiores qui delectus maxime autem. Occaecati et ut commodi est cum.","2018-08-20"
4826,84,2912064,"Iure iusto et quia eveniet dolorem consequatur. Nam voluptates eveniet libero nisi esse. Nulla ex enim libero commodi at animi veritatis eos. Explicabo mollitia repudiandae veritatis sint velit laudantium est vel aspernatur.Eos quo non velit corporis. Nam eum quia eligendi quidem vitae itaque dolor nisi accusamus. Expedita accusamus quae consectetur placeat. Tempora error fugit velit. Nihil ea modi voluptates in. Reprehenderit eius consequatur optio earum.","2018-08-20"
4827,81,2912064,"Est vero vero. Nemo et excepturi ex voluptas est. Dolores commodi eveniet distinctio totam autem sed cumque est. Autem voluptas rerum mollitia possimus maiores sed quaerat atque fuga.Neque rem voluptatibus quos voluptas quas sunt officiis iure repellat. Fugiat quaerat sit est officiis qui enim voluptates. Voluptatem voluptates iste repellat perferendis.","2018-08-20"
4828,36,2912064,"Voluptatibus voluptatem sed. Quos odio et et consequatur qui. Consectetur distinctio quia dicta delectus molestiae inventore alias ut nostrum. Est voluptates quo necessitatibus consequuntur cupiditate. Et sint omnis iusto provident aut quam.Dolores autem enim expedita molestiae officiis ipsam. Soluta placeat accusantium aperiam necessitatibus rerum animi. Saepe illum vitae delectus hic. Soluta quibusdam sit deserunt eos qui. Iusto vel exercitationem vero.","2018-08-20"
4829,88,2912064,"Dolor magnam doloremque distinctio nihil reiciendis sint impedit pariatur. Nisi quia occaecati consectetur consectetur unde. Vitae dicta voluptatum impedit. Vel sit aliquam aut.Iste dolor voluptatum hic harum est eos excepturi. Blanditiis exercitationem corrupti sequi nam aut blanditiis natus. Ut suscipit a est veritatis sapiente alias ut et.","2018-08-20"
4830,69,2912064,"Qui ut dolorem mollitia corporis dolor beatae. Aut voluptates repellendus suscipit aut qui. Expedita est unde fuga.Non inventore rerum ut laudantium laboriosam. Atque quasi id minus doloribus. Sunt eligendi quibusdam impedit et itaque sit dicta maxime quia. Tenetur quo accusamus qui iure esse explicabo. Illum quis reprehenderit.","2018-08-20"
4831,53,2912064,"Et omnis velit et. Dolores eos reiciendis eligendi similique. Dicta fugiat consequatur eum vel quo consequatur maiores. Libero sit libero. Dolor odio quo et ex.Non repudiandae velit aut beatae dignissimos. Omnis vel fugit ut praesentium. Optio rerum adipisci accusantium debitis quo id voluptatem alias tempora. Minima iste neque excepturi dignissimos veritatis modi sed voluptatem libero. Veniam quia maiores commodi sint doloribus in.","2018-08-20"
4832,77,2912064,"Et officia repellat corrupti molestias cumque corporis magnam sed quasi. Asperiores voluptatem non in nihil sint necessitatibus aut ratione aut. Non excepturi ab alias et amet fugit eos delectus. Cumque rerum corporis atque ut culpa omnis. Ea magnam nisi sint illo dicta maiores eveniet. Voluptatem illo quo optio totam.Nam vel quia iusto ea quod consequatur ut. In officiis ut aut consequuntur iusto ipsa. Quo error voluptas iste explicabo est.","2018-08-20"
4833,85,2912064,"Sit distinctio ab ratione possimus natus. Aut voluptatem aperiam quos deserunt saepe beatae laborum similique est. Reprehenderit omnis nobis amet tempore temporibus culpa deserunt explicabo quia. Sunt sed ipsa nesciunt est reprehenderit rem harum dolorem. Rerum iste sint ex delectus sit in iure. Laborum accusamus quia et sit aperiam necessitatibus voluptas.Rem quia et magni fugiat provident vero quibusdam. Nihil commodi porro veniam molestias saepe saepe incidunt accusantium id. Laborum aut beatae in itaque et a quas magnam maiores. Et molestiae et. Et porro voluptatibus quia necessitatibus enim atque at.","2018-08-20"
4834,17,2912064,"Non provident consequuntur quisquam quis. Quia inventore pariatur fugit qui. Mollitia reiciendis reprehenderit non aliquid occaecati aliquam. Explicabo ducimus commodi ex illum velit. Qui ipsum eligendi quaerat ut sunt aperiam ad sunt temporibus. Non eum recusandae et suscipit in nesciunt.Voluptatem repudiandae nobis et adipisci et. Voluptatem expedita maiores repellat debitis nobis eos qui occaecati laboriosam. Necessitatibus perferendis autem ad ut.","2018-08-20"
4835,23,2912064,"Recusandae inventore laborum molestiae ut iusto vel harum hic vel. Ad maiores quis ut nemo unde ut et qui. Ex earum minus quae officia consequuntur maiores ut. Dolor rerum corrupti et quam. Ipsa a a. Velit minima exercitationem assumenda velit eos harum.Blanditiis explicabo autem et eveniet. Quos dolorum aut minima. Repellendus blanditiis doloremque libero amet et sed. Perferendis qui nihil nam. Rerum eos nihil commodi incidunt incidunt praesentium sint nostrum. Ut odio molestiae qui ut expedita.","2018-08-20"
4836,87,2912064,"Excepturi nihil numquam autem voluptates repellendus placeat accusamus doloribus qui. Temporibus distinctio ipsam quo et alias id deleniti animi quis. Omnis est incidunt officia error vero est. Qui commodi id sunt eum nulla rem aut eos. Tempora fuga provident fugiat nobis aspernatur atque alias et quasi. Quidem dolore repudiandae voluptatem et ut modi.Quaerat officia et dolorem beatae impedit veniam aspernatur. Quisquam est facilis et sint facilis itaque aspernatur. Non omnis dolorem. Ut voluptas saepe architecto maiores. Eius dolore enim soluta quos hic qui.","2018-08-20"
4837,90,2912064,"Omnis quidem error. Libero est reiciendis dicta et placeat temporibus quisquam occaecati. Rerum fugiat enim ut quia laudantium rerum. Non in sit quisquam ab et.Sed et ipsum voluptatem mollitia ea quae. Consequuntur earum eum quae deleniti ullam. Officiis est sunt labore doloribus et. Accusamus voluptas quia dignissimos. Inventore ipsa sint consequatur autem qui repellat nisi odit.","2018-08-20"
4838,79,2912064,"Tenetur fugit quod. Quo rem ea sed dolorum natus quaerat molestiae et. Tenetur quia deleniti. Laborum nobis autem ex esse ullam quibusdam.Eaque aliquid beatae quas sit. Quam dolore suscipit ipsa unde. Sapiente iste ut expedita sunt ea eos cum. Dolorem vero distinctio et officia blanditiis est nihil architecto.","2018-08-20"
4839,33,2912064,"Atque iure sunt aut molestiae est. Dolorem qui iure et. Quia animi alias ducimus neque impedit autem. Totam totam distinctio totam maiores. Porro hic enim esse sapiente atque. Dolor illum aliquam doloremque adipisci sit sed aliquid repellendus.Cumque quos sapiente illum. Dolores consequatur ullam non omnis laboriosam ut. Dolores mollitia quibusdam excepturi neque. Et sint quia voluptatem eos perferendis rerum voluptas aliquam commodi.","2018-08-20"
4840,65,2912064,"Reiciendis fugit quibusdam ab et quasi rerum molestiae. Placeat ea praesentium. Quo deserunt dolore adipisci officia.Sed et omnis sit ut pariatur quis vel. Omnis ea vel facilis recusandae. Deserunt enim qui tempore.","2018-08-20"
4841,60,2912064,"Recusandae et ea. Eos fuga sed pariatur esse ratione et. Id distinctio aperiam non sed.Mollitia officiis labore ea dolorem ea ipsum veniam. Ut sequi quos vel modi voluptas enim. Corporis ullam dolore nihil dolor dolorem veniam omnis consequatur. Nam et dicta eos dolor soluta laboriosam amet laborum. Aliquam labore voluptas aut amet.","2018-08-20"
4842,7,2912064,"Ab numquam vitae minima. Nesciunt est non culpa quo dolores debitis. Quis et itaque optio. Numquam nihil est dolorem qui error ut saepe aut. Vel fugit quia alias et.Expedita voluptatem sunt. Sint porro quis consequatur cumque iusto asperiores at quisquam. Dicta et eos et quis sunt similique esse. Aut eligendi qui aperiam non necessitatibus nostrum necessitatibus mollitia aut. Quam explicabo natus eaque. Vero in adipisci recusandae voluptatem assumenda.","2018-08-20"
4843,94,2912064,"Iure nihil ipsam eveniet suscipit. Quae sint ab at neque omnis ipsam voluptas. Accusamus maxime aut sed nulla nulla.Aliquid quisquam fugiat iure quis aliquid est fugiat. Illo consequatur numquam nisi blanditiis est magnam ratione aperiam. Modi vero repellendus ex illum. Laborum provident error quo.","2018-08-20"
4844,47,2912064,"Autem saepe unde ut suscipit eos aut tenetur ducimus odio. Consectetur mollitia ratione illum. Rem autem assumenda aut id inventore debitis. Quis autem qui. Doloremque voluptates quia veritatis voluptate et qui nesciunt in.Voluptatum distinctio ut adipisci qui. Corporis minima porro molestiae. Ut sequi doloribus quia nemo rerum. Praesentium dicta quas.","2018-08-20"
4845,29,2912064,"Ut aliquid ut eum ea. Quidem autem deleniti sequi accusamus aliquid est laboriosam. Accusantium dolorum perferendis voluptatem debitis ut ad rerum blanditiis. Earum vel ut aut quo natus nesciunt quos.Temporibus animi consequatur repudiandae et nostrum qui expedita. Et earum possimus. Facere excepturi dolor. Hic quod est dolorum omnis aliquam aut eaque eum. Magnam aut et harum qui et corrupti autem. Ratione et placeat non vel aut nulla non dolore blanditiis.","2018-08-20"
4846,2,2912064,"Quidem ex quia. Occaecati ut fugiat perspiciatis vel aperiam. Et voluptate facilis quidem odit ipsam. Assumenda impedit minus minima aut velit quam debitis est et. Dolor adipisci quisquam optio sapiente. Amet aut voluptatem nihil aut quia repudiandae quo non sapiente.Beatae consectetur illo accusantium. Enim vel rerum illo voluptatum esse aut vel voluptatem. Omnis dolores consequatur id dolor. Voluptas id et dolor. Eum quod sequi corporis deserunt et adipisci aut.","2018-08-20"
4847,79,2912064,"Dolor ut necessitatibus nisi. Voluptatem delectus maiores. Totam amet commodi dolorem numquam sint.Quia nobis est veniam et eaque. Incidunt consequatur dolor omnis soluta. Aliquam doloribus dolorum corrupti necessitatibus vero in neque repellendus. Porro sed quae. Doloremque iure inventore molestiae recusandae suscipit a recusandae ipsa voluptatem.","2018-08-20"
4848,34,2912064,"Nihil qui nihil maxime quas non voluptatem fugiat hic. Placeat quia ut saepe sint corporis voluptatem tempore. Eos voluptatem non maiores ipsa blanditiis distinctio eum. Distinctio beatae voluptas deleniti veritatis molestias veritatis. Officiis hic exercitationem voluptatem blanditiis quo magni quam.Suscipit labore officiis aliquam consequatur et tempora qui cupiditate dolores. Nesciunt et laboriosam. Eos quas distinctio repellendus voluptas consequuntur eos. Odit optio odio qui amet. Sit et incidunt quos libero. Quasi error voluptatum qui ipsa.","2018-08-20"
4849,11,2912064,"Sit modi asperiores temporibus eos voluptatem. Earum atque et. Labore qui excepturi. In et aliquid vitae corrupti voluptas commodi et laborum unde. Aperiam dolorem exercitationem doloremque aut quis nostrum.Minus autem quia dolorem voluptatem aut dolor. Delectus ab dolor expedita nihil aut. Consequatur totam dolores rerum aut id nam et eveniet. Iusto voluptatem soluta omnis magnam ipsam eaque.","2018-08-20"
4850,4,2912064,"Similique vel error. Libero non voluptatem. Mollitia incidunt aut aut omnis neque veniam molestias iure ullam.Et repellendus laborum tenetur sit ea perferendis sint. Labore laboriosam autem nisi aperiam fugit vel saepe vitae nulla. Consequuntur est libero veritatis quasi et vel deleniti eveniet. Rerum est et.","2018-08-20"
4851,64,2912064,"Doloribus nesciunt ut. Velit qui et. Dolore et aliquid enim accusamus rem exercitationem voluptatum qui. Similique qui maiores non dolorem aperiam.Illo saepe doloribus architecto et et possimus. Quidem ut dicta. Veritatis ut autem qui quisquam quod consectetur. Deleniti aperiam eos.","2018-08-20"
4852,55,2912064,"Saepe vitae est natus. Aut ad nobis assumenda maiores. Consequatur asperiores veritatis aperiam rerum nostrum. Facere ab vel provident voluptate vero sint.Qui non consequatur. Laborum quos atque velit necessitatibus officia quis adipisci deserunt est. Vitae asperiores officia velit maxime voluptate quod. Expedita consequatur voluptatem. Necessitatibus delectus eligendi ut et. Recusandae dolores dicta incidunt est qui quibusdam omnis.","2018-08-20"
4853,99,2912064,"Aut et veritatis aspernatur ratione. Ea doloremque repellendus totam vel consectetur cumque corporis quam tenetur. Accusantium unde cum minima fugit numquam. Dolor vel distinctio necessitatibus.Omnis laboriosam sit deleniti et omnis animi excepturi dolores molestiae. Quae est rerum. Labore dignissimos sit laudantium omnis nihil culpa a sed quaerat. Suscipit neque deserunt quisquam. Qui suscipit consequatur in necessitatibus beatae. Beatae quisquam reprehenderit ipsa.","2018-08-20"
4854,88,2912064,"Assumenda sed voluptatibus molestiae sed ut explicabo similique aspernatur. Temporibus doloribus dolores quae vero eos ipsum eum. Repellat quod expedita qui minus. In voluptas et molestias. Ipsa officiis pariatur qui autem autem corporis.Culpa et atque ullam perferendis explicabo. Corporis eum itaque expedita enim fugit ut. Adipisci quia aliquam quisquam. Magni nostrum magnam.","2018-08-20"
4855,4,2912064,"Assumenda quis voluptas aut qui consequatur mollitia sit libero voluptatum. Architecto perferendis facere non velit occaecati atque. Consectetur delectus ut ut nesciunt qui magnam et vitae. Eum soluta voluptas sed. Est quia similique mollitia aut officia nihil quibusdam.Blanditiis excepturi voluptas est ratione qui officiis consectetur excepturi minus. Ad similique est porro. Odit maiores dolores aut quod tempora laudantium. Error voluptatem voluptatem eligendi. Sint pariatur excepturi libero commodi officiis. Nihil esse vel eveniet.","2018-08-20"
4856,97,2912064,"Minima qui ut illum accusantium distinctio. Repudiandae quod non delectus quis sit vitae quo expedita. Velit ut et ut consequuntur excepturi quaerat sunt cum.Qui nam autem omnis quis odio. Atque ad similique modi sed consequatur ipsa qui rerum voluptates. Est aspernatur velit ipsa sapiente ab non. Neque autem iure voluptas. Dolore quisquam sed sint porro rerum qui provident quasi labore. Facere suscipit aut perferendis cumque aliquam nostrum soluta natus.","2018-08-20"
4857,19,2912064,"Sequi maxime quis vitae aliquam et magni et aut mollitia. Aut corporis eum error aut numquam. Dolorem eum voluptatum impedit ut a et.Ab ad autem aut recusandae. Sed ex voluptatem libero quod. Quaerat cumque fugit facere voluptatem repudiandae voluptatem ut.","2018-08-20"
4858,41,2912064,"Voluptatem officia iusto et. Quae ea possimus ut assumenda et. Necessitatibus nisi placeat dicta velit.Deleniti eos voluptas rerum suscipit voluptas. Velit illo et vel minus in omnis qui placeat qui. Soluta in reprehenderit. Odio beatae cupiditate iusto velit quia nesciunt ut esse. Porro hic minus tenetur dolores ut amet eos.","2018-08-20"
4859,29,2912064,"Iste magni tempora suscipit quod possimus rem. Sint voluptatibus corrupti repudiandae sit et quam labore in. Mollitia et sed ut velit distinctio. Consequuntur et eligendi inventore molestiae voluptatem officiis voluptatem perspiciatis.Officiis asperiores omnis et doloribus in consequatur consequatur aut. Ullam quis sit delectus sed qui sint similique. Sit adipisci est ex consectetur velit laudantium odit aut alias. Et reprehenderit et ab et quis id. Illo nam voluptates eveniet labore. Reiciendis repudiandae laudantium sint recusandae vel.","2018-08-20"
4860,10,2912064,"Repellat repellat nesciunt iste illo optio a. Ab sint est blanditiis quasi eos voluptates. Vero ut debitis esse harum facere. Ad voluptas nisi optio. Dolor sit laboriosam et. Velit nemo repellat et vel.Natus sequi et magni tempore autem. Ipsum beatae aut eum ducimus laborum accusantium. Veritatis voluptatem numquam quisquam. Accusantium eaque velit corrupti delectus alias explicabo. Molestiae rerum illo repellendus repellat enim et. Eos animi commodi.","2018-08-20"
4861,64,2912064,"Quod atque occaecati voluptatem vitae vitae consectetur non aut omnis. Non exercitationem ad vero est asperiores. Et perspiciatis totam quae molestias. Neque ut sunt aperiam magni voluptates et et. Distinctio officia necessitatibus quia fugit.Eos qui provident assumenda. Quod mollitia voluptatibus consequatur ullam sunt quia possimus sit officiis. Dolorum nihil hic et voluptates earum. Occaecati est hic molestiae explicabo sit in error voluptates ad.","2018-08-20"
4862,58,2912064,"Odio inventore beatae facere rem minima nihil. Expedita eveniet fugiat repellat voluptatibus quas nam necessitatibus sunt dignissimos. Voluptas nemo officiis harum doloribus. Autem possimus doloremque voluptas. Ea praesentium porro minus. Provident nihil sapiente perferendis praesentium aut alias et.Dolorum rerum voluptatibus officiis aut laudantium rem dolores reprehenderit. Molestiae voluptatum dolorem et. Maiores omnis optio fuga quisquam fugiat non accusamus et. Est est voluptas.","2018-08-20"
4863,3,2912064,"Dolore facere dolores dolores officia ex et quo suscipit non. Quos vero occaecati perferendis dolor cum voluptatem velit qui hic. Veniam aut velit assumenda nam ut numquam. Blanditiis tempora nisi sapiente.Quisquam nobis ea rem voluptates quas. Ratione perferendis ut. Autem aut corrupti et.","2018-08-20"
4864,74,2912064,"Neque iste ut ea non sit sed fuga magni dicta. Qui similique est eveniet fuga ducimus. Corrupti vel a eligendi repellendus. Dolorem eum occaecati vitae illum non ad. Adipisci voluptatem eos ipsam culpa sit. Maiores quia expedita ut ut ducimus vitae culpa velit optio.Aspernatur dolor sunt ipsa molestiae ipsum. Et et eum ea eos placeat. Qui voluptatem eos. Provident voluptate et veritatis officiis consectetur enim rem aperiam.","2018-08-20"
4865,87,2912064,"Quia sed voluptatibus assumenda cupiditate perferendis dolores nostrum id nemo. Aspernatur corporis autem non adipisci nulla asperiores nisi quidem et. Saepe quas dolor totam minima.Numquam pariatur vitae labore ad voluptatem nihil nesciunt iure voluptas. Autem qui ex incidunt incidunt earum. Voluptate aliquam ipsa sequi omnis non consequuntur aut placeat libero.","2018-08-20"
4866,60,2912064,"Occaecati qui et necessitatibus voluptas quisquam laudantium. Eum similique corporis necessitatibus perspiciatis pariatur architecto. Libero dolorem et animi aut tempora vitae aut.Iure quisquam sed sed sunt tenetur aliquam numquam veritatis. Voluptate amet dolor dolores enim aut velit. Voluptatem est sed.","2018-08-20"
4867,34,2912064,"Asperiores et repellendus optio reprehenderit culpa. Neque et quidem non. Sint laboriosam ut. Eaque omnis placeat hic maiores dolorem vel.Sapiente dolore provident id ut. Quam est qui nesciunt nemo illo. Et optio molestiae. Et dolor eum rerum qui necessitatibus harum iste velit enim.","2018-08-20"
4868,92,2912064,"Provident non similique corporis sit. Recusandae harum autem praesentium quisquam. Quia corporis qui est ut aliquid laboriosam. Aut illum delectus eveniet quo laboriosam molestiae. Et expedita incidunt itaque velit quisquam at at.Facilis cumque enim voluptate et in. Ut molestias molestiae. Maxime vero esse voluptas. Impedit doloribus aut officia rerum. Quaerat qui rem repellendus ut cupiditate.","2018-08-20"
4869,71,2912064,"Eum ipsam dolor quas. Quas quis vero natus distinctio sit et. Provident esse adipisci delectus non illo voluptates ut voluptatibus.Eligendi veritatis fuga aut. Dolor eius est dolorem nam. Sapiente optio atque voluptatum voluptas id est nihil aspernatur. Ut molestias a quasi quo sint delectus ut.","2018-08-20"
4870,55,2912064,"Eos at doloremque eum corrupti nemo consequuntur. Qui amet architecto voluptas. Veniam omnis similique odit sint quis id aut sed et. Fuga debitis dolorum error. Et et non.Qui consequatur esse asperiores sunt qui. Incidunt vel nihil sit vitae dolor temporibus cumque ratione unde. Ut magnam ducimus expedita. Id natus est quia.","2018-08-20"
4871,10,2912064,"Sunt non est quia accusantium rerum. Quia dolor ut fugiat porro. Dolores soluta consectetur voluptatibus aut qui velit. Odio ut dignissimos rerum. Ut blanditiis laudantium.Est et illum ratione voluptatibus esse. Quos vero enim sunt nesciunt quam quis consequatur voluptate. Repellendus et et quidem. Modi ea quis voluptatibus rerum laudantium enim voluptatem earum. Facilis consequuntur excepturi quis magnam aspernatur quos.","2018-08-20"
4872,30,2912064,"Nulla sed harum sed eius voluptatem ut quia dolore. Expedita eos adipisci. Veniam enim eum sint eaque eaque tempora animi. Saepe quis quo.Tempore sed id ab. Voluptatem quo unde. Optio soluta quos rerum. Et est illo sint quasi aut ab.","2018-08-20"
4873,37,2912064,"Quis corrupti temporibus ratione. Facere non id possimus. Minima est ab.Sed cupiditate veniam architecto fugiat dolorum. Velit sunt rem. Nihil in sed praesentium ducimus voluptas exercitationem quisquam.","2018-08-20"
4874,34,2912064,"Expedita error recusandae. Sed sit blanditiis molestias in autem. Aperiam voluptatem recusandae a expedita et deserunt id. Quo dolores sint et dolore maiores. Ut minima impedit provident dolor qui similique. Reprehenderit sunt omnis ducimus non fugiat qui et.Iste placeat fuga laudantium aut eos in quis debitis voluptatem. Natus sunt deleniti assumenda molestias impedit ut quo reiciendis quo. Et qui quisquam vel aspernatur facere voluptatem et. Id ea pariatur consequatur velit unde. Ipsam quos sint qui. Nihil libero cupiditate.","2018-08-20"
