"id","user_id","listing_review_id","review_content","review_time"
4639,14,2912061,"Magni sed dolorem id. Qui sed sit. Minima quia voluptatem mollitia voluptates sunt. Voluptatem in et dignissimos blanditiis maiores omnis.Et eum perspiciatis nobis aliquam alias sit sit iure earum. Quisquam ipsa quo ducimus dolor. Et ex quasi inventore. Optio aut error amet aspernatur repellat et eius porro perferendis. Qui doloribus sit doloribus natus officiis ullam. Et nemo deleniti harum perspiciatis illo natus omnis.","2018-08-20"
4640,2,2912061,"Optio autem et aut saepe aperiam et porro nihil. Architecto architecto iste qui praesentium corporis. Consequuntur dolor sunt. Ex voluptatem occaecati qui ipsam quis. Magni enim provident rerum.Unde et laboriosam. Sed eligendi ab porro hic architecto eius. Dolores distinctio excepturi. Deleniti deleniti et totam expedita sed.","2018-08-20"
4641,74,2912061,"Autem esse necessitatibus qui officiis tenetur quisquam optio laudantium. Ut autem eum. Atque fugiat eum quod eveniet in repellendus qui. In quisquam dolore. Incidunt impedit facilis ab consectetur quos. Magni eligendi amet et nesciunt et veniam expedita.Alias est veniam sed rem consequuntur possimus sed quisquam ea. Occaecati nisi magni ut. Accusamus sint voluptatem ut doloremque. Autem esse sint unde qui et nihil eligendi. Repellat harum voluptatem at.","2018-08-20"
4642,51,2912061,"Qui architecto nihil dolores ipsum non. Assumenda sunt qui et in. Non nisi rerum debitis. Voluptatum veritatis autem. Et molestiae minus harum et non ea. Voluptatem earum cupiditate maxime aperiam quae.Quasi eum esse odio commodi sed. Sint est velit commodi quia est atque quia aut autem. Deserunt pariatur ratione vel in nulla labore in necessitatibus. Rerum perspiciatis hic aut nostrum et soluta. Sunt optio perspiciatis cum et quas eum reiciendis est. Tenetur voluptas saepe non accusantium veniam.","2018-08-20"
4643,24,2912061,"Eius qui accusamus cumque officia numquam vitae. Explicabo quia repellendus asperiores assumenda aut incidunt illum sed. Molestiae repellendus qui quis.Voluptates sit illum hic facilis. Molestiae placeat nemo natus temporibus ea. Eligendi corporis culpa sint commodi voluptatem et.","2018-08-20"
4644,30,2912061,"Magnam voluptas sunt distinctio hic laborum. Sed labore cumque enim et. Consectetur repudiandae voluptatem aut saepe.Sapiente qui et sed. Et earum qui. Voluptates vitae soluta beatae. Vel cumque est ratione.","2018-08-20"
4645,49,2912061,"Soluta aut cupiditate veritatis consequuntur non. Ullam quam autem eveniet amet commodi. Est quaerat eum similique eum adipisci velit. Ab nesciunt est provident odit ut suscipit soluta illo. Velit distinctio atque possimus ut debitis et aliquid mollitia.Illum dolores ut commodi blanditiis debitis a. Ratione aut nihil beatae deleniti ex reprehenderit molestiae et est. At voluptatem et sint rerum nulla quibusdam recusandae est reiciendis. Ut doloribus velit ea animi unde repellat. Voluptas neque quidem consequatur occaecati voluptate quae molestiae quidem.","2018-08-20"
4646,4,2912061,"Dolor delectus provident dolor velit soluta consequatur fugiat necessitatibus non. Dignissimos unde expedita quisquam qui mollitia nisi corporis sed est. Adipisci debitis odit. Ipsum delectus deleniti ea voluptatem dolorem est aut. Quam debitis est aut veritatis non quas sit et. Omnis et nam.Autem doloremque qui. Cupiditate sit sunt ullam deserunt odio cum. Ipsam autem voluptatem rerum in. Magnam deleniti hic. Dolorem nemo quia incidunt eos quis perspiciatis.","2018-08-20"
4647,82,2912062,"In et ea aperiam quo quia odio ipsa. Provident cumque inventore harum aliquid et ipsam suscipit hic. Impedit autem saepe tenetur.Et et et fugit maxime sint. Iusto nulla aut perspiciatis explicabo mollitia. Culpa quidem unde nobis. Maxime et et placeat voluptatem sed odit nam nemo aspernatur.","2018-08-20"
4648,49,2912062,"Est qui necessitatibus minus molestias. Soluta dolore et ullam molestiae. Cum aut quaerat unde.Aspernatur quia quam consequatur eius iste. Reiciendis nesciunt quia culpa dolores. Nam ut quis nisi porro ullam et. Sed placeat sequi reprehenderit eveniet. Unde ut animi illum facere cumque aut voluptate.","2018-08-20"
4649,84,2912062,"Quia laborum quia debitis. Magnam repellendus vero laboriosam. Provident error quo eveniet ratione quaerat. Provident quia dicta et omnis sed praesentium vero quia eos. Expedita quo non vitae qui est. Fugiat error quis optio nisi.Aut laborum quia et et dolores dolor. Quia fugiat quibusdam eum quia. Eum est nisi eum ea est dignissimos nisi in.","2018-08-20"
4650,3,2912062,"Quisquam repudiandae adipisci odit inventore dolorum et. Autem nihil tempore et consequuntur laudantium incidunt natus enim. Voluptatem quia rerum rerum dolor iure voluptates dolor iste. Odio commodi inventore et delectus occaecati illo eius explicabo quia. Ut enim enim non eos quae adipisci sunt impedit quia.Tempore ipsum non doloremque aut optio libero dolore. Officia animi hic. Aspernatur rerum alias molestiae dignissimos omnis rem enim est est. Maxime facilis corrupti. Nam qui id. Illum et numquam pariatur mollitia quia soluta distinctio.","2018-08-20"
4651,53,2912062,"Voluptatibus consequuntur iure adipisci nihil magni voluptatum. Numquam ullam perferendis aliquam consequuntur. Placeat eaque dicta.Et deserunt modi tenetur unde facilis mollitia dolorem voluptas quidem. Optio autem voluptas modi assumenda cum necessitatibus. Expedita vel omnis natus quod voluptatem assumenda quisquam. Iusto ut expedita nihil deserunt odio aut omnis voluptas. Cupiditate harum quod est.","2018-08-20"
4652,98,2912062,"At laborum id nam itaque. Ea et rerum ducimus in velit. Adipisci totam eius ea voluptate sit quia voluptatibus voluptas aut. Cumque enim quos et. Repellendus laborum ut et.Expedita nemo quibusdam facere est delectus. Et perspiciatis placeat voluptatem provident pariatur perferendis quo blanditiis. Et voluptatem repudiandae fugit aut quisquam dolores est. Repudiandae voluptatem doloremque consequatur autem aspernatur fuga et eius. Fuga ut delectus sunt rerum sint voluptatibus.","2018-08-20"
4653,74,2912062,"Rerum dolor sit dolor itaque quo occaecati sit. Voluptatem aliquam porro. Et impedit velit commodi quis mollitia omnis architecto. Et placeat officia sit nemo numquam sed culpa eligendi. Sunt amet quis sed perspiciatis distinctio aperiam repellendus vel. Possimus aliquid quia sunt aut aut atque et debitis et.Ut accusantium incidunt nam cum odio velit odio ratione. Error animi nihil vitae id et molestiae pariatur. Eius ipsam quos eum aut ducimus. Quaerat illo fugit dolorem.","2018-08-20"
4654,97,2912062,"Unde rerum eos suscipit perspiciatis. Suscipit cum qui aut doloribus. Corporis aut ut rerum odit numquam autem. Qui laudantium numquam quia. Quod sunt aut distinctio quam omnis quasi. Omnis ab unde optio sit qui rerum sed id aut.At est accusantium eligendi eum. Nostrum expedita sunt rem labore illum. Architecto officia et maxime fugit hic est.","2018-08-20"
4655,62,2912062,"Porro voluptas recusandae odit. Et ullam sit reprehenderit illo laboriosam. Sit qui enim molestiae. Et et excepturi illum sunt voluptas qui optio.Placeat non corporis iste corporis blanditiis. Blanditiis cum suscipit nostrum expedita nulla laudantium similique reiciendis voluptatum. Consectetur illo ab velit quas architecto est. Sed et rem. Labore sunt quos quaerat et molestias. Id nisi alias earum dignissimos dolorum laudantium quia tempora.","2018-08-20"
4656,15,2912062,"Eius laboriosam et aliquid a. Vel quo at facilis quia. Ut impedit molestias est rerum harum eveniet. Excepturi quidem consequuntur ipsum doloribus. Est illum consequatur voluptatum at explicabo in voluptatem mollitia sit. Itaque est et veritatis quis corrupti aut consequatur.Enim aut quam deserunt. Aliquid ullam culpa est consectetur reiciendis. Molestiae iure facere quia possimus ratione. Repellendus quo asperiores commodi numquam occaecati perferendis officiis quo sequi. Placeat voluptatem dolores. Nemo porro aliquam illo et asperiores.","2018-08-20"
4657,58,2912062,"Quis temporibus est expedita. Aut aliquid illo incidunt earum dolor. Adipisci placeat sit velit.Atque commodi rerum voluptatem rem perferendis eius illo et. Velit debitis quam quae recusandae dolor quibusdam excepturi repudiandae. Rerum est quis omnis nam quam. Maxime fugiat dicta voluptatum temporibus error deleniti blanditiis ipsa. Nulla consequatur eos alias enim necessitatibus doloremque nulla.","2018-08-20"
4658,69,2912062,"Error suscipit in omnis repudiandae nihil sit. Molestias et autem dicta et laudantium ipsum laudantium. Ad est voluptas. Dolorem consequatur est ullam aut qui porro ut.Quasi dignissimos ut sed autem ut totam sint doloribus. Quo accusamus deserunt quo. Omnis placeat sit hic. Fugiat laboriosam consequatur animi in ut nisi ut enim. Tempora perspiciatis corporis et. Et neque numquam dolor sed non et quod culpa non.","2018-08-20"
4659,22,2912062,"Aut consequatur minus nihil. Aut accusamus dolor. Atque tenetur tenetur hic veritatis. Doloremque assumenda beatae placeat placeat expedita voluptate ea. Soluta voluptatem distinctio rem id vel consectetur sit dolor sed. Laborum et officiis quisquam iure.Molestias aut velit autem voluptatem enim dicta sit cupiditate. Ab voluptate aut aut harum nesciunt voluptatem voluptatem. Molestiae sit quia et autem. Impedit maiores facere quos qui aliquid possimus.","2018-08-20"
4660,32,2912062,"Eligendi illum aut ducimus mollitia earum. Omnis magni odit. Nemo voluptatibus in.Dolorem cum voluptates quia provident ratione quam similique. Nulla incidunt fuga sed voluptates. Sit corrupti rerum rerum ducimus ullam. Eaque pariatur explicabo rem quia illum.","2018-08-20"
4661,8,2912062,"Qui non repudiandae reiciendis rerum magnam qui impedit animi. Corrupti qui explicabo alias sed id vitae corporis eum nobis. Ut eum laudantium sint inventore sint magnam maxime maiores accusamus.Voluptatum vitae itaque. Dolores dolor maiores et facilis est. Autem eos accusantium. Ut amet esse non perferendis harum et suscipit. Quos explicabo iste repellendus sapiente. Sunt excepturi deserunt neque.","2018-08-20"
4662,58,2912062,"Nostrum qui recusandae repellendus quibusdam velit ullam ab delectus. Error quia ab ut et sunt doloribus aspernatur. Sit vitae veniam in impedit corporis voluptates illo. Cumque omnis nostrum. Animi ad est culpa illum dolore. Alias qui consequuntur facilis tempore in repellendus iste consequatur qui.Consectetur nihil dolor nemo dicta possimus nesciunt blanditiis numquam. Non labore voluptate. Voluptatibus nihil iure suscipit voluptas. Eius ea qui corrupti mollitia. Aut a dolorem voluptatem neque et ab omnis.","2018-08-20"
4663,66,2912062,"Molestias totam quis minus qui omnis ut eligendi numquam. Praesentium voluptatem assumenda quasi sunt. Quia qui totam voluptas non deleniti ratione sint. Consequuntur corporis numquam alias cum totam ut. Qui aut id quo deserunt omnis perspiciatis perspiciatis.Et natus minus et quas accusantium nemo quia eius quia. Ut quasi distinctio adipisci quam error laboriosam ut. Eos sunt voluptas blanditiis. Accusantium qui eius velit deserunt ipsum aliquam sunt ipsam. Sequi sed animi saepe autem hic.","2018-08-20"
4664,47,2912062,"Rerum repellendus non est numquam magni et. Non placeat praesentium nisi similique iure dolorem. Facere dolore dignissimos earum vero porro est. Soluta odio in laudantium aliquam sunt.Quas reprehenderit architecto. Illo et officia est sit mollitia. Maxime et est deserunt laborum maiores. Natus delectus quia voluptatum consectetur soluta asperiores. Nulla repellat qui illo.","2018-08-20"
4665,46,2912062,"Vitae et omnis officiis magni. Architecto sapiente debitis earum. Ex delectus laborum dignissimos expedita veritatis aliquid temporibus dolore. Sint libero ut sunt est et et dolorem.Ea autem est adipisci et pariatur non sunt. Quod velit voluptas sapiente dolorum natus. Et voluptatem numquam dolores fuga dolores. Tempora nihil aliquam quibusdam ea dolores. At veniam porro nesciunt et fuga dolorem exercitationem molestiae.","2018-08-20"
4666,81,2912062,"Ex officiis temporibus deleniti accusamus sequi velit harum esse. Et aut molestiae blanditiis mollitia quaerat sed ad id laboriosam. Sint molestiae vitae.Libero est autem non nisi. Nisi est doloribus nam consequatur. Cupiditate beatae voluptatibus qui eaque ipsam non debitis.","2018-08-20"
4667,51,2912062,"In quod nobis pariatur sit eos quo. Sit quo praesentium. Omnis quibusdam aut est dolor. Corrupti ea ducimus alias. Dicta cumque sunt sapiente voluptas qui. Laudantium libero ipsum inventore dicta magnam.Praesentium ex fugit debitis recusandae deserunt. Quae quia excepturi dolorum cum. Nihil cum id nisi exercitationem adipisci sed quia illo quae. Soluta aut nostrum autem deleniti modi.","2018-08-20"
4668,38,2912062,"Eum eos molestiae. Sit ullam et temporibus. Ea rerum voluptates explicabo modi impedit quibusdam voluptates. Non quidem asperiores aliquam.Consequatur maxime vitae. Libero eos quae est ut maiores magni. Sequi inventore enim assumenda distinctio. Velit molestiae odio.","2018-08-20"
4669,93,2912062,"Reprehenderit consectetur occaecati incidunt et maiores est aperiam. Qui hic recusandae. Nostrum illum est non maxime rem. Odio quas commodi iure accusantium sit adipisci ipsa.Eligendi perferendis cumque. Facere sint aliquid necessitatibus ea voluptate labore consequuntur aut omnis. Sed dignissimos nisi et recusandae aut nulla delectus sunt. Quibusdam quia et et optio numquam.","2018-08-20"
4670,45,2912062,"Veniam dolorem dolorum fugit. Possimus occaecati aliquam id minima. Quia aspernatur quo dicta laboriosam quia minima cumque et expedita. Consequatur sint voluptatem in consectetur fuga facilis est eos.Sit laborum a architecto aut voluptatibus fuga nihil officia. Laboriosam maiores dolor placeat illum quia. Fugit reiciendis dignissimos sed eum. Quo ut doloribus. Non id inventore quos quis recusandae qui. Reiciendis enim esse magnam soluta error.","2018-08-20"
4671,27,2912062,"Ea rerum ut. Nisi eligendi vitae et. Sint reprehenderit rerum ex nihil corporis doloribus nihil. Magni voluptatibus temporibus aperiam.Aut autem aut enim rerum id repellat praesentium sit. Ad dicta molestias ad aut aperiam laborum et. Ab possimus aliquam ea ducimus ipsam et sed dolores.","2018-08-20"
4672,35,2912062,"In et aut accusantium culpa alias enim vel. Eum possimus non qui. Quo iusto sed.Excepturi et exercitationem necessitatibus culpa non. Voluptatum exercitationem labore est quo. Aliquam sit optio itaque voluptatem qui velit.","2018-08-20"
4673,86,2912062,"Animi dolores repudiandae quisquam sint. Molestias blanditiis itaque voluptas error magnam enim eaque cupiditate dolores. Temporibus voluptas doloribus. Accusamus harum inventore rerum.Id a voluptas voluptatem deserunt at ullam non quae. Architecto et ullam omnis. Itaque dolorum pariatur. In numquam ullam eum magnam quis commodi. Laborum fugit dolores delectus voluptate in rerum. Fugit non deserunt.","2018-08-20"
4674,5,2912062,"Quam id aut temporibus qui et voluptatem omnis similique. Eum officia consequuntur est repellendus labore voluptate sit autem facere. Consectetur laboriosam provident aut ducimus natus qui et ipsam. Eligendi natus dolore non aut enim adipisci aspernatur.Neque sint qui similique. Expedita enim doloribus voluptas cumque assumenda et aut quos similique. Dolore accusamus eum illo. Similique amet ducimus repellendus cumque nihil hic reprehenderit id. Quasi non maxime rem sunt dicta. Vel ut tempore quos veniam.","2018-08-20"
4675,35,2912062,"Eius nam porro. Esse tempora veniam. Fugiat minima sed voluptas eligendi maxime debitis. Molestiae sit id necessitatibus deleniti et maiores.Voluptatem voluptatem omnis saepe magnam. Est consectetur voluptatem tenetur rerum voluptatem aut quidem itaque. Nihil rem asperiores ut perspiciatis architecto aut sint doloribus. Reiciendis libero inventore molestiae eveniet labore ut. Nobis pariatur similique autem tempore unde animi deserunt sequi nemo.","2018-08-20"
4676,91,2912062,"Voluptatem et perferendis autem et veniam asperiores ut neque. Et aut velit nesciunt. Sit aspernatur enim. Voluptates pariatur aut voluptatem quia nulla dolor. Aut quo ut quod ea.Architecto et vel. Perspiciatis exercitationem aut eligendi enim rem. Quasi dolorem sunt voluptatem consequatur. Quaerat tempora enim rerum debitis quae libero corrupti eum.","2018-08-20"
4677,64,2912062,"Magnam quis ut sed quia velit. Dicta laudantium ullam quae aut. Quo ducimus voluptatem reiciendis architecto.Esse fugiat voluptates tempore et repellat rem iste. Non explicabo et libero dolor. Non excepturi sed tempora et voluptas iste vel adipisci. Corrupti libero est. Quo soluta recusandae. Et laboriosam ab in omnis qui ut iure repudiandae.","2018-08-20"
4678,15,2912062,"Sint et nihil minus. Cumque enim enim non non aut non excepturi ut atque. Velit et at ullam omnis voluptas ab.Aut cumque illo iusto repudiandae similique ab. Et possimus est animi quis nulla quia cum qui iure. Autem sed eaque autem officia. Reiciendis quis aut. Dignissimos nesciunt ab aut. Odio cum in nisi aliquam nihil.","2018-08-20"
4679,27,2912062,"Aut ipsam quam nobis. Cumque illo quod molestias qui praesentium. Ex est fuga voluptatem officiis unde est aperiam. Recusandae ex perspiciatis ut tenetur. Vero fugiat aspernatur deserunt et qui quae dolor.Sint quaerat velit quae qui et. Nobis et ducimus dolorum ea magni aspernatur. Enim at tempore sunt praesentium dolor.","2018-08-20"
4680,21,2912062,"Optio molestiae optio consequuntur voluptatem est. Quaerat nihil sed doloremque nobis. Dolorem non dolor et ducimus rerum. Nam ab nisi optio ad ut. Nemo reiciendis facilis saepe vitae doloremque et. Sunt suscipit distinctio explicabo doloribus.Eum et vitae qui facere incidunt in libero. Officiis nisi unde eos enim id autem voluptatem rerum ut. Dignissimos vel quia ullam magni eligendi nam voluptas porro. A a et dolorem necessitatibus eius nihil eligendi ratione. Vero nesciunt molestiae veritatis et tempora fuga hic.","2018-08-20"
4681,46,2912062,"Quos aut unde ipsum. Quo hic unde nisi. Ex ipsum labore sit officia dicta. Nesciunt commodi quasi.Dolores quia quaerat excepturi. Tempora quo non officia nobis. Dignissimos aliquam qui dolorem ea assumenda. Omnis id dolor quaerat quo pariatur eligendi omnis. Doloremque aut voluptas molestiae expedita nulla. Alias nihil ex praesentium sit dolor qui veniam.","2018-08-20"
4682,94,2912062,"Quia fugiat iusto iste vel qui. Sit repellendus voluptas dolore vel. Tempore libero sed perferendis sit. Ipsum magni ab natus reiciendis. Omnis labore eos corrupti vel rem sit eos voluptatem aut.Non tempore veniam minus accusantium quos in amet molestiae voluptatem. Ducimus delectus aut delectus ducimus quasi consequatur. Vel voluptatem quas veniam eveniet quam ea architecto nihil perferendis. Reprehenderit corrupti et perferendis ut accusantium debitis quo voluptatibus modi. Architecto libero et exercitationem tempore. Adipisci autem temporibus aperiam aut vero.","2018-08-20"
4683,76,2912062,"Dolorem dolorum sed vero unde amet sit officiis. Id ipsam aspernatur. Distinctio voluptatibus perferendis quia ut voluptates voluptates. Itaque autem voluptates quasi molestiae.Commodi quas voluptatem adipisci rerum id maxime. Veritatis et tempore nostrum numquam dolor. Recusandae qui necessitatibus asperiores temporibus necessitatibus quibusdam ut. Inventore dolores consequatur doloribus similique id. Quas adipisci voluptates omnis aliquid veritatis nisi cum eius eveniet.","2018-08-20"
4684,50,2912062,"Aut in qui optio aliquam eum est provident dolorem dolores. Quibusdam corrupti nisi fuga nostrum nemo. Suscipit modi est perferendis illum illum. Ipsam accusantium velit voluptatem ipsam.Eos maiores alias ducimus et deleniti vero veritatis est voluptas. Nostrum illum labore consequatur qui sapiente similique voluptas eius. Qui laudantium consectetur eos sit saepe quam perspiciatis.","2018-08-20"
4685,48,2912062,"Aliquid accusantium quam id culpa quas temporibus. Qui aut sed et non. Tenetur veniam quidem sed dolores sit aut velit incidunt. Neque mollitia voluptates nobis voluptatem expedita.Quas voluptatem sunt qui temporibus voluptatum. Veniam ut natus repudiandae voluptas repellat. Sed quod eligendi aut enim placeat neque illum laudantium consectetur. Consequatur quis dolore iusto ut expedita inventore possimus cum. Culpa tempora repellendus alias quam sed atque magnam dolorem.","2018-08-20"
4686,63,2912062,"Omnis minus doloremque. Rerum est doloremque quo quasi fugiat. Consequatur commodi enim sed qui. Provident in iusto blanditiis. Omnis eos voluptatem quis sunt praesentium. Quas voluptas rem quos eveniet.Ipsum minus in asperiores aspernatur assumenda. Praesentium tempore eius modi beatae veniam. Quidem non hic nesciunt veniam fugiat consequatur. Qui et perspiciatis magni minima.","2018-08-20"
4687,62,2912062,"Molestiae sequi et soluta provident omnis cum maiores veritatis dolor. Voluptatem rerum rerum officiis rerum in ut quod. Excepturi ut aperiam tempore est at.Delectus autem accusamus ea sed ex beatae autem vero. Dolore non temporibus praesentium est ut. Itaque eos quis. Sunt numquam consequatur cupiditate harum. Cum tempore sed mollitia dicta facilis velit. Provident optio nobis aut est et corrupti.","2018-08-20"
4688,67,2912062,"Architecto nesciunt est in eligendi quas praesentium. Nobis alias ut. Rerum accusantium eligendi enim inventore. Necessitatibus quia ab repellat.Ut nisi sequi officia sed cumque aperiam est ut et. Non nam dolores quia reprehenderit pariatur. Enim quis qui tempore excepturi aut deleniti id quaerat. Nam libero qui facilis vero consequatur consequatur.","2018-08-20"
4689,28,2912062,"Aspernatur blanditiis totam vero. Fuga sed tempore. Inventore nam illum quis.Enim possimus qui libero aut ut. Hic quo accusamus. Tempora rerum dignissimos. Nam iste debitis laborum animi ea at qui enim in. Ut dicta eaque esse ratione provident culpa voluptates.","2018-08-20"
4690,72,2912062,"Nulla aut inventore dolor distinctio ut non aperiam placeat. Dolor blanditiis repellendus. Provident est id mollitia debitis maxime nobis commodi enim libero. A harum natus quo dolores reprehenderit vero laboriosam. Totam eum in optio dolorem beatae aut distinctio pariatur.Dolor id commodi dolores aliquam minus ipsam. Provident provident molestias deserunt reprehenderit nihil harum accusamus. Omnis non quos deleniti et et labore earum tempora. Voluptatem quaerat enim vitae. Pariatur omnis delectus omnis occaecati.","2018-08-20"
4691,64,2912062,"Aperiam aliquid maiores et id quia tenetur dolorem maxime. Aut porro optio repellendus excepturi dolorem perferendis qui ipsam. Ullam repudiandae ab quod quis est et et quo.Exercitationem reprehenderit est nostrum porro consequatur. Assumenda iusto sit corrupti at. Ex libero quia rerum vero omnis. Nesciunt optio optio. Pariatur accusamus sit earum maxime consequatur dolore. Rerum eligendi ut.","2018-08-20"
4692,54,2912062,"Est rerum quisquam nemo atque enim fugiat dolorum omnis. Amet iste aliquam maxime ut ab id. Dolor suscipit voluptas. Recusandae ut qui dolore libero iure.Vel officia sit sunt quas suscipit cumque et. Consequatur aliquam occaecati eum fuga vitae voluptatem voluptas veritatis ut. At distinctio atque alias sapiente soluta. Natus error quia. Incidunt quia quod dolorem odio aut et dolorem quia voluptatem. Eos voluptatibus et saepe iusto id voluptatem nobis.","2018-08-20"
4693,13,2912062,"Et fugiat rem aut nesciunt et ut voluptas animi. Et maiores et consequatur eveniet est ratione ipsa et repudiandae. Eaque ut facilis. Nulla officiis unde fugiat ipsa ex odit. Et sit cupiditate in voluptatem vero.Eaque voluptas in quia temporibus. Aperiam temporibus et possimus officia numquam. Voluptatem ad voluptas totam non. Quia quaerat recusandae. Optio sit qui ut voluptas suscipit illo culpa illo expedita. Alias assumenda harum eos et ad doloremque dolores enim.","2018-08-20"
4694,97,2912062,"At architecto quia quo. Illo officia dolor. Esse molestias et tenetur veniam fuga. Et amet aspernatur eligendi accusantium doloribus ratione est dolorum.Deserunt labore voluptatem quidem ut. Quae ipsam consequatur iure praesentium quia dolor id velit et. Reprehenderit quia atque. Saepe deserunt magnam dignissimos voluptas voluptatum sunt voluptatem. Nulla error debitis autem at in aut. Pariatur ipsum cumque libero ut.","2018-08-20"
4695,11,2912062,"Eveniet debitis rerum dolorem. Accusantium quo laboriosam labore minus. Quam quibusdam odit.Aut dolore eius minus voluptas dolores ad laborum. Assumenda odio non nostrum earum dolores. Modi adipisci aspernatur molestiae. Rem aut atque. Voluptatem in totam quis atque aut reiciendis id debitis aut.","2018-08-20"
4696,39,2912062,"Sit iste magnam. Alias natus mollitia. Tenetur rerum exercitationem quis maiores pariatur ullam temporibus. Explicabo earum qui ea.Delectus explicabo ut rerum voluptate rerum. Facilis nam odio deserunt nesciunt quia est. Eaque ipsum repellat totam explicabo sint libero. Minus rerum dolore libero quo fugit aut. Facere esse modi quod officia est excepturi consequatur corporis.","2018-08-20"
4697,1,2912062,"Consequatur repellendus necessitatibus. Et qui odio ut. Ea nihil dolorem quod inventore delectus. Tenetur eligendi necessitatibus. Repellat molestiae laudantium aut.Voluptatem rerum aut necessitatibus voluptatem eligendi eveniet perferendis quia optio. Quibusdam odio ipsum modi voluptatem iusto. Aut aut commodi voluptatum aperiam repellat et. At delectus qui. Deserunt accusantium natus error alias dolor ea aliquam. Dolor nostrum iste neque dolores tenetur harum incidunt nihil.","2018-08-20"
