"id","user_id","listing_review_id","review_content","review_time"
2695,77,2912036,"Sint at harum sint minima necessitatibus maxime non vero dolore. Sed deleniti totam modi omnis. Ipsam quaerat nobis veniam totam in voluptatibus a. Assumenda voluptas similique saepe nostrum sed incidunt.Assumenda iusto sint ut nostrum ipsum enim labore provident odio. Ut dolor odio dolorem ab tempora et ut. Labore quae quo nobis est ut consequuntur.","2018-08-20"
2696,46,2912036,"Ipsum et ea et ut dolorem dolorem. Expedita rerum non quasi omnis corrupti accusamus ea molestias. Facere sint laboriosam ea omnis sit ipsam. Ea labore dolores nemo aut voluptatibus sunt autem quisquam. Accusamus accusantium distinctio saepe molestias praesentium qui enim. Voluptate quia ut voluptatum molestias facilis.Impedit error sed minus occaecati fuga. Suscipit quo et amet molestiae dolorem est accusantium. Pariatur tenetur labore occaecati. Corrupti exercitationem quo suscipit qui qui voluptas animi voluptas. Quo nemo sapiente nihil nobis eum error qui et quis. Sequi facere facilis est ut.","2018-08-20"
2697,48,2912036,"Odit est eos debitis sunt autem voluptatem. Et praesentium necessitatibus voluptate numquam rerum a enim. Temporibus et suscipit distinctio distinctio iusto nobis velit ut.Quisquam impedit similique iure. Doloribus quaerat laboriosam voluptatem exercitationem nihil. Amet et sint reprehenderit id ab ut tempora natus debitis.","2018-08-20"
2698,55,2912036,"Aut sequi odio ullam aut eveniet illum deleniti sequi quo. Et maxime quo sit. Voluptas hic totam quis delectus vel. Unde accusamus nisi. Facilis eos nobis.Nulla recusandae ipsa necessitatibus omnis dolor iste maiores voluptatibus. Dolorum ea autem vel. Atque sint velit. Eos id aut tenetur non doloremque veritatis in.","2018-08-20"
2699,39,2912036,"Quasi exercitationem dolor doloribus quidem dicta doloribus. Alias dolor nostrum. Qui eum molestias sed ut. Modi magni autem autem quibusdam at totam. Ad amet molestiae officia et. Delectus deserunt voluptatum consequuntur ut voluptas minima.Voluptatem ad rem atque quia itaque qui sit est. Unde nihil vero. Incidunt molestiae necessitatibus commodi minima sequi.","2018-08-20"
2700,61,2912036,"Id consequatur ullam consectetur dolor explicabo et autem ut. Sed quae accusamus blanditiis est rerum architecto aut possimus deserunt. Est inventore dicta sunt eveniet velit magnam. Et corrupti aperiam reiciendis distinctio et quisquam. Est est suscipit deserunt molestias quasi sit.Nihil eos similique rem mollitia saepe sint praesentium quod minima. Sint architecto quia est enim sit. Ratione neque et sed minima deleniti nihil deleniti deserunt. Aut dolore voluptas mollitia. Officia eligendi hic distinctio. Ut provident quos voluptates minima ut temporibus et quia.","2018-08-20"
2701,97,2912036,"Eum sit sit et dolorem quia quisquam accusamus pariatur. Omnis ut a dolor porro id. Beatae voluptate commodi repellat occaecati nihil quis ex ut. Natus dolorum et suscipit omnis eos.Ratione quod ipsa qui ratione quae exercitationem est alias. Accusamus debitis eligendi. Ullam delectus id voluptatem nobis mollitia. Est nobis voluptatibus laboriosam iste nisi et consequatur. Rerum quo fuga veritatis sit qui accusantium.","2018-08-20"
2702,34,2912036,"Corrupti assumenda et deserunt et nisi dolores. Ut blanditiis omnis culpa recusandae magnam quasi. In natus eius similique libero saepe. Ad ullam illo sit repudiandae tempora pariatur est. Quia itaque sit voluptas distinctio quae qui.Quia facere quia sequi voluptatum nostrum. Voluptatem minima molestias qui ad et ea autem eius commodi. Adipisci hic incidunt animi et quisquam. Quia nobis inventore minus in incidunt rem beatae similique. Recusandae voluptates quo optio ullam vitae dolores libero dolores.","2018-08-20"
2703,63,2912036,"Consectetur nesciunt molestias ratione quasi. Eius quos omnis ducimus adipisci aut. Odio perspiciatis voluptatem omnis voluptate minus nihil.Rem quas sed molestiae ut. Voluptatem asperiores qui ab ut eum et ducimus. Laboriosam sit maxime voluptas nesciunt vel porro consequuntur. Necessitatibus eum ex. Dignissimos nobis tenetur autem est est aspernatur repellat. A reiciendis omnis recusandae quidem numquam.","2018-08-20"
2704,94,2912036,"Atque consequatur molestiae rerum modi maiores fugiat ea aut eos. Voluptatem quia blanditiis fuga eius sed corrupti. Quia soluta porro facilis deleniti commodi praesentium reprehenderit consequatur.Voluptatum eius consectetur ut distinctio. Explicabo et nostrum doloremque in asperiores cupiditate voluptatem molestias. Deleniti impedit maiores ab et velit numquam sed et. Animi officia omnis voluptates beatae tempora veritatis deserunt. Nisi cum dolorem et similique eos quis quia.","2018-08-20"
2705,31,2912036,"Explicabo est accusamus error vitae voluptatem velit. Vero dolorum et et doloremque asperiores quia eligendi sequi. Iste sit culpa quis dolor facere quidem. Eaque amet qui et distinctio quaerat laboriosam saepe ut odit. Culpa dolor quidem dicta aliquam laborum ut libero.Corporis esse quo dolore. Non suscipit sit quaerat animi quos non molestiae praesentium omnis. Nisi sint qui reprehenderit qui excepturi. Facilis ullam nihil tempore odit facere dolore ut consequatur voluptatem. Eum nemo ullam. A vitae mollitia nam fugit optio nostrum et.","2018-08-20"
2706,3,2912036,"Autem at consectetur. Deleniti reprehenderit illo quam veniam. Blanditiis est debitis amet recusandae.Eveniet aliquid voluptas autem illum ipsum et. Culpa aliquid neque. A non error officia. Officiis sed fuga aperiam fugit nesciunt pariatur provident nam voluptatem. Sint ut nesciunt iure praesentium et fugit.","2018-08-20"
2707,89,2912036,"Ea ipsum ab occaecati exercitationem ut voluptatem velit. Ducimus voluptatem et cupiditate consectetur dicta omnis. Sit voluptatum commodi quaerat quia similique illo.Suscipit error distinctio fugit ducimus quibusdam aspernatur. Aliquam quibusdam asperiores quos ipsam quisquam. Qui nam consequatur vitae deserunt exercitationem error mollitia et explicabo. Quas maxime et. In omnis qui error nostrum accusantium et et ut.","2018-08-20"
2708,17,2912036,"Ut tenetur doloribus ut occaecati cupiditate sit voluptates beatae velit. Aliquid quia harum quis. Beatae iure placeat quae doloremque. Voluptatem omnis aut consectetur fuga perspiciatis iste accusamus voluptate laborum. Quidem unde distinctio sapiente voluptatem consequatur. Voluptates a hic odit minima itaque et neque maiores natus.Est omnis tempora ipsam et quibusdam. Quod laborum voluptatem itaque dolorem consequuntur accusantium expedita quae sapiente. Ut dolores omnis ab omnis aut. Eos ullam tenetur odio exercitationem. Non est consequatur molestiae. Nostrum sit accusantium nemo.","2018-08-20"
2709,38,2912036,"Expedita totam corporis eaque. Quaerat repellat mollitia voluptatem rerum illum voluptatem. Magnam dolor dicta sint iste est quia et. Est corrupti suscipit. Modi incidunt nemo maxime vitae. Dolorum dolor nisi mollitia cupiditate est doloribus qui.Autem id aut qui. Officiis distinctio corrupti aut cum rerum sed. Aspernatur sed aut ipsa dignissimos cupiditate sint natus dolorem alias. Mollitia eos ea expedita. Quasi ut et repellendus ipsam autem quo molestiae.","2018-08-20"
2710,23,2912036,"Eos reiciendis nemo ipsum quidem enim. Voluptatem quo in. Incidunt dolor voluptatem.Quia dolore exercitationem qui ad. Rerum corporis praesentium quis et ut. Et dicta natus esse similique repudiandae saepe sit eveniet similique. Nobis et voluptas illo dolore ad. Voluptatem dolorem sed ex sunt occaecati dolores laudantium rerum.","2018-08-20"
2711,93,2912036,"Voluptate voluptatem voluptatem. Hic ut porro consequatur voluptatum dolores. Dolor in itaque voluptatibus. Adipisci nihil omnis placeat.Provident maxime amet accusantium et. Iure aut rem odio. Iusto qui est. Consequatur tempore ut enim ut ex libero ut. Quo velit enim recusandae sed distinctio fuga nesciunt. Laudantium deserunt velit reiciendis sunt.","2018-08-20"
2712,8,2912036,"Id voluptates optio nostrum aliquid quod ut optio. Ipsa molestiae sunt iste repellendus debitis. Et consequatur ducimus quisquam perferendis voluptates nostrum incidunt sunt.Qui amet fuga in esse dolorum distinctio ut voluptate dolores. Aut dolorem inventore ipsa saepe et. Quam quo qui distinctio.","2018-08-20"
2713,26,2912036,"In placeat dolor quos quia eaque at. Iusto corporis quos excepturi beatae. Quasi non quidem nesciunt iusto autem explicabo dignissimos corrupti.Accusantium et debitis fugit occaecati at quo officia ipsum. Qui sequi nobis et ab placeat delectus rem explicabo. Aut ea consequuntur reiciendis consequatur enim deleniti nostrum eum aliquid.","2018-08-20"
2714,51,2912036,"Magni totam id. Accusantium eius est dolores doloremque illo temporibus. Facere illo odit natus minus dicta deleniti vero quia. In voluptatibus aspernatur molestiae ipsa cum perspiciatis. Rerum et incidunt velit qui natus nemo quis est culpa. Dolorum et ullam sint.Non rerum quas consequuntur ab corrupti pariatur qui repellat incidunt. Animi quasi consectetur veritatis qui reprehenderit accusantium est. Atque tenetur voluptates rerum eos incidunt dignissimos autem. Ducimus sint quidem omnis enim ipsa veritatis delectus.","2018-08-20"
2715,15,2912036,"Vero maxime blanditiis optio aut qui et vel illum. Pariatur sit sunt repellendus rerum ullam quod quasi quod eaque. Molestiae reiciendis laborum dolorum. Ad dicta nihil velit consequatur consequatur libero enim omnis qui. Qui ut at occaecati voluptatibus nihil mollitia dolores. Sint vel recusandae qui facere quisquam enim minus eveniet.Fuga voluptatem excepturi soluta suscipit eius ea nam esse. Possimus quo libero sequi ducimus autem voluptatem ut dolor est. Distinctio voluptas odit magnam qui. Nobis voluptate ut aut.","2018-08-20"
2716,55,2912036,"Et fugiat corporis. Minus ipsum est quos tempore et. Dolorum nam eveniet. Aut nostrum voluptates.Vel iusto odio dignissimos quas magnam facere ducimus ipsa. Rerum repellat autem vel ut quis. Nisi eum sit numquam possimus voluptatem ut ut. Quis aspernatur autem velit cumque excepturi autem. Ipsam deleniti est aut. Molestiae ratione aut ullam expedita et.","2018-08-20"
2717,47,2912036,"Rerum et ut iusto natus recusandae eos repellendus nobis sequi. Aut occaecati optio exercitationem esse consectetur adipisci laborum nobis. Quo odit laudantium ea sequi quibusdam eum tempora. Reprehenderit nihil quia numquam qui. Occaecati unde et nulla.Alias dolores autem nemo similique ducimus placeat distinctio nemo. Placeat dicta tempora ad omnis odit placeat. Aut qui impedit dolores dolore ullam sint recusandae aut aliquam. Vitae et adipisci quia ipsum.","2018-08-20"
2718,34,2912036,"Rerum ea id molestias minus non ipsum. Eaque laboriosam numquam. Adipisci hic distinctio qui dolorem perferendis temporibus. Ut quas ut tempora aut reiciendis deserunt.Eaque incidunt iusto illum. Nulla est ipsam cumque voluptatem enim. Qui sed est.","2018-08-20"
2719,36,2912036,"Iste fuga eius ducimus debitis. Harum consequuntur quia. Ut aut perspiciatis.Beatae ut recusandae. Praesentium molestiae et placeat excepturi omnis libero enim in. Reiciendis aperiam rerum qui sequi ullam reprehenderit eveniet quis. Ut officia omnis quibusdam consectetur rerum velit.","2018-08-20"
2720,73,2912036,"Soluta cupiditate labore nihil suscipit culpa dolores dolor et. Alias ipsa molestiae dolor nisi rerum. Sit sint aliquid reiciendis. Qui amet id voluptates dolor laborum voluptatem sed et. Ex et facere autem velit dolorem quisquam neque est sequi.Explicabo aut molestias temporibus voluptatem blanditiis quo sit veritatis. Assumenda deserunt et laboriosam natus quasi eum cum. Doloribus temporibus veritatis.","2018-08-20"
2721,99,2912036,"Sit id vel ullam vero officiis et aut. Soluta nihil velit est. Sit nobis ducimus laboriosam fuga minus.Perferendis explicabo amet ab laborum maiores. Consequatur ex consequuntur corporis id minus voluptatem aut accusamus saepe. Vel quam dolor tempore voluptatem ullam qui. Eius dolorem quae voluptatem ut in excepturi molestiae. Aut sed voluptas fugit. Tempora quidem consequatur enim odio amet laboriosam vero nesciunt.","2018-08-20"
2722,91,2912036,"Pariatur vel et optio eaque et. Libero rem ad nemo molestiae qui assumenda qui. Ut sed in qui deleniti exercitationem. Eaque est dicta. Ipsam quos commodi cupiditate delectus.Et et voluptatem aspernatur qui. Qui corporis eius aut qui fugiat iure tempore dolores saepe. Sequi ad incidunt deleniti. Similique eos esse numquam. Dolorum ipsum molestias qui eaque qui et possimus voluptates quod.","2018-08-20"
2723,39,2912036,"Velit non eum illo aut reprehenderit ut ipsa maxime sint. Voluptatibus velit non. Voluptates temporibus explicabo.Commodi rerum aut et. Reprehenderit ut molestias nisi ea doloremque cum. Expedita nobis neque quod sit eveniet. Quidem autem quis quia porro sed tempore ullam unde.","2018-08-20"
2724,68,2912036,"Facilis ut dolor sequi. Quae ducimus dolorum praesentium sapiente veniam ipsam pariatur et nam. Culpa aperiam officiis sint quod voluptates iusto.Odio molestias quibusdam odio pariatur quo enim nisi modi iste. Dolorem qui voluptatum autem sunt. Ut rem sed non mollitia voluptates. Error impedit officia non. Quidem facere velit quae quisquam reprehenderit soluta inventore sint modi.","2018-08-20"
2725,61,2912036,"Soluta dolores quia a. Illum ab harum ut. Dolorem non possimus quis vitae explicabo impedit et.Rerum laudantium et aut consequatur maxime. Ratione autem ut ullam blanditiis. Qui assumenda et quibusdam culpa velit dolor fuga.","2018-08-20"
2726,85,2912036,"Ad aut laborum inventore quis molestias autem aperiam. Dolorem velit culpa autem eius ut qui. Sed corporis voluptatum. Itaque est sint et est. Ullam id temporibus harum qui aperiam aliquam perspiciatis quo id.Et numquam ex. Quia ea soluta voluptatem atque explicabo consequatur et est. Sint omnis excepturi officiis a vitae dolore sed. Doloremque qui commodi sit omnis deserunt aliquid voluptatibus mollitia odio. Suscipit est sapiente voluptatem totam. Enim dolor sed aliquam quaerat similique.","2018-08-20"
2727,51,2912036,"Quam debitis maiores non. Architecto dignissimos doloremque itaque suscipit culpa enim porro quod qui. Sed facere non dolor. Libero dolores et id. Quae est aperiam quod et rerum totam ducimus est. Voluptatem omnis qui rerum quis.Esse fuga fugiat tenetur vel aut. Labore porro dolorum sunt minus animi et dignissimos sunt. Totam eveniet quas placeat iure eos. Reiciendis voluptas odio sequi quae. Quis et id repellendus iusto beatae voluptas et recusandae in.","2018-08-20"
2728,3,2912036,"Ab corporis perferendis maiores qui velit aut et nisi illum. Dolorem deserunt officia. Officiis ad dolor tempora aut quia molestiae odit ut neque. A reiciendis aut eum et earum maxime quis sed corporis.Distinctio animi harum laborum est iure praesentium libero ut. Omnis et iure incidunt eum in maxime iste nesciunt quia. Non aliquid est eum voluptas voluptatem quos recusandae culpa. Numquam eos dolores incidunt deleniti possimus tempore. Corrupti mollitia velit itaque et nobis aspernatur ut. Sint velit tempora voluptas excepturi.","2018-08-20"
2729,64,2912036,"Quibusdam incidunt magnam quia repudiandae odio sapiente sint quod. Molestiae autem dolor dolorem aut quia neque iste est. Molestiae eaque incidunt eius doloremque odio.Nostrum a et minus. Odio vitae qui accusantium laudantium eligendi dolorem mollitia commodi. Enim laborum rerum nihil id quo quisquam officiis. Debitis rerum atque autem non et quia voluptatem illum. Placeat voluptates libero velit quas veniam id nemo.","2018-08-20"
2730,50,2912036,"Animi consectetur earum laudantium laudantium possimus laboriosam. Quasi recusandae qui provident quasi dicta qui. Nemo at tenetur sint eos quibusdam. Quis qui ut ipsam et eum ea.Fugiat perferendis dolorum. Qui iure blanditiis vel. Aut perspiciatis aliquid impedit praesentium laboriosam voluptates unde corrupti.","2018-08-20"
2731,11,2912036,"Qui provident voluptas asperiores. Tempore voluptatem distinctio commodi. Architecto id doloremque sed est alias natus. Iure et commodi odit enim adipisci. Voluptatem commodi voluptatem.Officiis minima cumque corrupti nihil tempore numquam ut et aut. Magnam molestiae aliquid vel ipsa nihil ducimus aut. Pariatur omnis sit voluptatibus. Ea nostrum illo in. Ipsam deserunt natus dolore.","2018-08-20"
2732,26,2912036,"Aut earum et id ut reiciendis non. Impedit sequi consequatur doloremque eos alias. Ut dicta sint veniam voluptas qui. Voluptas cum suscipit animi omnis eveniet.Est ut minus earum ad. Doloribus odio ut sint eos cum itaque porro quam voluptatibus. Accusantium enim sunt. Corrupti nostrum sit. Minima sunt nemo libero veritatis neque natus cumque aliquam nemo.","2018-08-20"
2733,58,2912036,"Eaque ut sunt consectetur molestiae. Et quod ducimus aliquid odit doloremque. Quod animi non ex temporibus incidunt blanditiis libero vitae. Alias qui earum doloremque est ipsa ducimus animi praesentium aliquam. Minima ut cupiditate quia magnam rerum dolores est et natus.Et architecto in nulla necessitatibus voluptatibus sint enim iste. Quis consequuntur consectetur ut. Vero repellendus quis nemo expedita distinctio sapiente hic repellat harum. Veniam voluptate id optio mollitia laudantium.","2018-08-20"
2734,8,2912036,"Eum eos dolores dolorem officia id minima aut sint. In esse hic in neque pariatur doloremque modi optio et. Et veritatis beatae animi qui. Quia id voluptatem atque amet odio harum aut. Sit laborum adipisci quibusdam qui officia ipsa aliquam molestiae.Modi ea nemo iste. Est qui consequatur nisi non distinctio dolor animi aut. Voluptatem totam eligendi eveniet laudantium qui quo adipisci.","2018-08-20"
2735,62,2912036,"Dolorem omnis et tenetur inventore iure non sed. Exercitationem minus quis aliquid voluptatem. Quia ipsum magni dolore voluptas sit. Ea id perspiciatis rem quidem ad et quos enim.Quia sit vel omnis. Dolor labore rerum voluptas voluptatum ut. Est et voluptas.","2018-08-20"
2736,57,2912036,"Est eum ea commodi aut expedita exercitationem aliquam fugiat deserunt. Suscipit sint ut molestias quis placeat doloribus rerum repellat autem. Ut consequatur nostrum vel. Non autem soluta distinctio qui cumque nam.Et suscipit et culpa aut quod dolore optio ut esse. Rerum ut harum sed sit voluptate doloremque. Vel facere rem nostrum adipisci non necessitatibus reiciendis molestiae. Et molestiae omnis nemo. Laudantium vero iste laudantium atque ducimus ut doloribus odit ex. Suscipit numquam ea a eos.","2018-08-20"
2737,62,2912036,"Asperiores sit eos voluptate sunt error tempora eaque. Provident sint debitis error perferendis sit. Placeat dolor qui tempore voluptatem deleniti magni omnis fugiat sit. Quis ipsum non totam.Veniam eveniet odio. Ab commodi ducimus nam. Atque qui autem.","2018-08-20"
2738,56,2912036,"Ipsa qui consequatur in inventore quisquam consequuntur qui labore. Perferendis voluptatem impedit excepturi quia aliquid. Enim qui sit totam ut.Dolorum sit nesciunt omnis quaerat nam voluptatem quasi cupiditate. Consequatur dolorum sed. Voluptas quo sed enim blanditiis dolor aut numquam veritatis numquam. Blanditiis placeat et ut blanditiis corporis fuga. Rerum qui a nobis. Est laborum iure eius.","2018-08-20"
2739,29,2912036,"Sit sint et porro. Aut magni aut at incidunt aperiam explicabo. Qui dicta et sapiente ut autem explicabo. Ipsam ducimus eveniet iusto.Ipsum dolorum minus magni maxime. Ut eaque eaque numquam ratione dolore consequatur eos reiciendis et. Libero nostrum modi sint repudiandae qui corporis sunt. Et odit voluptatibus quisquam. Voluptates consequatur optio repellat accusamus assumenda eius et ut a.","2018-08-20"
2740,39,2912036,"Nihil voluptate rem culpa consequatur. Quia inventore ad aut. Ut ut velit. Et quidem quia sint magnam illo corporis occaecati. Inventore ad ut saepe eos.Numquam facere unde et id. Tenetur excepturi eveniet. Maiores vitae iure voluptate et quia. Esse non adipisci distinctio in quisquam alias. Est dolorum reprehenderit debitis quos.","2018-08-20"
2741,10,2912036,"Assumenda fugiat occaecati. Non laboriosam dolorem ea vitae aut ipsa libero. Quo molestiae ipsa nobis modi vero ea reprehenderit nisi officia. At voluptatem velit. Eos autem ea quibusdam possimus et quam rerum possimus in.Voluptatem molestias consequatur sed voluptate nihil voluptatem ipsum voluptatem aspernatur. Iusto et ut quia. Quasi ut ipsam.","2018-08-20"
2742,66,2912036,"Dicta at cum et architecto eum commodi consequatur. Alias nesciunt provident officiis minima fugit vero. Et suscipit non temporibus ipsam praesentium aut sapiente labore. Ipsa accusantium animi eos. Voluptas qui ullam consequatur at ullam accusantium. Incidunt recusandae rem aliquam tenetur reiciendis expedita qui consequatur perspiciatis.Quia quod deserunt repudiandae debitis omnis et. Molestias reprehenderit atque architecto provident. Eius qui fugiat eum quo quis ut nobis blanditiis. Dolore velit iure dolores sed vitae qui ea tempore.","2018-08-20"
2743,27,2912036,"Ex nam voluptatum nihil ducimus. Suscipit ex repellendus velit qui. Eum aliquid laborum illum voluptas quo consectetur tempora.Ex ipsa aut. Dolorem voluptatibus dolorem vitae sunt maxime perspiciatis eveniet ab illo. Est et est reprehenderit quo voluptas.","2018-08-20"
2744,95,2912036,"Est cum ipsa rerum molestiae. Rem perferendis repellat recusandae aut architecto. Aliquam cum et et consequatur dolor eveniet.Aliquid ut qui dolorum rerum qui et. Neque illo sapiente aut odit ut quibusdam. Repellendus tenetur ea cum omnis et cum sint non. Ipsa quas est eum. Neque voluptas sit porro optio aliquam quia illum ut.","2018-08-20"
2745,69,2912037,"Omnis harum qui eveniet eos ea. Sunt inventore consectetur quia qui ut nesciunt ut sit nostrum. Autem quos nihil sequi quam laborum rerum dicta at quis. Quam magnam blanditiis. Reprehenderit velit hic perspiciatis libero. Est et omnis et optio debitis.Eos earum minima recusandae error itaque voluptatem eius dolore distinctio. Nulla earum non nostrum. Voluptatibus recusandae ex temporibus deleniti. Ea voluptas voluptas odio blanditiis laborum.","2018-08-20"
2746,99,2912037,"Voluptas ab similique ea voluptatum. Sed nihil facere nam ab. Ea exercitationem nam ut dolore eum alias.Dolores aspernatur ea assumenda consequatur asperiores quis. Nisi repudiandae doloremque non quia mollitia deleniti doloribus. Eaque iure quam. Et quis mollitia culpa rerum. Nisi consequuntur quis dolorem fuga dolor est asperiores dolorem necessitatibus. Veritatis ullam dolor minus perferendis neque.","2018-08-20"
2747,10,2912037,"Et assumenda dignissimos dolores sit consequatur iusto ut expedita. Et deleniti aut cum. Accusantium est ut repudiandae aut quia ut modi et voluptas.Corporis odio maxime voluptas qui ipsa id. Nihil sed omnis non et. Laudantium dicta animi qui odio corrupti.","2018-08-20"
2748,44,2912037,"Consequatur ut sapiente. Eligendi voluptas odio dicta non nisi quis id. Voluptatibus velit quae at aut aut vero tempora aspernatur. Beatae fuga soluta quia repudiandae aliquam tempora. Doloremque rerum qui consectetur. Quidem in et voluptatem.Et laborum debitis cumque mollitia assumenda. Aut provident vel aliquam libero est repudiandae autem eius. Consequatur sint excepturi ut asperiores quod. Laudantium error aperiam ab modi rem.","2018-08-20"
2749,19,2912037,"Repudiandae et fugit optio autem qui. Unde qui vel odit. Blanditiis occaecati quia modi. Illum numquam eius ullam rem eum cumque distinctio. Qui at voluptates veniam molestiae rem accusamus earum. Rerum accusamus cupiditate est dolor.Reprehenderit reprehenderit quia. Sunt unde et nemo laudantium. Atque alias dolores cupiditate atque. Aliquam nihil quam sequi eum et recusandae. Aut velit voluptas quisquam labore est.","2018-08-20"
2750,46,2912037,"Voluptatum itaque sed velit accusantium eligendi non delectus. Temporibus consequatur omnis suscipit omnis. Quas porro consequatur vitae inventore a reprehenderit. Accusantium doloribus et a minima. Doloremque quo a magnam ratione et voluptas nesciunt libero labore. Quidem doloremque qui dignissimos odio tempora nobis autem qui.Hic voluptas doloribus. Ducimus consequatur aut et dolorum voluptatem sed quasi iusto eveniet. Animi ducimus deleniti ipsa et ut magnam dolores ea ex.","2018-08-20"
2751,7,2912037,"Nostrum maiores a assumenda magni fugiat illum. Consequatur error autem suscipit. In magnam ipsam porro natus.Non a non aliquid. Culpa nulla non sit cumque voluptatum iste eum expedita. Non est odit repudiandae rerum nihil autem nesciunt. Vero deleniti enim quae in velit vel in consequatur. Perferendis ex laboriosam. Consequatur iure illo hic non molestiae.","2018-08-20"
2752,69,2912037,"Iste aut ipsa odit suscipit tempora voluptates. Ex est porro dolorem illum. Placeat autem sed rem. Minima et repellendus.Rerum atque expedita odio impedit. Perspiciatis nulla rem vel nisi asperiores in sunt unde. Voluptatibus soluta omnis libero omnis voluptate. Labore rem debitis. Necessitatibus natus reprehenderit velit voluptates suscipit.","2018-08-20"
2753,76,2912037,"Aut est blanditiis maxime qui numquam et. Dolores quo reprehenderit consequatur consectetur suscipit corrupti est explicabo. Quia et asperiores nobis dolor rerum nisi.Facilis repellat labore. Eum ducimus aspernatur. Earum ipsum quibusdam.","2018-08-20"
2754,22,2912037,"Ea est enim vero aut accusantium saepe. Sed laboriosam vitae ex. Nulla voluptate iure laborum asperiores minima earum qui est. Rerum vitae culpa quis sapiente. Necessitatibus perferendis sapiente.Aliquam aut ut possimus consectetur. Perspiciatis et quo et quibusdam sit aut. Quae ut voluptatem iusto facilis.","2018-08-20"
