"id","user_id","listing_review_id","review_content","review_time"
4998,70,2912066,"Quo enim quia animi voluptatum aliquam non et. Repellendus doloribus sunt ullam minima corrupti. Rerum ipsa nihil.Omnis minus et. Officiis commodi tempora optio iusto beatae velit pariatur quaerat deserunt. Aliquam aliquam ea.","2018-08-20"
4999,67,2912066,"Debitis sint ut. Sunt nam velit est explicabo in. Tempore vel aperiam eius possimus.Dignissimos hic quae facere laborum quod soluta esse tempore est. Et magnam ullam modi quo doloribus. Sit et nihil expedita quasi qui quidem voluptatibus incidunt qui. Sed sapiente voluptatum occaecati. Quam fugit dolorem delectus nulla.","2018-08-20"
5000,22,2912066,"Et rerum in consequatur atque soluta deleniti repellat. Maiores consectetur a ut omnis quaerat commodi. Beatae odio aut sapiente in ab voluptatibus. Ab adipisci consequuntur et commodi nisi non enim illum. Aliquam similique ut nobis non ea nihil ipsam est quidem.Sed tenetur rerum reprehenderit aliquid voluptates voluptas enim sit qui. Qui delectus quaerat quisquam quidem. Vel ex id.","2018-08-20"
5001,96,2912066,"Voluptas sed et et aut qui. Libero aliquam amet odio incidunt eos ut. Adipisci reprehenderit consequatur quasi. Fuga provident neque voluptate et earum fugit. Voluptates rerum impedit. Quisquam quam sint necessitatibus qui consequuntur aut.Eligendi adipisci enim doloribus iste omnis qui. Eos sequi sapiente qui eum veniam eos aut. Aut voluptatem animi. Perferendis libero consequatur aut perferendis suscipit. Et id ipsa architecto doloremque est.","2018-08-20"
5002,92,2912066,"Illum eum culpa sapiente quis asperiores dolorum. Hic vitae maiores. Dolor vero sed nihil autem voluptas aut qui.Est ducimus deleniti ipsum ex recusandae eaque quia eligendi. Numquam nam consequatur cupiditate sapiente et at. Nisi ut culpa corporis molestiae alias voluptatibus aut a. Libero harum tempore maiores error occaecati explicabo ratione. Tenetur in et eaque vel eligendi tenetur et reiciendis.","2018-08-20"
5003,88,2912066,"Dolores vel quisquam voluptas vero nihil. Praesentium sed consequatur dolores architecto. Ut similique rerum est facilis velit quia libero rerum tempore. Cum recusandae harum. Eaque suscipit eum consectetur. Et et doloremque ut dolores ratione sapiente.Dicta vel quia amet tempore explicabo ut officia optio quisquam. Dignissimos dolor repellendus aut facilis qui. Ratione odit nihil. Harum est adipisci vitae voluptatem doloremque tempore eos veniam voluptates. At eum quo reiciendis voluptatem enim sit. Distinctio earum fuga ut et eligendi quidem provident.","2018-08-20"
5004,34,2912066,"Nemo et ipsa ipsa nulla itaque molestiae aut earum fugit. Provident pariatur qui dignissimos ullam et molestias provident. Dolorem placeat et. Voluptate error consectetur sapiente qui ea quia quis excepturi aliquam. Ea enim tempora voluptate accusantium et molestias ipsum molestias.Velit impedit id voluptates eum non consequatur illum eos. Doloribus in deserunt aliquid modi dolorem omnis. Pariatur quibusdam rerum minima inventore excepturi. Quod et nam adipisci ipsam sint illo. Placeat explicabo numquam ratione ut veniam est nulla vel voluptas.","2018-08-20"
5005,72,2912066,"Vel ea aliquid. Quia aperiam consequatur ipsa magnam laudantium ut perferendis. Voluptate nobis illum laborum eius inventore. Voluptates sequi error earum consectetur eaque.Non voluptatibus nisi beatae assumenda. Aspernatur quae reprehenderit magni nam est libero harum. Ab sed qui voluptatem dolorem voluptate sed placeat sed. Qui quisquam suscipit temporibus.","2018-08-20"
5006,33,2912066,"Enim id suscipit mollitia quidem ea aut. Nostrum maxime consequatur excepturi. Consequatur aut eaque qui ut et omnis. Unde eveniet laborum harum magnam. Soluta explicabo aut sed. Cum odio sint.Neque harum sunt incidunt quo molestias nihil voluptas sit dolores. Cupiditate sint magni adipisci velit at eum. Vitae harum quia officiis.","2018-08-20"
5007,87,2912066,"Facilis et saepe dolores nam nesciunt alias provident exercitationem rem. Tenetur porro eligendi esse. Et facere in. Quod iure aut sed porro est dolorem. Ex maiores exercitationem ipsum. Repellat et ut eos quis harum.Nostrum doloremque ut quibusdam quia natus repudiandae mollitia. Natus voluptatibus pariatur facilis nemo cumque voluptatum quia. Eos neque ipsa eos eos. Dolorem ad non. Maxime autem soluta dolor est error perspiciatis expedita veritatis. Aliquid autem eligendi quia.","2018-08-20"
5008,91,2912066,"Et vel veniam ut eos ea excepturi esse sint. Facere saepe ut libero inventore. Ut voluptas harum tempore sit. Odio harum sit officia veritatis consequatur non eligendi quo aspernatur. Commodi quo aut magni a.Iure excepturi non vel. Harum tenetur nihil quia. Ducimus sequi cum consequatur qui rerum soluta hic. Et odit est cum in quia.","2018-08-20"
5009,65,2912066,"Dolor labore repudiandae accusamus dolorum et ea cupiditate. Et maxime ratione repellendus. Excepturi et perferendis et aut dolores. Dolorum et architecto molestiae quia earum.Tempore molestiae esse assumenda voluptas nam culpa. Natus eius qui. Aut voluptate omnis aut. Aliquam ullam repudiandae distinctio enim. Commodi quo non occaecati.","2018-08-20"
5010,8,2912066,"Labore velit itaque. Facilis nesciunt incidunt nisi quo ut dolores quo asperiores sapiente. Explicabo reiciendis qui. Incidunt cumque recusandae sed. Nulla eum quia neque molestias voluptas. Aliquam dolor optio ea voluptatem deleniti quasi eveniet labore.Labore sint saepe eum ut fugit asperiores rerum rerum. Laborum cumque velit nihil minus soluta tenetur aliquid doloribus. Officia veniam voluptas et temporibus dolorem perferendis omnis.","2018-08-20"
5011,48,2912066,"Soluta aliquid aperiam iure. Illo molestias maiores expedita aut et eos a. Dolores odit dolores vel enim. Totam pariatur autem odio et doloremque.Voluptatem qui et. Ea sequi laudantium consectetur. Nostrum itaque eveniet ut architecto molestiae. Ut ea non quis soluta blanditiis quo est facere ipsam. Ducimus accusamus totam aut qui vero quidem itaque placeat.","2018-08-20"
5012,46,2912066,"Explicabo rerum odio. Vitae qui dolore ratione totam distinctio labore amet minima. Vitae qui nostrum dolore quibusdam sunt aut est. Dolores fuga est labore iure. Impedit cupiditate dolorem ullam impedit. Saepe libero sit ut ullam voluptatibus quasi.Nemo illum cum ipsum. Fugiat autem eaque sit. Quod soluta vel quis est iste aliquam.","2018-08-20"
5013,74,2912066,"Molestiae sit veritatis molestias beatae omnis omnis est. Ducimus est repudiandae quaerat illo hic optio totam repudiandae. Veritatis quas sequi eaque quia.Labore veniam velit. Qui veniam voluptatem. Ea quas ut praesentium. Corrupti doloribus qui consequuntur non voluptatem impedit et. Qui et sint possimus voluptatem optio sed. At maiores libero sunt rerum ut cupiditate laboriosam.","2018-08-20"
5014,22,2912066,"Velit deserunt optio error. Sed sit inventore. Nemo quia voluptas magnam placeat maxime quis sint fugit ut. Nobis placeat facilis iusto consequatur numquam dolor. Est distinctio repellendus ut dolor repellendus.Dolorem nobis pariatur sed quas necessitatibus consequatur officiis qui. Ut illo rerum voluptas nam. Culpa ad voluptatum ratione voluptate distinctio dolore est debitis. Natus iusto perspiciatis in quia quibusdam delectus. Atque officiis in.","2018-08-20"
5015,8,2912066,"Temporibus aut sunt sunt accusantium et atque. Est ratione voluptas eveniet et consectetur eos. Consequatur et perspiciatis quo quidem labore soluta quia magnam consectetur. Dolores aut molestiae veniam aut beatae aut ipsum architecto.Assumenda nesciunt voluptatem possimus molestias et et magni. Voluptas culpa itaque et ut ipsa. Quia possimus voluptates veritatis ipsum. Voluptate autem architecto distinctio dolores ex modi odio rerum.","2018-08-20"
5016,59,2912066,"Dolore quia doloremque maxime consequatur corrupti atque assumenda ut. Similique soluta earum eos. Asperiores sint molestiae ut. Voluptatibus cum vitae nemo. Voluptatem ea qui ut et deserunt accusamus. Doloribus culpa consequatur.Voluptas autem accusamus dignissimos voluptatem commodi. Qui aperiam dolor vel. Ipsa consectetur ut alias deserunt sit.","2018-08-20"
5017,77,2912066,"Et ut sunt. Ipsam sint incidunt corporis rerum perferendis. Quia est consequatur molestias voluptatum tempore tempore iure. Voluptatum totam excepturi aspernatur accusantium incidunt aut. Ut rem est doloribus dolorem aliquid natus.Sunt in minus et aut sit. Ipsam iusto similique nemo sed. Ea ut rem asperiores dolore qui dolorem deleniti. Animi fugiat recusandae nihil rerum accusamus. Possimus at aut dolores dicta et consequatur officiis ea laborum.","2018-08-20"
5018,55,2912066,"Qui rerum porro ut nostrum cum earum sit ut. Eligendi a voluptatem quia in quas est numquam quos pariatur. Et et est non. Odio omnis quo fugit cumque molestiae doloribus commodi perspiciatis tempore. Ut deserunt sed ducimus voluptate. Nemo cum et asperiores impedit nulla in impedit in.Corrupti dignissimos et aut veniam voluptate libero. Commodi ut amet omnis ut rem. Omnis voluptatem quasi est vel neque ullam. Beatae eum harum omnis quidem fuga.","2018-08-20"
5019,72,2912066,"Minima dolores maxime voluptatem non. Expedita velit numquam laboriosam quis. Consectetur neque omnis omnis vel molestiae id eum ut molestiae. Aperiam consequatur et dignissimos aut nulla ea autem. Iste id et nam sit debitis sed itaque. Fuga aliquam natus incidunt ut numquam est aut.Ea vero et laboriosam animi ex omnis iste quaerat possimus. Ea quia consectetur id vero libero. Praesentium at sequi eum id ut omnis qui quis. Sunt tempore maiores quaerat occaecati et aut vitae ipsam esse. Natus dicta laudantium quia sunt nobis aut cum. Nulla sed iusto quis.","2018-08-20"
5020,34,2912066,"Quibusdam dolore nobis laboriosam totam aut atque. Blanditiis vitae ipsa. Labore aut id error. Cumque perferendis alias quia.Exercitationem autem doloribus qui consectetur. Porro sed et earum sint autem quis a magni. Sunt est quia eveniet non perferendis sint eveniet iste sunt. Aut voluptatem et vero ducimus nemo deserunt asperiores amet esse. Velit ducimus sed molestiae ipsa veritatis.","2018-08-20"
5021,80,2912066,"Illo assumenda ut maiores facilis. Aperiam voluptates explicabo deserunt. Eveniet alias corporis iusto a minima. Et dolorem illo qui ut quaerat magnam fugit vel. Velit deserunt totam. Blanditiis qui minus neque facilis.Natus commodi quasi laborum tenetur nostrum explicabo beatae. Accusamus harum dolor dicta temporibus nobis quasi. Consequatur fugit corporis consequatur id. Non quibusdam nulla iure consectetur nihil accusantium sint deserunt.","2018-08-20"
5022,98,2912066,"Est necessitatibus numquam unde vel sit magni aut distinctio. Necessitatibus earum nobis tempora dolorem asperiores et facere. Sit nisi dolore corporis in. Dolore eius eos similique cum eveniet exercitationem et et.Iusto quo ducimus est voluptas officia autem ut. Deserunt minus hic. Veritatis et est itaque nihil temporibus. Assumenda dolorem quis. Quis vel totam eligendi et nemo voluptates unde molestiae.","2018-08-20"
5023,55,2912066,"Maxime voluptas voluptatem dolor libero ut quasi aut tenetur. Delectus aut voluptates. Molestiae qui sit ipsam incidunt debitis possimus quae. Qui impedit optio ut sed explicabo sint. Sapiente sapiente vero cupiditate quisquam et. Vel debitis neque.Ducimus aliquid doloribus non non autem repellendus inventore dolor. Possimus aliquam aut et sint vero aut aut cupiditate modi. Est aliquam qui quae cum dolorum natus possimus distinctio optio. Et eveniet recusandae ab non consequuntur. Quia assumenda voluptatem est dolor sint enim nulla.","2018-08-20"
5024,44,2912066,"Et est rerum ut numquam. Eligendi dolore quo doloribus exercitationem quia. Eaque sit aut doloribus rerum quod aperiam autem veritatis. Cum velit quaerat. Est tempora harum quia a harum voluptatem.Totam non officia ut non dolorem vel deleniti corrupti. Voluptatem sed sunt qui et distinctio molestiae hic. Voluptatem minus error. Iste a corrupti quaerat. Impedit a sit suscipit impedit ipsam rerum voluptas ut voluptate.","2018-08-20"
5025,24,2912066,"Eaque aut facilis velit molestiae doloremque. Odio itaque et unde ut totam aut adipisci rerum voluptate. Atque autem qui veritatis ipsum praesentium sit aut.Necessitatibus mollitia iusto culpa adipisci et recusandae. Beatae saepe sed fugit dicta alias minus aspernatur quas. Enim repellat mollitia.","2018-08-20"
5026,97,2912066,"Et quasi unde. Eius pariatur alias quisquam dolor perferendis et quo. Est consequatur in.Veniam sapiente aut similique sequi qui velit illo quas. Suscipit facilis et. Rerum voluptatem id officia. Sint modi impedit culpa voluptatem. Modi doloremque libero impedit repellat maxime et voluptatem dolor. Officia aut aliquid laborum odio velit enim maxime quo.","2018-08-20"
5027,18,2912066,"Ut reiciendis et qui. Et voluptas quos mollitia minima laudantium necessitatibus sit facilis. Culpa et ex doloremque quos qui illo et.Mollitia sit nostrum quaerat. Vel tempore eos. Ipsa ut voluptates omnis sequi nulla sit. Aut commodi in. Deleniti dolorem commodi sed at aut ducimus.","2018-08-20"
5028,23,2912066,"Ipsum quam neque ratione odit doloribus perspiciatis. Temporibus ut illo et eum odit similique. Dolor est iure similique repudiandae. Delectus et aut modi fugiat. Quo soluta ut aperiam nemo necessitatibus non. Est itaque similique ut et debitis dolorem assumenda voluptatum tempore.Libero quos quidem ipsum dolores. Ea consectetur iste repellat tempore quos tenetur laborum voluptates atque. Corrupti dolore minima nobis quae quia praesentium quia facere.","2018-08-20"
5029,54,2912066,"Est incidunt aut velit incidunt. Dolorem rem minus omnis exercitationem. Velit ipsa ullam earum temporibus omnis dolor. Ex reprehenderit esse est.Veniam cumque in voluptatem voluptas necessitatibus. Praesentium et reiciendis aut. Aliquam nihil omnis earum. Reiciendis ut eaque dolor et. In consequatur est rerum rem quo tempora consectetur. Maxime rerum iusto quia ipsa illo aut soluta.","2018-08-20"
5030,100,2912066,"Similique impedit quis ducimus et at architecto ex ullam. Corporis est adipisci. Possimus quam natus iste.Dignissimos nobis sit quidem veritatis consequuntur. Ipsa eum provident corporis similique sint facere et hic. Dolor perferendis deserunt. Impedit omnis corporis occaecati eveniet.","2018-08-20"
5031,15,2912066,"Similique quos velit itaque nihil reiciendis eius consequatur voluptatibus cupiditate. Dignissimos reprehenderit tenetur maxime occaecati inventore minus rem vero. Minima reprehenderit tenetur vel veniam velit aut aspernatur quo quidem. Sequi sunt sed id sit. Maiores voluptas a praesentium et perspiciatis rerum illo officia.Tempore occaecati et est tempora. Enim perspiciatis tempore ab vel cumque. Vero eos eum aliquid sint. Asperiores molestias ut asperiores est nesciunt quam. Autem incidunt accusamus totam quo. Dolores reprehenderit voluptatum consectetur dolore dolorem quae rerum voluptatem labore.","2018-08-20"
5032,65,2912066,"Voluptatum voluptatibus et officia. Doloremque voluptas voluptas in consequatur quis error blanditiis. In similique vel delectus libero eligendi. Numquam soluta consectetur alias. Numquam sit animi at.Qui ipsam dolorem voluptatem nobis voluptas voluptatem qui magnam dicta. Sunt molestias non. Enim optio ex ipsa optio voluptates recusandae. Quam delectus veritatis.","2018-08-20"
5033,89,2912066,"Eaque tenetur error nesciunt praesentium dolores laborum quia autem. Sed vitae quia dolore iusto consequatur et similique nihil. Voluptatem ut quibusdam labore nemo quos laudantium numquam sed. Neque reprehenderit voluptas voluptatum dolor. Possimus voluptatem doloribus nihil dolore possimus sed.Quod ullam optio harum iusto. Voluptates excepturi quia dolorum vel sunt. Consequuntur ea impedit hic quod tenetur omnis. Laborum distinctio cupiditate modi qui consequatur autem maiores amet quod. Sit repudiandae laudantium voluptatem harum consequatur libero. Est voluptas dignissimos praesentium sit.","2018-08-20"
5034,86,2912066,"Veniam optio in qui omnis alias. Nulla nobis veritatis amet omnis. Cupiditate nesciunt excepturi et quo.Aut voluptate qui quia quis tenetur quia enim. Quo eos mollitia eum. Impedit alias commodi sed natus cum ipsum repudiandae vel dolores. Beatae ea libero dolores facilis ea est nisi laboriosam.","2018-08-20"
5035,26,2912066,"Itaque odio id soluta aspernatur qui cumque omnis ad. Et ducimus enim qui ipsum. Id sunt quia rerum molestiae porro. Vel repellat maxime occaecati deleniti impedit deleniti qui praesentium tempore. Officia ut delectus voluptate ratione nihil aperiam. Aut et laboriosam eum et ducimus nobis sed nemo.Deleniti ipsum ut cumque culpa cupiditate voluptatem. Repellendus fuga voluptates porro aspernatur incidunt voluptas. Recusandae ratione quia. Voluptatem perspiciatis deserunt repudiandae. Cupiditate quas consequatur fugit deserunt.","2018-08-20"
5036,50,2912066,"Distinctio quisquam voluptas ipsum amet labore quis. Ipsa incidunt enim eius ab. Molestiae error praesentium. Sapiente ut exercitationem doloribus.Voluptatum eius qui velit fugit rerum. Vel et fuga voluptate aut quia error vel deleniti est. Corrupti et repudiandae recusandae pariatur ut. In dolor sed animi. Qui aut eaque.","2018-08-20"
5037,7,2912067,"Est dignissimos saepe vel qui optio dolor delectus totam. Explicabo ipsum dolorem. Enim qui dolore quidem dolorem. Quia veritatis laborum.Beatae tenetur quod eum. Est id saepe. Deleniti maxime unde non possimus autem. Ipsa voluptatem a eos dolores et aut deleniti impedit esse.","2018-08-20"
5038,42,2912067,"Qui repudiandae tenetur id quae cumque praesentium aspernatur sapiente. Cumque dolor aut aut corporis. Quod facilis voluptas quae sed qui et maiores earum aliquam. Quisquam sint temporibus adipisci.Culpa iure omnis totam est eaque quod provident praesentium qui. Est debitis voluptas tenetur asperiores cum ut. Aut impedit quos ut sapiente quia temporibus ipsa magnam architecto. Veniam ut aperiam numquam occaecati cum deserunt porro et.","2018-08-20"
5039,55,2912067,"Consectetur et commodi ducimus aut necessitatibus architecto. Recusandae aut reiciendis. Cupiditate impedit asperiores iure rem nesciunt omnis vero at. Id ullam quo et asperiores.Magnam aut qui. Id quod sit nobis autem voluptatibus. Et quo assumenda tempore non ut deserunt occaecati voluptatem. Error quam reprehenderit quo et sapiente neque.","2018-08-20"
5040,50,2912067,"Sunt beatae itaque. Incidunt molestiae reiciendis accusamus. Odio aliquid quisquam doloribus.Soluta dolor eum veniam autem doloremque. Mollitia deleniti reiciendis consequatur qui deserunt tenetur dolore fuga. Quod esse dicta voluptates aliquam aperiam maiores voluptatem. Quia nobis atque qui qui veritatis iure. Sint tenetur praesentium. Fuga tempore omnis omnis.","2018-08-20"
5041,25,2912067,"Fugiat rerum impedit ut non laudantium sapiente explicabo. Possimus est beatae laudantium et tempora. Ab voluptas officiis impedit iusto. Maxime omnis odit est exercitationem sed impedit. Accusamus vel nihil dolores veritatis.Praesentium velit nostrum sed omnis et provident reprehenderit recusandae. Quo non tenetur voluptatem earum ex eius perferendis. Optio maxime et quo quia. Non dolores possimus non. Qui laudantium mollitia laudantium eaque.","2018-08-20"
5042,55,2912067,"Quia et qui et eaque. Vero corporis minima nemo quia non nam non rem in. Blanditiis enim quasi provident et. Consequatur molestias eaque et labore repellat aut dolores. Quod blanditiis non.Voluptatem ut odit hic dolores dicta. Magni aut architecto illo veritatis. Sint molestiae ipsa voluptas. Ut dolores sit. Incidunt sint ducimus possimus. Vero quisquam deserunt est corporis exercitationem quidem tempore.","2018-08-20"
5043,67,2912067,"Atque doloribus ut architecto explicabo assumenda quae eum suscipit. Occaecati qui qui ducimus aut. Et exercitationem dolores est eum ut molestiae qui ducimus. Quis saepe qui.Ut minima qui vero. Dolorem vitae vel eum porro mollitia vero et. Dolor inventore quo. Sed ut omnis praesentium et velit et nostrum. Aspernatur ratione occaecati porro molestiae explicabo placeat magnam saepe. Soluta dignissimos molestiae beatae consequatur voluptatem odio voluptatem voluptas sed.","2018-08-20"
5044,98,2912067,"Dolorum ex officiis delectus. Maxime reiciendis a sunt et suscipit cum. Aperiam est non et quo et. Harum aut accusantium asperiores autem aspernatur nulla. Non labore cumque quis voluptatum. Laborum dolor at magni quo iure consequatur adipisci repellendus sed.Ipsam vitae recusandae quis est. Iusto ut dolores nostrum qui nemo dignissimos et dicta. Id possimus fugit fuga qui in explicabo. Optio ut in nemo laboriosam non accusantium. Nam beatae eveniet ab velit dolores ea.","2018-08-20"
5045,57,2912067,"Dicta suscipit sed omnis accusamus. Et illo voluptatem animi quis sit. Hic non ut at ut sunt doloremque.Veniam id molestiae porro maxime cum quos eius ut laudantium. Dolor error velit itaque est modi quo aut consequuntur ut. Provident ex aspernatur sint ipsum repellat ratione repellendus.","2018-08-20"
5046,35,2912067,"Sunt laborum reiciendis eius unde. Odit dicta voluptatibus vel laborum aut vero. Ea corporis soluta minus ut ut modi. Reprehenderit ducimus consequatur non.Magnam vitae voluptatem labore nihil odit. Excepturi quibusdam ut veritatis est distinctio et nostrum optio. Facilis impedit neque numquam aut.","2018-08-20"
5047,28,2912067,"Quis voluptatem quis laborum voluptas consectetur et. Nesciunt voluptatem cum laboriosam quisquam enim consequatur. Consequuntur voluptatem et nam fugit impedit ea animi esse nobis. Ipsum velit excepturi. Commodi dolores et nisi praesentium sint. Qui quasi sit possimus odit omnis beatae harum cupiditate.Eveniet est veritatis assumenda et veniam ipsa. Amet rerum animi vel ipsa neque. Suscipit sint enim est accusamus. Recusandae dolorem et ad ex necessitatibus error. Sed excepturi corrupti dolor.","2018-08-20"
5048,57,2912067,"Libero quidem ad et. Sit repellat dolores odio aperiam non molestiae natus vero. Qui unde provident sint repellendus esse sed velit autem. Et voluptatem a. Commodi qui dignissimos vero. Aut ipsa ipsa quis sed similique.Dolor aliquid qui ipsam velit voluptatem modi tempore. Voluptatum sit eum hic nesciunt. Ratione praesentium et beatae illo et est et aperiam. Debitis corrupti enim cupiditate et amet accusantium fuga.","2018-08-20"
5049,69,2912067,"Suscipit et consequatur odit nam. Sunt nisi nisi eaque ab rerum nihil officia. A unde neque qui beatae. Veniam ab sed. Deleniti neque molestiae corporis maxime aliquid nobis quisquam. Ut velit iste ut explicabo culpa.Qui possimus in. Sint qui dignissimos. Nam laborum qui accusantium fugiat labore. Facilis omnis ea ut odio qui quia error ut culpa. Quasi quis eos adipisci amet cumque fugiat dolore nobis. Quasi nostrum deleniti qui.","2018-08-20"
5050,89,2912067,"Consectetur nam consequatur aut aut quia ratione nesciunt quo. Voluptate expedita culpa error minus sunt. Corrupti repellat ipsam voluptas iure et explicabo. Et tempora autem aut numquam. Quia debitis est sunt nisi illum qui. Non voluptas maiores.Nobis in voluptate voluptatem sint quaerat aut sed aut suscipit. In aliquid cupiditate placeat voluptatem perspiciatis perspiciatis alias. Optio quia sint quos minima odit est. Ut numquam voluptas perferendis quia corporis. Rerum eos iusto minus pariatur veniam voluptas porro iusto. Quis quaerat sunt alias et.","2018-08-20"
5051,82,2912067,"Possimus rerum nobis ipsa quo sit ut. Officiis optio nihil. Nemo quidem dignissimos in et voluptatem quaerat quidem ad. Aut ipsum consequuntur sit culpa provident est. Quisquam voluptas doloribus ducimus.Doloribus et sit quis hic voluptatem quis et ipsum. Eaque ea et voluptatibus nam et modi odio magnam. Deleniti quia soluta excepturi vel et qui in quis et. Neque culpa aut eos. Ab et aut sunt. Excepturi et exercitationem quibusdam quam nesciunt voluptatem.","2018-08-20"
5052,38,2912067,"Sit laborum voluptate et neque. Ea consectetur nihil aliquam quas velit et. Autem corporis qui saepe exercitationem pariatur dolores perspiciatis hic. Qui esse ut est. Laborum quia eum qui earum est necessitatibus officiis.Fugiat possimus officia architecto quos error est qui pariatur officia. Alias blanditiis fuga veritatis possimus alias eaque. Est delectus nihil perspiciatis esse eius inventore voluptatibus rem est. Aliquam laboriosam quis vero sit vel commodi necessitatibus vel.","2018-08-20"
5053,63,2912067,"Et non ratione expedita optio consequatur necessitatibus modi laboriosam error. Ducimus reprehenderit omnis et voluptates maxime beatae illum distinctio omnis. Dolore impedit eum numquam velit. Aut alias tenetur iusto officiis quisquam corporis fuga tenetur aspernatur. Eos labore reprehenderit.Tenetur et ut natus hic consequuntur. Modi ullam nobis est sed molestias voluptatem. Neque perspiciatis dolor asperiores sunt rerum asperiores similique non. Rerum quas illo facilis vel itaque doloribus suscipit similique.","2018-08-20"
5054,44,2912067,"Nesciunt quia esse dolorem dolores consequuntur eos. Dolorum consequatur corporis ex eos consequuntur occaecati voluptatem non neque. Culpa sed id consectetur alias consequatur itaque animi quia enim.Sunt impedit dicta laborum architecto id quia quis minima. Rem omnis sed assumenda iure deserunt iste nihil aut. Quia praesentium qui maxime quibusdam. Qui provident corrupti sit commodi neque. Totam accusantium iure voluptas. Voluptatibus consequatur est nemo vel.","2018-08-20"
