"id","user_id","listing_review_id","review_content","review_time"
4462,43,2912060,"Corporis doloribus aperiam qui voluptatem cumque ut alias. Sunt expedita id ullam rem dignissimos iure consectetur molestias eos. Modi in nisi enim a. Esse ipsum reiciendis et unde esse rerum. Sit facilis hic alias voluptatem reprehenderit eius et. Aperiam odit vitae.Rerum est velit quis delectus. Id totam qui illum aspernatur harum quod dolorem id amet. Sit laborum et aut quia explicabo exercitationem maxime est non. Ut distinctio fugiat.","2018-08-20"
4463,1,2912060,"Tempore quia perspiciatis et architecto nesciunt maiores itaque. Et cum officiis culpa perferendis officiis recusandae. Temporibus quas molestiae fuga. Odit fuga molestiae est sed reiciendis quo.Fugiat nihil iusto assumenda ut rem sint ipsum commodi. Minus nam quaerat nihil. Ea sed alias eos expedita cumque non voluptates dolor. Illo ea quia asperiores. Itaque quia nisi.","2018-08-20"
4464,91,2912060,"Quo nemo nostrum. Architecto accusamus fuga laborum possimus. Neque vel eligendi et dolor porro voluptas expedita beatae alias. Quibusdam nisi cupiditate. Doloremque rerum officiis quia consequatur molestias est sunt. Rerum ipsam ipsum non enim illo consequuntur voluptatem.Numquam et vel nesciunt vel aut accusamus veritatis. Sunt quaerat consequuntur quo quo omnis cum officiis. Doloribus non vel necessitatibus dolor exercitationem quisquam. Perferendis enim ea est nisi. Et id sit quasi dolores et velit vero ad.","2018-08-20"
4465,32,2912060,"Itaque voluptatibus perferendis vero id quae rerum ut. Placeat rerum tempore unde. Fugiat facere vel voluptatem quaerat totam laudantium id aut sit. Incidunt non cupiditate consequatur quo est ipsum ut unde.Porro omnis culpa debitis. Quisquam eaque vel accusamus hic. Nihil pariatur tempore est accusantium iste eaque.","2018-08-20"
4466,42,2912060,"Distinctio quia iusto ab ut explicabo autem qui ipsam. Tenetur ea magnam magni quam est ipsum. Reiciendis omnis nemo minus tempora aut.Quia voluptas dolore non maxime rerum rerum voluptas rem et. Minima molestiae quia quis et. Expedita enim laborum dolore voluptatem. Molestiae odio voluptas sunt. Non consequatur corrupti rerum.","2018-08-20"
4467,95,2912060,"Sunt nihil voluptatibus enim iste. Quo eum rerum aspernatur voluptas. Ducimus omnis quia reiciendis. Sed quo dolores. Magnam sed nesciunt quasi distinctio mollitia ea in. Aut nostrum veniam nam beatae magnam expedita.Voluptas ipsum optio. Enim et expedita. Fuga sed quis dolor. Et quis qui incidunt nihil nesciunt et eum ut. Exercitationem error quis molestiae ab facilis illo esse. Alias soluta quisquam ut sit est enim minima.","2018-08-20"
4468,64,2912060,"Est sed perferendis expedita unde eligendi laboriosam vel. Vel asperiores et maxime est dolorum modi. Accusamus rerum libero fugit eum dolor sed nam animi. Et excepturi necessitatibus ab quae et velit provident. Odit dolorem tempore dolores non.Tempora est facilis. Voluptate quasi praesentium dolorem inventore autem. Dolores reprehenderit est. Quia est porro neque magni non sit eius repellendus.","2018-08-20"
4469,57,2912060,"Officia quis dolores dolorem sapiente beatae occaecati. Voluptate perspiciatis et et quasi et eligendi nihil. Temporibus sunt illo consequatur modi non.Aut aut possimus. Tempore velit laborum aspernatur autem. Ut illo est iure praesentium dolores harum. Optio nam unde architecto.","2018-08-20"
4470,21,2912060,"Rem rerum laborum assumenda sit ut et qui iure. Dolor est quia molestias aperiam. Et atque nam molestiae ipsum sapiente quis quod ratione at. Delectus doloremque tempore consectetur aliquid totam voluptatem velit tenetur magni.Assumenda quia et sunt dolores. Voluptatem suscipit aliquam ratione consectetur dolor molestiae laborum. Cum aut natus.","2018-08-20"
4471,43,2912060,"Culpa qui voluptatem cupiditate. Aut consequatur ut officia voluptatem reprehenderit velit. Natus sit ut. Voluptatum sed consequatur natus sequi. Consequatur laborum quis tenetur corrupti est at.Ad molestiae est. Non consequatur rerum voluptates enim commodi porro provident esse ipsa. Iure eos id eos consequatur non.","2018-08-20"
4472,36,2912060,"Autem mollitia aspernatur delectus perspiciatis. Culpa perferendis tempore sit magni at. Beatae omnis rerum enim reprehenderit. Autem eum ratione sunt laborum sequi amet eveniet. Neque quia id dolores vitae. Aperiam culpa non voluptas reiciendis blanditiis.Dolores qui sit veniam magni explicabo assumenda est saepe. Et harum est. Qui laudantium error sunt eveniet consequatur quia vero vel iusto.","2018-08-20"
4473,6,2912060,"Porro sed corrupti et. Aut consequatur earum. Velit nihil tempore dolore sapiente.Quia necessitatibus illum aliquid qui occaecati qui occaecati. Omnis quidem similique molestias laboriosam fuga sit sit pariatur. Maxime vero minus non voluptatum.","2018-08-20"
4474,61,2912060,"Corrupti error dolores. Enim quia quo ut. Voluptatum fuga vel velit dolores et modi facilis. Recusandae eum molestias rerum dolor et consequatur. Eos omnis quia consequatur ea fuga veniam et minus.Porro non eius molestiae et cupiditate. Sed reprehenderit similique consequatur exercitationem aperiam ut voluptatem. Quas ullam velit. Molestias quo non aspernatur. Sequi tempore et eos ex sequi.","2018-08-20"
4475,11,2912060,"Maxime iusto praesentium earum quo beatae animi. Quisquam quis autem delectus nostrum atque sed sunt impedit voluptatem. Omnis neque facilis nostrum tempore molestiae non. Natus ut eos nihil neque sed. Dolor velit consectetur sint dolorum ullam magnam corrupti aut molestiae.Et mollitia fugit. Expedita et temporibus eum ut est. Laborum sapiente ea. Molestias iusto temporibus quia ad voluptas aspernatur iusto. Magnam ex quia ducimus at soluta quo. Omnis asperiores minus qui vitae.","2018-08-20"
4476,30,2912060,"A voluptate rerum. Aut aut molestiae a laboriosam sint nobis deleniti. Iusto alias quo error et. Officiis aut quas sed. Velit qui magnam enim tenetur. Rerum in culpa cum quisquam nesciunt.Necessitatibus est quisquam iusto quaerat suscipit. Dignissimos esse maiores. Delectus libero eum reiciendis et perspiciatis. Optio aspernatur sed fugit magnam libero facilis illo molestias. Ut voluptate non.","2018-08-20"
4477,87,2912060,"Cum totam occaecati quas porro aut aspernatur quis nesciunt sapiente. Aut deserunt perferendis nostrum error facere. Error est cum rem. Odio sed atque qui.Possimus dicta sunt. Error illo velit et in qui deserunt cum dolor. Deserunt nisi sint et. Aperiam placeat natus perferendis et qui ipsa vel sit ut. Ratione eum harum omnis soluta odio rerum neque. Qui est sint qui velit quos ad.","2018-08-20"
4478,11,2912060,"Aliquid earum recusandae maxime quis. Aut non aut. Nesciunt mollitia tenetur quia consectetur quibusdam dolore alias. Neque nihil ut distinctio expedita qui eum repudiandae.Est ipsum et est aut aut ratione perspiciatis. Sint et sit et maxime. Nostrum qui consequatur enim et accusantium ipsa mollitia modi. Repellendus ut aut fugit dolorum id. Autem mollitia error voluptatibus facere ex ad.","2018-08-20"
4479,49,2912060,"Eaque nobis quo quaerat libero consequuntur distinctio laboriosam quam accusamus. Dolore autem nobis sapiente est eligendi ratione velit accusantium quo. Ad corporis cupiditate iusto unde explicabo consequuntur ratione quis quia.Consectetur incidunt maiores aspernatur quia non debitis. Rerum nisi veniam. Vel nisi consequatur doloremque. Recusandae debitis omnis incidunt. Inventore eligendi unde totam exercitationem dolores quia. Ipsam ut aliquid ullam qui possimus.","2018-08-20"
4480,23,2912060,"Odio ut voluptatem labore quia saepe qui praesentium non. Alias quisquam reiciendis sint inventore natus illum ut. At ut quis quod.Officia tempore dolor placeat omnis delectus repudiandae quasi eaque. Qui consequatur minus aut ab. Facere perferendis et. Unde possimus ipsum nemo. Nesciunt tempore quidem rerum eligendi delectus ex et non cumque. Vitae natus officiis cumque occaecati.","2018-08-20"
4481,13,2912060,"At praesentium voluptates accusantium iure. Sequi aut ut cumque eos quod et sunt placeat quia. Natus facere quia reiciendis. Voluptatem corrupti non sunt eveniet cum odit.Nam ut ut. Aut odit modi labore saepe similique autem necessitatibus repellat ut. Sint commodi deserunt voluptate et voluptatem sit. Aliquid cupiditate repudiandae doloribus neque cum aut. Alias molestiae aut inventore fugiat odio sed id. Repudiandae voluptatem est fuga ducimus.","2018-08-20"
4482,9,2912060,"Et deleniti qui tenetur ex. Enim ea dolor. Rerum accusantium autem consequuntur repellendus inventore exercitationem dolore velit. Nostrum odio molestiae asperiores.Vel iste pariatur. Dolore enim aliquid molestias iure culpa. Dolore id fugiat eum vero ut id magni ullam. Facilis eos id in at optio aspernatur. Ex qui aut.","2018-08-20"
4483,35,2912060,"Culpa occaecati itaque. Voluptas voluptas consequuntur saepe laboriosam voluptas. Tempore aut et quo maxime. Quis provident aut similique et optio voluptatibus eligendi.Qui occaecati ea dolore dolores. Consectetur quia et. Mollitia omnis sint optio illum sed omnis rerum quod dolor. Nobis rem aut.","2018-08-20"
4484,3,2912060,"Quis architecto totam aut et sed aut perspiciatis. Fugit velit quisquam. Aliquid enim quaerat est qui at. Laboriosam et dolores qui nam quae magnam quo reprehenderit. Dolore placeat suscipit sunt. Magnam quod consequatur quibusdam.Non illo eveniet tempora. Quis officia perferendis eius ipsum qui. Laudantium deleniti perspiciatis eligendi temporibus soluta. Porro ut molestias placeat velit ratione quia voluptatem. Vel ad amet doloremque molestiae.","2018-08-20"
4485,59,2912060,"Ratione aut eveniet dolore sed. Numquam architecto ut qui facere provident qui labore. Ducimus ex harum. Voluptatum voluptatem asperiores quos voluptatem et nostrum earum corrupti ratione. Quia corrupti velit commodi ut.Eum eveniet eum debitis nihil ut voluptatem rerum fuga molestias. Sed provident voluptas corrupti et voluptates quibusdam corporis labore. Temporibus quia ipsum delectus quia earum. Doloremque in facilis ut minus incidunt excepturi. Velit cum id et facere esse debitis possimus veniam. Expedita qui exercitationem officia ut incidunt numquam.","2018-08-20"
4486,67,2912060,"Animi modi commodi illo facere. Molestias numquam similique quos. Aut cum voluptatem suscipit voluptatem magnam eum ipsa et.Id aut et voluptatum non reprehenderit ex qui ex optio. Quos error sint laborum aut facilis deserunt. Enim dolorem rerum ipsa. Mollitia perferendis qui numquam quia consequuntur. Impedit libero ut perspiciatis praesentium a sit. Voluptatem quisquam quis consequatur dolorem qui odio quidem.","2018-08-20"
4487,83,2912060,"Dolorem ut magni. Minima vel omnis natus iste excepturi ratione voluptatem et qui. Illum quia quis non culpa eius earum. Amet sequi recusandae minus nemo ut qui. Enim quaerat id quae recusandae possimus possimus consequatur sit. Id soluta non.Totam sunt omnis velit nostrum dolorem molestiae voluptas voluptas fugiat. Aut ut accusantium vel est in est repellendus. Velit voluptates ab inventore et quibusdam possimus error nulla.","2018-08-20"
4488,20,2912060,"Quia nobis veniam consequatur repellendus. Et ut neque beatae doloremque facere veniam mollitia recusandae. Minima et nihil et quos et corrupti. Quis aut illum facilis maiores et quisquam quo laboriosam ut.Quia enim occaecati nobis. Et facere eveniet excepturi debitis voluptas. Non consectetur nam vero ut. Ab explicabo veniam voluptatibus numquam. Sequi est ut ad eveniet dolorum officiis sed minus.","2018-08-20"
4489,70,2912060,"Iusto repellat soluta. Est velit asperiores maxime non tempore ipsam et modi. Quia numquam tempora aut reprehenderit est et facere voluptatem illo. Iusto libero est nobis tenetur aut dolor consequatur et sapiente. Officiis est repellat aut doloribus.Ipsa praesentium dolores explicabo maxime dolores nisi voluptatem sed. Eveniet non vero voluptas. Commodi numquam praesentium. Illo omnis et.","2018-08-20"
4490,89,2912060,"Corrupti illo inventore vitae odio atque nisi quia autem est. Nihil voluptas excepturi architecto praesentium est tempore facere asperiores. Similique dolor voluptatem aspernatur consequatur consequatur eum. Nulla aliquam et aut illum ad molestiae assumenda iusto.Qui sint nobis voluptatem. Praesentium nemo quaerat rerum cupiditate sed in ex quasi. Et ipsum quis.","2018-08-20"
4491,33,2912060,"Voluptatem tenetur tempore possimus atque et qui a. Perferendis consequatur et error. Porro placeat vel et amet vero facere ut expedita.Mollitia pariatur ut blanditiis. Tenetur voluptatem labore. Nihil vitae autem.","2018-08-20"
4492,22,2912060,"Ea distinctio nisi tempore numquam omnis explicabo ea id atque. Quasi aspernatur omnis placeat enim nisi doloribus. Qui voluptas molestiae placeat enim reiciendis pariatur. Consectetur molestiae debitis.Porro et ut molestiae nulla quo architecto. Reprehenderit aut optio aut sunt. Fuga culpa dolorem perferendis natus ullam quia enim ea alias.","2018-08-20"
4493,74,2912060,"Numquam ad possimus qui. Sunt sunt perspiciatis culpa sit dicta possimus sapiente. Facere minima corrupti quas. Voluptatem aut est.Voluptatem sapiente quo perferendis eos fugit rerum asperiores porro. Quidem voluptas consequatur reprehenderit est itaque ad praesentium magnam. Autem tempora omnis. Aut ut molestiae a quibusdam repudiandae ea. Voluptatem esse minus tempore quia.","2018-08-20"
4494,51,2912060,"Dicta nihil sequi voluptatem. Dolorum cumque voluptatem cum quo nemo. Aut voluptates modi aperiam.Magnam esse dolor numquam. Ut natus molestiae blanditiis quo soluta quidem soluta. Aut officia dignissimos tempora iure. Repellat quae dolor dicta qui nulla ullam dolorum voluptate sed.","2018-08-20"
4495,68,2912060,"Vitae qui aspernatur mollitia et quis doloribus aut temporibus. Laudantium alias incidunt est facilis pariatur vitae earum. Nam molestiae sint blanditiis eveniet est. Reprehenderit dolores sed eveniet voluptas. Quod eos deleniti commodi consequuntur explicabo. Laboriosam doloremque id in non.Qui natus repudiandae reiciendis cupiditate. Eos molestias libero modi maiores. Ut est labore quia officiis dolorem similique consequatur facere similique. Molestias qui quia voluptate corporis. Error rem est ut voluptatem eos iusto assumenda dolore. Necessitatibus et veritatis quod dignissimos ut fugiat ea.","2018-08-20"
4496,30,2912060,"Consequuntur nihil quos et provident accusantium perspiciatis perspiciatis ut accusantium. Corporis adipisci aut dolorem quos voluptatum quia. Corporis voluptatem est nobis corrupti sint et perspiciatis laborum. Ex mollitia et est quaerat. Repudiandae qui voluptas neque non. Et in libero et rerum excepturi aut ut quibusdam.Aspernatur odio exercitationem adipisci ex laborum tempore. Necessitatibus reiciendis dolorem sit ut eaque aut veniam. Qui nulla expedita minus reprehenderit quod. Aut eveniet quam quibusdam sit quam aut maxime aut qui. Temporibus voluptatem corrupti reiciendis saepe libero qui explicabo fuga autem.","2018-08-20"
4497,90,2912060,"Adipisci consequatur quia. Quia illo et at et ullam. Ut sint dolorem et labore enim debitis aut reiciendis voluptatem. Corrupti aliquam itaque id ullam porro qui et est. Dolor cum eos qui qui illum quibusdam quisquam. Officia praesentium recusandae amet.Ad odio nisi qui voluptatem quidem. Ea magni mollitia porro enim quis enim. Modi beatae et voluptatibus in doloribus.","2018-08-20"
4498,3,2912060,"Dolore cumque recusandae reiciendis. Alias blanditiis non error repudiandae id ut sint veniam. Dolor in dicta dolore eligendi est quo dolores. Blanditiis incidunt assumenda.Nemo consequatur magnam placeat voluptatum unde veniam architecto ducimus debitis. Est sint voluptatem itaque magni. Placeat odit enim qui nihil. Quibusdam dignissimos rerum repudiandae enim odio accusamus praesentium eos non.","2018-08-20"
4499,75,2912060,"Ipsum a deserunt porro aperiam consequatur et sint ad. Ut dolores occaecati. Et est molestiae fuga rerum nesciunt rem vitae. Ut facere ut ut. Quam odio quos.Et laudantium harum est. Ab voluptatem in aut. Facere odit enim dolorem aperiam nesciunt omnis aperiam. Et ut dolorem eum. Odit quasi aut.","2018-08-20"
4500,21,2912060,"Laborum cumque molestiae voluptatem aperiam quasi dolor. Consectetur nemo necessitatibus. Eos voluptas architecto earum qui voluptates quibusdam fugiat nisi enim.Eos est ullam corporis perspiciatis soluta qui optio et perferendis. Facere earum saepe repudiandae voluptatem sed. Harum excepturi impedit vel odio illo est. Itaque est voluptatum doloremque rerum maxime porro sunt. Occaecati recusandae consequuntur dicta. Et delectus voluptatem dolorum accusamus culpa nobis repellat illo.","2018-08-20"
4501,56,2912060,"Occaecati consequatur cumque occaecati. Quo tempore molestias a nobis temporibus. Rem earum omnis eos dolore. Iusto iste esse qui sapiente exercitationem. Voluptatem perspiciatis cumque dolores vero rerum voluptatibus laborum harum aperiam.Dignissimos voluptas repellat sapiente voluptate laudantium consequatur soluta vero accusantium. Et delectus temporibus. Voluptatum eveniet rerum quam et repellendus omnis molestiae. Et corrupti velit accusamus magnam velit hic voluptas.","2018-08-20"
4502,87,2912060,"Aut voluptate aut minima beatae laudantium ducimus cum eum. Sapiente autem vitae et est aperiam modi officia quia. Quas harum magni quo necessitatibus voluptate. Assumenda qui nostrum dolorum aut eos vitae minus.Delectus placeat ut. Et enim voluptatibus quo. Voluptatem eum et excepturi delectus.","2018-08-20"
4503,4,2912060,"Ullam beatae provident velit consequuntur. Voluptates delectus quas tempora. Eos autem natus illum nostrum officia. Distinctio dolores et doloribus vitae nihil veniam sit.Aut rem ut quas. Laboriosam atque molestiae. Voluptate et facilis est velit natus et. Est placeat dolorem et minima in voluptate nihil amet.","2018-08-20"
4504,95,2912060,"Nesciunt eum recusandae et. Et nesciunt temporibus consequuntur. Ut odit aliquam eligendi. Nulla velit ratione soluta aut quam labore.Aut laboriosam iste velit repudiandae voluptatem quos ut ipsa. Enim dolores libero deserunt non recusandae explicabo earum eum blanditiis. Temporibus similique aut cupiditate sed temporibus. Natus sint quia nobis ut alias consequatur modi explicabo.","2018-08-20"
4505,60,2912060,"In et quia ut cumque dolorem fuga aliquam rerum adipisci. Vel et veniam qui sint dolor deserunt sint. Unde tenetur voluptas veniam sequi non praesentium laborum. Sint ad eos quod earum velit qui.Veniam totam asperiores eligendi possimus pariatur debitis. Pariatur sunt est sed repellendus fugit. Necessitatibus eos doloribus. Soluta odit labore culpa dolores enim nihil.","2018-08-20"
4506,21,2912060,"Itaque voluptatibus modi excepturi. Qui necessitatibus eos. Qui ducimus voluptatum omnis libero ut corporis fuga. Cumque modi quos. Molestiae voluptas nam libero reprehenderit.Ut fuga sed ex tempora molestiae aut. Et omnis non doloribus et similique fugit rerum veniam et. Non neque sit et ut sed quia cumque.","2018-08-20"
4507,16,2912060,"Mollitia distinctio porro quibusdam consequatur. Numquam et dolorem dolores praesentium. Porro provident quo accusantium sit enim autem eaque non. Perferendis omnis quam expedita consequuntur possimus illum. Facilis porro et aut excepturi eius.Autem aut ut impedit explicabo accusantium saepe ut. Minima non quasi ut quia distinctio et natus. Sed porro dolores ut accusantium molestiae. Nisi dolore provident eveniet voluptatem cum praesentium.","2018-08-20"
4508,56,2912060,"Maxime quia quia at beatae. Dolore ipsum molestias. Labore pariatur expedita nemo laudantium est aut provident voluptas nam.Hic ea cupiditate perferendis quis voluptate atque ipsam commodi. Rerum rerum dignissimos qui. Dolores quidem sed qui recusandae.","2018-08-20"
4509,99,2912060,"Recusandae suscipit sit sequi commodi excepturi sed in. Laboriosam ut incidunt non velit atque ut aspernatur consequatur mollitia. Quasi et qui aut omnis laudantium deserunt culpa sed. Ad animi sed sed incidunt aperiam ut adipisci. Voluptatem officia nisi eius at quae quis a quia.Non commodi repudiandae architecto non veritatis sequi. Quae nulla iusto et voluptatibus dolores ea deserunt maxime. Sit laborum labore eum aut incidunt id sit tenetur odio. Cum esse ipsum. Minus rem hic sint voluptatibus amet et autem.","2018-08-20"
4510,41,2912060,"Minima architecto et est ut dolores aspernatur voluptatem soluta. Quos occaecati perferendis est quia quos inventore non modi. Quia ut sequi et et consectetur iure autem.Repellendus culpa occaecati molestiae possimus eius et reiciendis. Sequi qui tempore sit aut voluptatem nisi vitae et qui. Sed aspernatur optio voluptas rerum sed excepturi sint ut facere. Distinctio voluptatem ut. Autem voluptatem dicta vel non natus et. Eos sed qui in tempora et aperiam eum.","2018-08-20"
4511,26,2912060,"Eaque rerum et molestiae ratione nesciunt ut quia. Eum nulla et earum ut tempore vel sed qui. Et exercitationem dolorem deleniti. Ea voluptas sed. Mollitia non qui omnis est accusamus dolores assumenda quia.Aperiam magnam dolorem et est eius reprehenderit. Corrupti fuga molestiae dicta commodi itaque et quibusdam ab. Ut provident voluptatem eligendi cum autem illo voluptatem harum vel.","2018-08-20"
4512,36,2912060,"Est sint nihil dolores atque qui minus distinctio adipisci dicta. Recusandae qui neque fugiat occaecati dolore distinctio et qui est. Est et est ipsam earum. Accusantium illo illum.Quos et ad eveniet velit corrupti. Dolorem iure enim illo nam et reiciendis commodi. Sed dignissimos itaque laboriosam rerum voluptatem. Vel rerum magni nihil nisi et et amet. Aut et molestias labore vero saepe alias repellendus perspiciatis unde.","2018-08-20"
4513,74,2912060,"Debitis dolore vel sit voluptatem corporis. Dolor nihil placeat ducimus nisi ab dolore. Provident sed consectetur. Quia totam minus. Odio quisquam aliquid quia enim autem commodi placeat natus iste. Temporibus vero doloribus officiis illo ut omnis.Provident corrupti provident laboriosam distinctio temporibus aut. Et omnis eum sunt veritatis et. Voluptatibus omnis mollitia consequuntur modi quidem. Eveniet et est quas id temporibus iusto sed quos. Quae et ut ut provident rem.","2018-08-20"
4514,97,2912060,"Dolores sequi dolore voluptatem alias quis perspiciatis hic eum. Repudiandae beatae fuga possimus qui consequatur commodi nihil ullam. Sapiente est pariatur velit veniam et eos et aut. Ex est nihil et molestiae alias. Pariatur harum fugit illum commodi vero quas inventore in. Incidunt nisi maxime quibusdam.Iste natus ex ad aut. Repudiandae velit reprehenderit et soluta aut non ipsum non porro. Eveniet voluptates in error perferendis. Et fugiat quo est. Eaque quia vel dolorum officia maxime aut sed quasi. Non aut iste quasi beatae possimus nisi sed officia qui.","2018-08-20"
4515,97,2912060,"Suscipit molestiae quasi. Beatae voluptatem dolore rerum molestias numquam aut eaque ducimus deserunt. Labore aspernatur quos. Mollitia illo quae labore vero esse numquam rerum qui.Est laudantium provident nihil culpa quia modi earum. Sunt omnis eveniet quo ex vel. Aut dolor iste aut ipsam sunt omnis rerum doloremque.","2018-08-20"
4516,1,2912060,"Placeat neque optio qui ut. Aut quam delectus aut sint delectus. Ab nulla minus saepe nihil. Voluptas assumenda qui.Temporibus quibusdam incidunt ut. Rerum nemo ut aut beatae soluta ea. Earum nostrum reprehenderit id id voluptate error est.","2018-08-20"
4517,34,2912060,"Omnis repudiandae quasi sapiente neque eum. Qui placeat asperiores quae fugit est odit. Natus nostrum voluptas. Ut qui quo commodi eos cupiditate. Fuga qui laudantium tempora sapiente rem.Cum accusamus nostrum. Atque nobis minus vitae officia quis voluptatibus. Sapiente quisquam qui velit aut consequatur qui eum unde.","2018-08-20"
4518,97,2912060,"Incidunt illo iste non atque delectus adipisci itaque est quisquam. Libero in quia deleniti assumenda ut. Qui harum quasi aut nobis dolore deserunt excepturi ut. Excepturi totam quis maiores. Laboriosam suscipit voluptates consequatur.Qui doloribus incidunt occaecati voluptas voluptate. Ut et accusantium laboriosam corrupti quia eum aut autem repudiandae. Accusamus qui reprehenderit similique repudiandae. Aut cum quo iusto doloribus consequatur omnis. Molestiae vero voluptatem.","2018-08-20"
4519,91,2912060,"Doloribus inventore corporis velit voluptas animi ipsum sint excepturi inventore. Cumque hic cupiditate doloribus officiis earum soluta perferendis nihil. Cumque natus quae officiis quis iure et.Est est commodi saepe tenetur quo. Veritatis quos ea et voluptas atque pariatur non est. Minus quae aspernatur totam. Odit quasi consequatur amet dolor in voluptas laborum aut. Nemo dolor in sint ut voluptatibus et facere fuga quos. Ipsa aut animi itaque libero numquam iusto modi.","2018-08-20"
4520,17,2912060,"Aut molestias ab ut et. Nisi nemo deserunt autem esse soluta nihil consequuntur vel. Earum temporibus dolor neque tempore quam ipsum hic nam ipsum. Est voluptas rerum molestiae omnis est. Voluptate impedit totam earum consequatur quasi repudiandae harum quod dolorem.Quibusdam non a architecto doloremque nobis ratione nihil fuga. Nihil libero voluptatem velit. Deserunt ut quam odit. Aspernatur et repudiandae non enim fuga. Reiciendis qui ex laboriosam iste aut ut qui.","2018-08-20"
4521,50,2912060,"Suscipit alias laboriosam quaerat repudiandae iste est voluptatem amet. Omnis est ut suscipit rerum blanditiis vel labore officia deleniti. Veniam eligendi repudiandae iure. Magni sunt unde ullam nihil vitae placeat id. Ab aliquam atque atque sit animi necessitatibus cum culpa sed. Qui amet autem aut.Qui placeat doloribus. Rem consequatur possimus. Tempora repellat dignissimos quibusdam est esse magni sit. Ut animi dolor animi.","2018-08-20"
